LAPSYD	PHOIBLE_REF	PHOIBLE_KEY
Doty, Christopher S. & Susan G. Guion. (to appear). Tolowa peak pitch alignment: Perspectives from an Autosegmental-Metrical framework. Proceedings of the 33rd Annual Meeting of the Berkeley Linguistics Society (2007). (abstract at http://linguistics.berkeley.edu/bls/past_meetings/bls33/abstracts_web/Doty.pdf. Full version not seen)		
Douglas, W.H. 1955. Phonology of the Australian aboriginal language spoken at Ooldea, South Australia, 1951-1952. Oceania 25: 216-29.	Douglas, Wilfrid H.. 1955. {Phonology of the Australian Aboriginal Language Spoken at Ooldea, South Australia, 1951-1952}. 25. 216--229	Douglas1955
Douglas, W.H. 1964. An Introduction to the Western Desert Language (Oceania Linguistic Monographs 4, revised ed.). University of Sydney, Sydney.	Douglas, Wilfrid H.. 1964. {An Introduction to the Western Desert Language}. Sydney. The University of Sydney, Australia. 4	Douglas1964
Dow, F.D.M. 1972. An Outline of Mandarin Phonetics. Faculty of Asian Studies, Australian National University, Canberra.	Dow, Francis D. M.. 1972. {An Outline of Mandarin Phonetics}. Canberra. Faculty of Asian Studies, Australian National University	Dow1972
Doyle, Aidian. 2001. Irish. Lincom Europa, München & Newcastle.		
Du Feu, Veronica. 1985. The phonology of Rapanui. University of East Anglia Papers in Linguistics 21-22: 35-55. --- Du Feu, Veronica. 1996. Rapanui. London: Routledge. --- Weber, R. and N. Weber. 1999. Review of Rapanui, Veronica du Feu. Anthropological Linguistics 41:142-6		
Duanmu, San. 2007. The Phonology of Standard Chinese, second edition. Oxford University Press, Oxford.		
Duff-Tripp, Martha. 1997. Gramática del idioma yaneshaʼ (amuesha) (Serie Lingüística Peruana 43.) Ministerio de Educación and Instituto Lingüístico de Verano, Lima. Available at http://www.sil.org/americas/peru/show_work.asp?id=38254		
Duff-Tripp, Martha. 1998. Diccionario Yaneshaʼ (Amuesha)—Castellano (Serie Lingüística Peruana 47). Ministerio de Educación and Instituto Lingüístico de Verano, Lima. Available at http://www.sil.org/americas/peru/show_work.asp?id=38931	"Duff-Tripp, Martha. 1998. Diccionario yanesha' (amuesha)-castellano. Lima. Instituto Ling{\""u}{\'\i}stico de Verano. 11--12"	1838_Duff-Tripp1998
Dunn, John Asher. 1970. Coast Tsimshian Phonology. Ph. D. dissertation, University of New Mexico, Albuquerque.		
Dunn, John Asher. 1979. A Reference Grammar for the Coast Tsimshian Language. Canadian Ethnology Service Paper 55. National Museum of Canada, Ottawa.	Dunn, John Asher. 1979. {A Reference Grammar for the Coast Tsimshian Language}. Ottawa. National Museums of Canada. 55	Dunn1979
Dunn, John Asher. 1995. Sm'algyax: a reference dictionary and grammar for the Coast Tsimshian language. University of Washington Press, Seattle, and Sealaska Heritage Foundation, Juneau. (Rev. ed. of: A practical dictionary of the Coast Tsimshian language. 1978, and A reference grammar for the Coast Tsimshian language. 1979).		
Dunn, Michael John. 1999. A Grammar of Chukchi. Ph D. dissertation, Australian National University. (not accessible on-line: under embargo)		
Dunstan, Elizabeth (ed.) 1969. Twelve Nierian Languages. Longman's, London and Harlow. (Chapter on Efik, contributed by T. L. Cook: 35-46).		
Durbin, M. and Seijas, H. 1972. The phonological structure of the Western Carib languages of the Sierra de Perija, Venezuela. Atti del XL Congresso Internazionale degli Americanisti. vol. III: 69-77.	Durbin, Marshall; Seijas, Hayd{\'{e}}e. 1972. {The Phonological Structure of the Western Carib Languages of the Sierra De Perija, Venezuela}. 3. 69--77	DurbinSeijas1972
Dutton, T.E. 1969. The Peopling of Central Papua (Pacific Linguistics, Series B, 9). Australian National University, Canberra.	Dutton, Tom E.. 1969. {The Peopling of Central Papua}. Canberra. Australian National University. 9	Dutton1969
Dutton, Tom E. 1996. Koiari. Lincom Europa, München and Newcastle.		
Dyck, Carrie, Julie Brittain, & Marguerite MacKenzie. 2006. Northern East Cree accent. Available at http://westernlinguistics.ca/Publications/CLA2006/Dyck_Brittain_MacKenzie.pdf		
Dye, Sally Folger. 2008. Bahinemo phonology. SIL Papua New Guinea, Ukarumpa. Available from http://www.sil.org/pacific/png/pubs/928474543398/Bahinemo_Phonology.pdf		
Dye, Wayne (Compiler). 1992. Organized Phonology Data: Bahinemo (Gahom) language. SIL Papua New Guinea, Ukarumpa. Available from http://www.sil.org/pacific/png/pubs/928474542519/Bahinemo.pdf		
Eather, Bronwyn. 1990. A grammar of Nakkara (Central Arnhem Land Coast). Ph D. dissertation, Australian National University, Canberra. Available at https://openresearch-repository.anu.edu.au/handle/1885/132899. Published version Lincom Europa, München, 2011.	Eather, Bronwyn. 1990. A Grammar of Nakkara (Central Arnhem Land Coast). [Canberra]. Australian Natl. Univ.. Australian National University. xvi+498	152615
Ebert, K.H. 1976. Sprache und Tradition der Kera (Tschad). Teil II: Lexikon. Berlin: Dietrich Reimer.	Ebert, Karen Heide. 1976. {Sprache Und Tradition Der Kera (Tschad). Volume 2: Lexicon}. Berlin. Dietrich Reimer	Ebert1976
Ebert, K.H. 1979. Sprache und Tradition der Kera; III: Grammatik. Dietrich Reimer, Berlin.	Ebert, Karen Heide. 1979. {Sprache Und Tradition Der Kera (Tschad). Volume 3: Grammatik}. Berlin. Reimer	Ebert1979
Echeverría, Max S. & Heles Contreras. 1964. Araucanian phonemics. International Journal of American Linguistics 31: 132-135.	Echeverr{\'\i}a, Max S.; Contreras, Heles. 1965. {Araucanian Phonemics}. 31. 132--135	EcheverriaContreras1965
Eckert, Paul, and Joyce Hudson. 1988. Wangka Wiru: A Handbook for the Pitjantjajara Language Learner. Aboriginal Studies and Teacher Education Centre, Underdale, Australia.?also Adelaide: South Australian College of Advanced Education (not seen)		
Edgar, John T. 1991. Maba Group Lexicon. (Volume 13 of Sprache und Oralität in Afrika: Frankfurter Studien zur Afrikanistik). Dietrich Reimer Verlag, Berlin (not seen).		
Edgar, John. 1991. First Steps toward Proto-Maba (With a Historical Note by John E. Lavers) African Languages and Cultures 4: 113-133 (not seen)		
Egurtzegi, Ander. 2013. Chapter 4: Phonetics and Phonology. In Basque and Proto-Basque: Language-internal and Typological Approaches to Linguistic Reconstruction, edited by Mikel Martínez-Areta. Peter Lang, Frankfurt-am-Main: 119-172.		
Ekka, Francis. 1985. Kũṛux Phonetic Reader. Central Institute of Indian Languages. Manasagangotri, Mysore.	Ekka, Francis. 1985. Kurux Phonetic Reader. Mysore. Central Institute of Indian Languages	1754_Ekka1985
El Hannouche, Jamal. 2008. Ghomara Berber. A Brief Grammatical Survey. M.A. Thesis, Leiden University. Available at https://www.scribd.com/document/46042206/Ghomara-Berber-a-Brief-Grammatical-Survey-by-J-El-Hannouche#download		
El Hannouche, Jamal. 2010. Arabic Influence in Ghomara Berber. M.A. Thesis, Leiden University. Available at https://www.scribd.com/document/46039741/Arabic-Influence-in-Ghomara-Berber-by-J-El-Hannouche		
Elderkin, E.D. 1982. Tanzanian and Ugandan isolates. Nilotic Studies. Proceedings of the International Symposium on Languages and History of the Nilotic Peoples, Cologne, R. Vossen and M. Bechhaus-Gerst, editors. (Kolner Beitrage zur Afrikanistik, vol. 10): 499-521.		
Elderkin, Edward D. (1992). Predictable nasality before East African clicks. Afrikanistische Arbeitspapiere 29. 111–129.		
Elfenbein, Josef. 1997. Brahui. In Phonologies of Asia and Africa, Volume 1I. Alan S. Kaye, ed., Eisenbrauns, Winona Lake IN: 797-811	Elfenbein, Josef. 1997. Brahui phonology. Phonologies of Asia and Africa. Winona Lake, Indiana. Eisenbrauns. 2. 797--814	elfenbein1997brahui
Elfenbein, Josef. Brahui. 1998. In The Dravidian Languages, ed Sanford B Seever. Routledge, London & New York: 389-414.		
Emeneau, M.B. 1937. Phonetic observations on the Brahui language. Bulletin of the School of Oriental Studies 8: 981-983.	Emeneau, Murray B.. 1937. {Phonetic Observations on the Brahui Language}. 8. 981--983	Emeneau1937
Emeneau, M.B. 1944. A Sketch of Kota Grammar. In Kota Texts, Vol. 1. University of California Press, Berkeley and Los Angeles: 15-29.		
Emeneau, M.B. 1962. Brahui and Dravidian Comparative Grammar. University of California Publications in Linguistics 27. University of California Press, Berkeley.	Emeneau, Murray B.. 1962. {Brahui and Dravidian Comparative Grammar}. Berkeley. University of California Press. 27	Emeneau1962
Emeneau, Murray B. 1951. Studies in Vietnamese (Annamese) Grammar. University of California Press, Berkeley and Los Angeles.		
Engstrand, Olle & Abulaziz Yusuf Lodhi. 1985. On aspiration in Swahili: Hypotheses, field observations, and an instrumental analysis. Phonetica 42: 175-187.		
Engstrand, Olle. 1999. Swedish. Handbook of the IPA. Cambridge University Press, Cambridge : 140-146.		
Eraso, Natalia. 2015. Gramática Tanimuka, Una Lengua de La Amazonía Colombiana.. Doctoral dissertation, Université Lyon 2.		
Eriacho Sr., Wilfred & Verna L. Chavez. 1998. Shiwi'ma Isamma: Bena:we — Zuni Glossary. Zuni Tribe and Zuni Public School District No 89, Zuni.		
Escalante Hernández, Roberto. 1962. El Cuitlateco. Instituo Nacional de Antropología e Historia, Mexico.		
Esquerra, Ignasi, Albert Febrer & Climent Nadeu. 0000 Frequency analysis of phonetic units for concatenative synthesis in Catalan.		
Estrada Ramírez, Hortensia. 2000. La lengua sáliba. In María Stella González de Pérez & María Luisa Rodríguez de Montes (eds.), Lenguas Indígenas de Colombia: una Visión Descriptiva. Instituto Caro y Cuervo, Bogotá: 681-702.		
Evans, Nicholas D. 1995. A Grammar of Kayardild, with Historical- Comparative Notes on Tangkic. Mouton de Gruyter, Berlin.		
Evans, Nicholas. 2003. Bininj Gun-Wok: A Pan-dialectal grammar of Mayali, Kunwinjku and Kune (Pacific Linguistics 541). Research School of Pacific and Asian Studies, Australian National University, Canberra.	Evans, Nicholas. 2003. Bininj Gun-Wok: A Pan-dialectal Grammar of Mayali, Kunwinjku and Kune. Canberra. Research School of Pacific and Asian Studies, Australian National University. 541. 782	311644
Everett, Daniel L. 1982. Phonetic rarities in Pirahã. Journal of the International Phonetic Association. 12: 94-96.	Everett, D. L.. 1982. {Phonetic Rarities in Piraha}. 12. 94--96	Everett1982
Everett, Daniel L. 1986. Piraha. In Desmond C. Derbyshire and Geoffrey K. Pullum, ed., Handbook of Amazonian Languages 1, pp. 200-325. Berlin:Mouton de Gruyter.		
Everett, Daniel L. 2003. Iambic feet in Paumari and the theory of foot structure. Linguistic Discovery 2(1). http://journals.dartmouth.edu/cgi-bin/WebObjects/Journals.woa/2/xmlpage/1/article/263?htmlOnce=yes		
Everett, Daniel L. and Barbara Kern. 1997. Wari. London: Routledge.	Everett, Daniel Leonard; Kern, Barbara. 1997. Wari: the Pacaas Novos Language of Western Brazil. Routledge	1890_Everett1997
Everett, Daniel Leonard. 1995. Sistemas prosódicos da família Arawá. In Leo Wetzels, ed, Estudios Fonológicos das Línguas Indígenas Brasileiras. Editora UFRJ, Rio de Janeiro: 297-339.		
Everett, Karen S. 1997. Acoustic correlates of stress in Pirahã. Journal of Amazonian Linguistics 1/2: 104-162.		
Faarlund, Jan Terje. 2012. A Grammar of Chiapas Zoque. Oxford: Oxford University Press.		
Facundes, Sidney Da Silva. 2000. The Language of the Apurinã People of Brazil (Maipure/Arawak). Ph. D. disssertation. State University of New York, Buffalo.	Facundes, Sidney da Silva. 2000. {The Language of the Apurin{\~a} People of Brazil (Maipure/Arawak)}. State University of New York at Buffalo	apu_facundes2000
Faraclas, Nicholas & Ronald Esperano Severing. 2008. Linguistic studies on Papiamentu. Fundashon pa Planifikashon di Idioma, Willemstad Curaçao. (not seen)		
Fast, P. W. 1953. Amuesha (Arawak) phonemes. International Journal of American Linguistics 19: 191-4.	Fast, Peter W.. 1953. {Amuesha (Arawak) Phonemes}. 19. 191--194	Fast1953
Faye, Souleymane & Hillebrand Dijkstra. 2005. Glottalisées du sereer-siin, du saafi-saafi et du noon du Sénégal. SudLangues 5. http://www.sudlangues.sn/spip.php?article86		
Fedden, Olcher Sebastian. 2007. A Grammar of Mian, a Papuan Language of New Guinea. Ph D. thesis, University of Melbourne. Published version: A Grammar of Mian, de Gruyter Mouton, Berlin 2011.		
Feldstein, Ronald and Steven Franks. 2002. Polish. Lincom Europa.		
Ferguson, C.A. and Chowdhury, M. 1960. The phonemes of Bengali. Language 36: 22-59. (has frequency data based on transcribed texts	Ferguson, C. A.; Chowdhury, M.. 1960. {The Phonemes of Bengali}. 36. 22--59	FergusonChowdhury1960
Ferrel, R. 1982. Paiwan dictionary. Canberra: Dept. of Linguistics and Research School of Pacific Studies, Australian National University.		
Ferry, M-P. -1991 Thesaurus tenda: dictionnaire ethnolinguistique de langues sénégalo-guinéennes, 3 Volumes (SELAF 324-326). Peeters Press, Louvain & Paris. (not seen)		
Ferry, M-P. 1961. Le basari. In Perrot, Jean (ed.), Les langues dans le monde ancien et moderne, volume 1. Centre National de la Recherche Scientifique, Paris: 55-63.		
Ferry, M-P. 1968. Deux langues Tenda du Sénégal Oriental: Basari et Bedik. Bulletin de la Société d'Études Linguistiques et Anthropologiques de France 7: 1-62.		
Filchenko, Andrey Yury. 2007. A grammar of Eastern Khanty. (Ph.D. dissertation, Rice University.) (not seen)	Filchenko, Audrey Yury. 2007. {A Grammar of Eastern Khanty}. Rice University	kca_filchenko2007
Fintoft, Knut. 1970. Acoustic Analysis and Perception of Tonemes in some Norwegian Dialects. Universitetsforlaget, Oslo.		
Firchow, Irwin B. & Jacqueline Firchow (compilers). 2008. Rotokas-English Dictionary. SIL Papua New Guinea, Ukarumpa. Available at http://www-01.sil.org/pacific/png/pubs/928474531319/Rotokas_lex_2008.pdf		
Firchow, Irwin B. 1987. Form and function of Rotokas words. Language and Linguistics in Melanesia 15: 5-111. Available from http://www.langlxmelanesia.com/LMM%20vol%2015%20no%201-2%20form%20and%20function%20of%20rotokas%20words.pdf (Published version of 1970 Master's thesis, University of California, Davis)		
Firchow, Irwin B., Jacqueline Firchow, & David Akoitai (compilers). 1973. Vocabulary of Rotokas--Pidgin--English. Summer Institute of Linguistics, Ukarumpa.		
Firchow, Irwin and Jacqueline Firchow. 1969. An abbreviated phoneme inventory. Anthropological Linguistics 11: 271-6.	Firchow, I.; Firchow, J.. 1969. {An Abbreviated Phoneme Inventory}. 11. 271--276	Firchow1969
Firchow, Jacqueline (checked by). 1992. Organised Phonology Data: Rotokas Language [ROO]. SIL Papua New Guinea, Ukarumpa.		
Fleming, H.C. 1976. Kefa (Gonga) Languages. In M.L. Bender (ed.), The Non-Semitic Languages of Ethiopia. African Studies Center, Michigan State University, East Lansing: 351-76.		
Fleming, Ilah and Ronald K. Dennis. 1977. Tol (Jicaque) phonology. International Journal of American Linguistics. 43: 121-7.	Fleming, Ilah; Dennis, Ronald K.. 1977. {Tol (Jicaque) Phonology}. 43. 121--127	FlemingDennis1977
Flores, Elexander. 2002. Morfosintaxis del Japreria. Master's thesis, Universidad de Zulia, Maracaibo. Available at http://tesis.luz.edu.ve/tde_busca/arquivo.php?codArquivo=798		
Foley, William A. 1991. The Yimas Language of New Guinea. Stanford University Press, Stanford.		
Ford K. & D. Ober. 1991. A sketch of Kalaw Kawaw Ya. In S. Romaine (ed.), Language in Australia. Cambridge University Press, Cambridge: 118-142.. (not seen)		
Ford, Lysbeth Julie. 1988. A Description of the Emmi language of the Northern Territory of Australia. Ph D. dissertation. Australian National University, Canberra. Avaialble at https://openresearch-repository.anu.edu.au/handle/1885/10796. (Published 2013 by Lincom Europa, München, in series 'Outstanding Grammars from Australia')	Ford, Lysbeth J.. 1998. A Description of the Emmi language of the Northern Territory of Australia. Canberra. Australian Natl. Univ.. Australian National University. 477	42990
Foreman, Velma M. 1974. Grammar of Yessan-Mayo. Language Data, Asian-Pacific Series, 4. Summer Institute of Linguistics, Santa Ana CA.		
Foreman, Velma and Helen Marten. 1973. Yessan-Mayo phonemes. In Phonologies of Three Papua New Guinea Languages (Workpapers in Papua New Guinea Languages 2).Summer Institute of Linguistics, Ukarumpa.		
Foreman, Velma, Helen Marten and Seija Meinander. 2004. Organised Phonology Data: Yessan-Mayo Language [YSS] (New name: Yamano). SIL Papua New Guinea, Ukarumpa.		
Fortescue, Michael. 1984. West Greenlandic. Croom Helm (now Routledge), London. (not seen)		
Foster, Mary L. 1969. The Tarascan Language. University of California Press, Berkeley and Los Angeles.	Foster, Mary Lecron. 1969. {The Tarascan Language}. Berkeley. University of California Press. 56	Foster1969
Fougeron, C. and C. L. Smith. 1999. French. Handbook of the IPA. Cambridge University Press, Cambridge.	Fougeron, C{\'e}cile; Smith, Caroline L.. 1993. Illustrations of the IPA: French. Cambridge University Press. 23. 73--76	fra_fougeron1993
Frachtenberg, Leo J. Coos. In Franz Boas (ed.). 0000 Handbook of American Indian Languages, Part 2. U.S. Government Printing Office, Washington, DC: 297–430. Available on-line at https://ia601605.us.archive.org/2/items/HandbookOfAmericanIndianLanguages-Part2/22-handbook-amerindlanguages-2.pdf		
Frajzyngier, Zygmunt. 2001. A Grammar of Lele. Center for the Study of Language and Information, Stanford University, Stanford CA.	Frajzyngier, Zygmunt. 2001. A grammar of Lele. CSLI	1275_lele_frajzyngier
Frank, Paul. 1990. Ika Syntax. Studies in the Language of Colombia 1. Summer Institute of Linguistics and University of Texas at Arlington.		
Franklin, Joice. 1965. Kewa II: Higher level phonology. Anthropological Linguistics 7/5: 84-88. [On Eastern Kewa]		
Franklin, Karl J. 1971. A grammar of Kewa, New Guinea. Pacific Linguistics C, 16. Canberra: Australian National University.		
Franklin, Karl J. 2010. The word in Kewa. http://www.sil. Paper presented at the August, 2000 workshop on the “word,” Research Centre for Linguistic Typology, La Trobe University, Melbourne. Available at org/pacific/png/pubs/928474549153/Kewa_The_Word.pdf		
Franklin, Karl and Joice Franklin. 1962. Kewa I: phonological asymmetry. Anthropological Linguistics 4/7: 29-37. [On Eastern Kewa]	Franklin, Karl; Franklin, Joice. 1962. {Kewa 1: Phonological Asymmetry}. 4. 29--37	FranklinFranklin1962
Frantz, C.I. and Frantz, M.E. 1966. Gadsup phoneme and toneme units. Pacific Linguistics, Series A, 7: 1-11. (has frequency data)	Frantz, Chester I.; Frantz, Marjori E.. 1966. {Gadsup Phoneme and Toneme Units}. Papers in New Guinea Linguistics 5. Canberra. Australian National University. 7. 1--11	FrantzFrantz1966
Frazier, Meissa. 2009. Tonal dialects and consonant-pitch interaction in Yucatec Maya. In H. Avelino, J. Coon & E. Norcliffe (eds), New Perspectives in Mayan Linguistics. 59-82. MIT Working Papers in Linguistics 59.		
Freeland, L.S. 1951. Language of the Sierra Miwok. Indiana University Publications in Anthropology and Linguistics, supplement to International Journal of American Linguistics 17/1.	Freeland, L. S.. 1951. {Language of the Sierra Miwok}. Indiana University. 6	Freeland1951
Freiberger, Nancy. 1964. A phonemic description of Nong (Nung). Te Reo 7: 15-22.		
Frequency data based on lexicon in Kotapish & Kotapish (1975)		
"Frequency data from ""Syllables"" project analyzing lexicon in Wistrand-Robinson & Armagost (1990)."		
Frequency data from count by John Higgins (University of Bristol) of lexical items in the Advanced Learner's Dictionary (1973 electronic edition-text 710 in the Oxford Text Archive).		
Friedrich, Paul. 1971. Dialectal variation in Tarascan phonology. International Journal of American Linguistics. 37: 164–187.		
Friedrich, Paul. 1975. A phonology of Tarascan. Chicago: University of Chicago, Department of Anthropology.	Friedrich, P.. 1975. {A Phonology of Tarascan}. Chicago. Department of Anthropology, University of Chicago. 4	Friedrich1975
Friedrich, Paul. 1984. Tarascan: From meaning to sound. In Munro Edmonson. Supplement to the Handbook of Middle American Indians. 2. Austin: University of Texas Press.		
Furby, C.E. 1974. Garawa Phonology. Pacific Linguistics, Series A, No. 37:1-11. Australian National University, Canberra.	Furby, Christine E.. 1974. {Garawa Phonology}. Papers in Australian Linguistics 7. Canberra. Australian National University. 37. 1--11	Furby1974
GILLBT (Ghana Institute of Linguistics, Literacy & Bible Translation). 2018. Tampulma Dictionary. Online resource at https://tampulma.webonary.org/overview/		
Gabjanda, James Dahab. 1976. The Axiomatic Functionalist Analysis of the Phonology of Yulu. Ph. D. dissertation, University of St. Andrews. Available at http://research-repository.st-andrews.ac.uk/handle/10023/2642		
Gaby, Alice Rose. 2006. A Grammar of Kuuk Thaayorre. Ph. D. dissertation, University of Melbourne.	Gaby, Alice Rose. 2006. A Grammar of Kuuk Thaayorre. Melbourne. UMER. University of Melbourne. xx+649	107761
Gadzhieva, N. Z. 1966. Azerbajdzhansij Jazyk. In V.V. Vinogradov (ed.), Jazyki Narodov SSSR: Vol 2. Tjurkskie Jazyki. Nauka, Moscow and Leningrad: 68-93.		
Gair, James W. 2003. Sinhala. In George C. Cardona & Dhanesh Jain, eds, The Indo-Aryan Languages. Routledge, London: 766-817.		
Gair, James W. and John C. Paolillo. 1997. Sinhala. Lincom Europa, München and Newcastle.		
Gajendragadkar, S.N. 1970. East Indian Fisher Folk. (Dialects in the Bombay Area I) University of Bombay.	Gajendragadkar, S. N.. 1970. {East Indian Fisher Folk}. Bombay. University of Bombay. 1	Gajendragadkar1970
Gamzatov, Magomed-Rasul Elovic. 1975. Fonetika gunzibskogo jazyka [Phonetics of the Hunzib Language]. Inst. Iazykoznaniia, Moscow. (not seen)		
Gancedo, Omar Antonio. 1972. Fonología segmental de un dialecto guayaquí. Relaciones de la Sociedad Argentina de Antropología 6: 193-201.		
Garay, Ana Fernández. 1994. Testimonios de los últimos Tehuelches. Instituto de Lingüística, Facultad de Filosofía y Letras, Universidad de Buenos Aires, Buenos Aires.		
Garay, Ana Fernández. 1998. El Tehuelche, una Lengua en vías de Extincîon. Estudios Filológicas, Valdivia, Chile. (Has frequency data based on text)		
Garcia Rivera, Fernando. 2007. Fonología del Ashaninka del Río Pichis. In Fonologías Volumen 1 (Serie Descriptiones Lingüísticas). Formabiap, Iquitos: 35-57.		
Garvin, Paul L. 1948. Kutenai I: phonemics. International Journal of American Linguistics 14:37-38.		
Garvin, Paul L. 1950. Wichita 1: Phonemics. International Journal of American Linguistics 16: 179-184.	Garvin, Paul L.. 1950. {Wichita I: Phonemics}. 16. 179--184	Garvin1950
Gasaway, Eileen. 1980. Review of: Woiskia II: Phonemics, by W. A. L. Stokhof. Kivung 12: 212-15. Available at http://www.langlxmelanesia.com/kivung%20vol%2012%20no%202%20review--woisika%20II-phonemics%20(1).pdf		
Gawthorne, Linda A. and Grace E. Hensarling. 1984. Fonología del cogui. In Sistemas fonológicos de idiomas colombianos 5: 5-56. Lomalinda: Editorial Townsend.	Gawthorne, Linda; Hensarling, Grace. 1984. Fonolog{\'\i}a del cogui. Lomalinda. Editorial Townsend. 5. 5--56	1896_Gawthorneetal1984
Geary, Elaine. 1977. Kunimaipa grammar: Morphophonemics to discourse. Workpapers in Papua New Guinea Languages 23. Summer Institute of Linguistics, Ukarumpa. (Available at Summer Institute of Linguistics, Ukarumpaabstract.asp?id=928474523581)		
Geary, Elaine. 1992. Organised Phonology Data: Kunimaipa Language [KUP]. Summer Institute of Linguistics, Ukarumpa. (Available at http://www.sil.org/pacific/png/abstract.asp?id=928474542355		
Genko, A. N. 2005. Tabasaransko-russkij slovarj. Akademia, Moscow.		
Georgianna Noel, An Examination of the Tone System of Fur and its Function in Grammar. M.A. Thesis, University of Texas at Arlington, 2008. Available at http://dspace.uta.edu/bitstream/handle/10106/1064/umi-uta-2172.pdf?sequence=1		
Geraghty, Paul A. 1983. The history of the Fijian languages. (Oceanic Linguistics Special Publication 19). University of Hawaii Press, Honolulu).		
"Gerdel, Florence L. 1974. ""Tzeltal (Mayan) phonemes."" SIL Mexico Workpapers 1: 101-6. (Bachajón dialect)."		
"Gerdel, Florence. 1973. Fonemas del Paez. Sistemas fonológicas de idiomas colombianos, 7-37. SIL, Lomalinda, Colombia. Translated as ""Paez phonemes"" Linguistics 104: 28-38."		
Gerdel, Florence. 1985. Paéz: pitch and stress in the phonological word and phrase. In From Phonology to Discourse, ed. Ruth M Brend, Summer Institute of Linguistics, Dallas: 31-42.		
Gerdel, Florence. 1990. Fonología del Paez (revisada). Instituto del Verano. Available at http://www-01.sil.org/americas/colombia/pubs/50076.pdf		
Gerzenstein, Ana. 1989. Diccionario Etnolinguistico Maka-Espanol. Instituto de Lingüística, Faculdad de Filosofia y Letras, Universidad de Buenos Aires. (not seen)		
Gerzenstein, Ana. 1994. Lengua Maká: Estudio Descriptivo. Instituto de Lingüística, Faculdad de Filosofia y Letras, Universidad de Buenos Aires.	Gerzenstein, Ana. 1994. Lengua Maka. Estudio Descriptivo. Buenos Aires. Instituto de Lingu{\'\i}stica. 41--61	1982_Gerzenstein1994
Ghosh, Arun K. 2008. Santali. In: Gregory D.S. Anderson (ed.), The Munda Languages. London, Routledge: 11-98.		
Gibson, Michael L. 1996 [2008]. El Munichi: Un idioma que se extingue. Serie Lingüística Peruana, 42. Instituto Lingüístico de Verano, Pucallpa. Available at https://www.sil.org/system/files/reapdata/14/53/60/145360849833376203662006346175168015148/slp42.pdf		
Gimson, A. C. 1970. An Introduction to the Pronunciation of English. St. Martin’s Press, New York.		
Girdenis, Aleksas. 1997. Phonology. In Vytautas Ambarzas, ed, Lithuanian Grammar. Baltos Lankos, Vilnius.		
Girdenis, Aleksas. 2009. Vadinamuju sutaptiniu dvibalsiu [ie, uo] garsine it fonologine sudetis. Baltistica 44: 213-242.		
