ID,Name,Description,BIPA,lowered,rhotic,pharyngealized,rising,backing,high,rhotacized,tapflap,velarized,place,nasal,ejective,prenasalized,front,release,fronting,implosive,rounded,nasalized,long,lateral,whistled,dental,voiced,pulmonic,uvular,higher,labialized,retracted,labiodental,pharyngeal,mid,nasalizing,unspecified,velar,voiceless,palatalized,trill,rounding,supra,laryngealized,click,palatal,unrounded,breathy,approximant,sibilant,retroflex,low,overshort,aspirated,epiglottal,back,coronal,lower,trilled,bilabial,stop,prestopped,diphtong,raised,alveolar,central,glottal,affricate,preaspirated,fricative,palatoalveolar,unrounding,lowering
BIPA_ei_u025Cu0069,ɜi,from unrounded open-mid central to unrounded close front diphthong,ɜi,-,-,-,+,-,+,-,-,-,-,-,-,-,+,-,+,-,-,-,-,-,-,-,-,-,-,-,-,-,-,-,+,-,-,-,-,-,-,-,-,-,-,-,+,-,-,-,-,-,-,-,-,-,-,+,-,-,-,-,+,-,-,+,-,-,-,-,-,-,-
BIPA_nd_u006Eu032Au0064u032A,n̪d̪,pre-nasalized voiced dental stop consonant,ⁿd̪,-,-,-,-,-,-,-,-,-,-,-,-,+,-,-,-,-,-,-,-,-,-,+,+,+,-,-,-,-,-,-,-,-,-,-,-,-,-,-,-,-,-,-,-,-,-,-,-,-,-,-,-,-,-,-,-,-,+,-,-,-,-,-,-,-,-,-,-,-,-
BIPA_h_u029C,ʜ,voiceless epiglottal fricative consonant,ʜ,-,-,-,-,-,-,-,-,-,-,-,-,-,-,-,-,-,-,-,-,-,-,-,-,+,-,-,-,-,-,-,-,-,-,-,+,-,-,-,-,-,-,-,-,-,-,-,-,-,-,-,+,-,-,-,-,-,-,-,-,-,-,-,-,-,-,+,-,-,-
BIPA_ai_u0061u0268,aɨ,from unrounded open front to unrounded close central diphthong,aɨ,-,-,-,+,-,+,-,-,-,-,-,-,-,-,-,-,-,-,-,-,-,-,-,-,-,-,-,-,-,-,-,-,-,-,-,-,-,-,-,-,-,-,-,+,-,-,-,-,+,-,-,-,-,-,-,-,-,-,-,+,-,-,+,-,-,-,-,-,-,-
BIPA_ao_u0061u006F,ao,from unrounded open front to rounded close-mid back diphthong,ao,-,-,-,+,+,-,-,-,-,-,-,-,-,-,-,-,-,+,-,-,-,-,-,-,-,-,+,-,-,-,-,+,-,-,-,-,-,-,+,-,-,-,-,+,-,-,-,-,+,-,-,-,+,-,-,-,-,-,-,+,-,-,+,-,-,-,-,-,-,-
BIPA_ai_u0061u026A,aɪ,from unrounded open front to unrounded near-close near-front diphthong,aɪ,+,-,-,+,-,+,-,-,-,-,-,-,-,+,-,+,-,-,-,-,-,-,-,-,-,-,-,-,-,-,-,-,-,-,-,-,-,-,-,-,-,-,-,+,-,-,-,-,+,-,-,-,-,-,-,-,-,-,-,+,-,-,+,-,-,-,-,-,-,-
BIPA_s_u0073u02BC,sʼ,voiceless alveolar ejective sibilant fricative consonant,sʼ,-,-,-,-,-,-,-,-,-,-,-,+,-,-,-,-,-,-,-,-,-,-,-,-,-,-,-,-,-,-,-,-,-,-,-,-,-,-,-,-,-,-,-,-,-,-,+,-,-,-,-,-,-,-,-,-,-,-,-,-,-,+,-,-,-,-,+,-,-,-
BIPA_kngw_u006Bu014Bu02B7,kŋʷ,labialized with-nasal-release voiceless velar stop consonant,kⁿʷ,-,-,-,-,-,-,-,-,-,-,+,-,-,-,+,-,-,-,-,-,-,-,-,-,+,-,-,+,-,-,-,-,-,-,+,+,-,-,-,-,-,-,-,-,-,-,-,-,-,-,-,-,-,-,-,-,-,+,-,-,-,-,-,-,-,-,-,-,-,-
UNK_dr_u0256u027D,ɖɽ,,,-,-,-,-,-,-,-,-,-,-,-,-,-,-,+,-,-,-,-,-,-,-,-,+,+,-,-,-,-,-,-,-,-,-,-,-,-,-,-,-,-,-,-,-,-,-,-,+,-,-,-,-,-,-,-,+,-,+,-,-,-,-,-,-,-,-,-,-,-,-
BIPA_u_u028Au0259,ʊə,from rounded near-close near-back to unrounded mid central diphthong,ʊə,+,-,-,-,-,+,-,-,-,-,-,-,-,-,-,+,-,+,-,-,-,-,-,-,-,-,+,-,-,-,-,+,-,-,-,-,-,-,-,-,-,-,-,+,-,-,-,-,-,-,-,-,+,-,-,-,-,-,-,+,-,-,+,-,-,-,-,-,+,+
BIPA__u02A2,ʢ,voiced epiglottal fricative consonant,ʢ,-,-,-,-,-,-,-,-,-,-,-,-,-,-,-,-,-,-,-,-,-,-,-,+,+,-,-,-,-,-,-,-,-,-,-,-,-,-,-,-,-,-,-,-,-,-,-,-,-,-,-,+,-,-,-,-,-,-,-,-,-,-,-,-,-,-,+,-,-,-
BIPA_ai_u0061u0330u1E2D,a̰ḭ,from creaky unrounded open front to creaky unrounded close front diphthong,a̰ḭ,-,-,-,+,-,+,-,-,-,-,-,-,-,+,-,+,-,-,-,-,-,-,-,-,-,-,-,-,-,-,-,-,-,-,-,-,-,-,-,-,+,-,-,+,-,-,-,-,+,-,-,-,-,-,-,-,-,-,-,+,-,-,+,-,-,-,-,-,-,-
BIPA_tpj_u0074u0070u02B2,tpʲ,palatalized voiceless alveolar-and-bilabial stop consonant,tpʲ,-,-,-,-,-,-,-,-,-,-,-,-,-,-,-,-,-,-,-,-,-,-,-,-,+,-,-,-,-,-,-,-,-,-,-,+,+,-,-,-,-,-,-,-,-,-,-,-,-,-,-,-,-,-,-,-,+,+,-,-,-,+,-,-,-,-,-,-,-,-
BIPA_bw_u03B2u02B7,βʷ,labialized voiced bilabial fricative consonant,βʷ,-,-,-,-,-,-,-,-,-,-,-,-,-,-,-,-,-,-,-,-,-,-,-,+,+,-,-,+,-,-,-,-,-,-,-,-,-,-,-,-,-,-,-,-,-,-,-,-,-,-,-,-,-,-,-,-,+,-,-,-,-,-,-,-,-,-,+,-,-,-
BIPA_ng_u014B,ŋ,voiced velar nasal consonant,ŋ,-,-,-,-,-,-,-,-,-,-,+,-,-,-,-,-,-,-,-,-,-,-,-,+,+,-,-,-,-,-,-,-,-,-,+,-,-,-,-,-,-,-,-,-,-,-,-,-,-,-,-,-,-,-,-,-,-,-,-,-,-,-,-,-,-,-,-,-,-,-
BIPA_bj_u0062u02B2,bʲ,palatalized voiced bilabial stop consonant,bʲ,-,-,-,-,-,-,-,-,-,-,-,-,-,-,-,-,-,-,-,-,-,-,-,+,+,-,-,-,-,-,-,-,-,-,-,-,+,-,-,-,-,-,-,-,-,-,-,-,-,-,-,-,-,-,-,-,+,+,-,-,-,-,-,-,-,-,-,-,-,-
BIPA_r_u0281,ʁ,voiced uvular fricative consonant,ʁ,-,-,-,-,-,-,-,-,-,-,-,-,-,-,-,-,-,-,-,-,-,-,-,+,+,+,-,-,-,-,-,-,-,-,-,-,-,-,-,-,-,-,-,-,-,-,-,-,-,-,-,-,-,-,-,-,-,-,-,-,-,-,-,-,-,-,+,-,-,-
UNK_jn_u025Fu0272,ɟɲ,,,-,-,-,-,-,-,-,-,-,-,-,-,-,-,-,-,-,-,-,-,-,-,-,+,+,-,-,-,-,-,-,-,-,-,-,-,-,-,-,-,-,-,+,-,-,-,-,-,-,-,-,-,-,-,-,-,-,+,-,-,-,-,-,-,-,-,-,-,-,-
BIPA_a_u0061u0324,a̤,breathy unrounded open front vowel,a̤,-,-,-,-,-,-,-,-,-,-,-,-,-,-,-,-,-,-,-,-,-,-,-,+,-,-,-,-,-,-,-,-,-,-,-,-,-,-,-,-,-,-,-,+,+,-,-,-,+,-,-,-,-,-,-,-,-,-,-,-,-,-,+,-,-,-,-,-,-,-
BIPA_tpnm_u0074u0320u0070u006Eu0320u006D,t̠pn̠m,from voiceless post-alveolar stop to with-nasal-release voiceless bilabial stop cluster,t̠pⁿ,-,-,-,-,-,-,-,-,-,-,+,-,-,-,+,-,-,-,-,-,-,-,-,-,+,-,-,-,-,-,-,-,-,-,-,+,-,-,-,-,-,-,-,-,-,-,-,-,-,-,-,-,-,-,-,-,+,+,-,-,-,-,-,-,-,-,-,+,-,-
BIPA_l_u006Cu032Au0325,l̪̥,devoiced voiced dental lateral approximant consonant,l̪̥,-,-,-,-,-,-,-,-,-,-,-,-,-,-,-,-,-,-,-,-,+,-,+,-,+,-,-,-,-,-,-,-,-,-,-,+,-,-,-,-,-,-,-,-,-,+,-,-,-,-,-,-,-,-,-,-,-,-,-,-,-,-,-,-,-,-,-,-,-,-
BIPA_r_u0072u031Du0325,r̝̥,raised devoiced voiced alveolar trill consonant,r̝̥,-,-,-,-,-,+,-,-,-,-,-,-,-,-,-,-,-,-,-,-,-,-,-,-,+,-,-,-,-,-,-,-,-,-,-,+,-,+,-,+,-,-,-,-,-,-,-,-,-,-,-,-,-,-,-,-,-,-,-,-,-,+,-,-,-,-,-,-,-,-
BIPA_r_u0072u032A,r̪,voiced dental trill consonant,r̪,-,-,-,-,-,-,-,-,-,-,-,-,-,-,-,-,-,-,-,-,-,-,+,+,+,-,-,-,-,-,-,-,-,-,-,-,-,+,-,-,-,-,-,-,-,-,-,-,-,-,-,-,-,-,-,-,-,-,-,-,-,-,-,-,-,-,-,-,-,-
BIPA_r_u027Du0325,ɽ̥,devoiced voiced retroflex tap consonant,ɽ̥,-,-,-,-,-,-,-,+,-,-,-,-,-,-,-,-,-,-,-,-,-,-,-,-,+,-,-,-,-,-,-,-,-,-,-,+,-,-,-,-,-,-,-,-,-,-,-,+,-,-,-,-,-,-,-,-,-,-,-,-,-,-,-,-,-,-,-,-,-,-
BIPA_mj_u006Du02B2,mʲ,palatalized voiced bilabial nasal consonant,mʲ,-,-,-,-,-,-,-,-,-,-,+,-,-,-,-,-,-,-,-,-,-,-,-,+,+,-,-,-,-,-,-,-,-,-,-,-,+,-,-,-,-,-,-,-,-,-,-,-,-,-,-,-,-,-,-,-,+,-,-,-,-,-,-,-,-,-,-,-,-,-
BIPA_a_u00E3u02D0,ãː,long nasalized unrounded open front vowel,ãː,-,-,-,-,-,-,-,-,-,-,-,-,-,-,-,-,-,-,+,+,-,-,-,-,-,-,-,-,-,-,-,-,-,-,-,-,-,-,-,-,-,-,-,+,-,-,-,-,+,-,-,-,-,-,-,-,-,-,-,-,-,-,+,-,-,-,-,-,-,-
BIPA_sj_u0283u02B2,ʃʲ,palatalized voiceless post-alveolar sibilant fricative consonant,ʃʲ,-,-,-,-,-,-,-,-,-,-,-,-,-,-,-,-,-,-,-,-,-,-,-,-,+,-,-,-,-,-,-,-,-,-,-,+,+,-,-,-,-,-,-,-,-,-,+,-,-,-,-,-,-,-,-,-,-,-,-,-,-,-,-,-,-,-,+,+,-,-
BIPA_ntsh_u0273u0074u0282u02B0,ɳtʂʰ,pre-nasalized aspirated voiceless retroflex sibilant affricate consonant,ⁿʈʂʰ,-,-,-,-,-,-,-,-,-,-,-,-,+,-,-,-,-,-,-,-,-,-,-,-,+,-,-,-,-,-,-,-,-,-,-,+,-,-,-,-,-,-,-,-,-,-,+,+,-,-,+,-,-,-,-,-,-,-,-,-,-,-,-,-,+,-,-,-,-,-
BIPA_nj_u006Eu0330u02B2,n̰ʲ,palatalized creaky voiced alveolar nasal consonant,n̰ʲ,-,-,-,-,-,-,-,-,-,-,+,-,-,-,-,-,-,-,-,-,-,-,-,+,+,-,-,-,-,-,-,-,-,-,-,-,+,-,-,-,+,-,-,-,-,-,-,-,-,-,-,-,-,-,-,-,-,-,-,-,-,+,-,-,-,-,-,-,-,-
BIPA_y_u028E,ʎ,voiced palatal lateral approximant consonant,ʎ,-,-,-,-,-,-,-,-,-,-,-,-,-,-,-,-,-,-,-,-,+,-,-,+,+,-,-,-,-,-,-,-,-,-,-,-,-,-,-,-,-,-,+,-,-,+,-,-,-,-,-,-,-,-,-,-,-,-,-,-,-,-,-,-,-,-,-,-,-,-
BIPA_ts_u0074u0073u032Bu02BC,ts̫ʼ,voiceless alveolar ejective whistled-sibilant affricate consonant,ts̫’,-,-,-,-,-,-,-,-,-,-,-,+,-,-,-,-,-,-,-,-,-,+,-,-,-,-,-,-,-,-,-,-,-,-,-,-,-,-,-,-,-,-,-,-,-,-,+,-,-,-,-,-,-,-,-,-,-,-,-,-,-,+,-,-,+,-,-,-,-,-
BIPA_iu_u0268u0075,ɨu,from unrounded close central to rounded close back diphthong,ɨu,-,-,-,-,+,+,-,-,-,-,-,-,-,-,-,-,-,+,-,-,-,-,-,-,-,-,-,-,-,-,-,-,-,-,-,-,-,-,+,-,-,-,-,+,-,-,-,-,-,-,-,-,+,-,-,-,-,-,-,+,-,-,+,-,-,-,-,-,-,-
BIPA_oe_u0153,œ,rounded open-mid front vowel,œ,-,-,-,-,-,-,-,-,-,-,-,-,-,+,-,-,-,+,-,-,-,-,-,-,-,-,-,-,-,-,-,+,-,-,-,-,-,-,-,-,-,-,-,-,-,-,-,-,-,-,-,-,-,-,+,-,-,-,-,-,-,-,-,-,-,-,-,-,-,-
BIPA_e_u025Bu0306,ɛ̆,ultra-short unrounded open-mid front vowel,ɛ̆,-,-,-,-,-,-,-,-,-,-,-,-,-,+,-,-,-,-,-,-,-,-,-,-,-,-,-,-,-,-,-,+,-,-,-,-,-,-,-,-,-,-,-,+,-,-,-,-,-,+,-,-,-,-,+,-,-,-,-,-,-,-,-,-,-,-,-,-,-,-
BIPA_ngj_u014Bu02B2,ŋʲ,palatalized voiced velar nasal consonant,ŋʲ,-,-,-,-,-,-,-,-,-,-,+,-,-,-,-,-,-,-,-,-,-,-,-,+,+,-,-,-,-,-,-,-,-,-,+,-,+,-,-,-,-,-,-,-,-,-,-,-,-,-,-,-,-,-,-,-,-,-,-,-,-,-,-,-,-,-,-,-,-,-
BIPA_oe_u006Fu0330u1E1B,o̰ḛ,from creaky rounded close-mid back to creaky unrounded close-mid front diphthong,o̰ḛ,-,-,-,-,-,-,-,-,-,-,-,-,-,+,-,+,-,+,-,-,-,-,-,-,-,-,+,-,-,-,-,+,-,-,-,-,-,-,-,-,+,-,-,+,-,-,-,-,-,-,-,-,+,-,-,-,-,-,-,+,-,-,-,-,-,-,-,-,+,-
BIPA_oe_u006Fu025B,oɛ,from rounded close-mid back to unrounded open-mid front diphthong,oɛ,-,-,-,-,-,-,-,-,-,-,-,-,-,+,-,+,-,+,-,-,-,-,-,-,-,-,+,-,-,-,-,+,-,-,-,-,-,-,-,-,-,-,-,+,-,-,-,-,-,-,-,-,+,-,+,-,-,-,-,+,-,-,-,-,-,-,-,-,+,+
BIPA_pf_u0070u0278,pɸ,voiceless bilabial affricate consonant,pɸ,-,-,-,-,-,-,-,-,-,-,-,-,-,-,-,-,-,-,-,-,-,-,-,-,+,-,-,-,-,-,-,-,-,-,-,+,-,-,-,-,-,-,-,-,-,-,-,-,-,-,-,-,-,-,-,-,+,-,-,-,-,-,-,-,+,-,-,-,-,-
BIPA_lz_u026E,ɮ,voiced alveolar lateral fricative consonant,ɮ,-,-,-,-,-,-,-,-,-,-,-,-,-,-,-,-,-,-,-,-,+,-,-,+,+,-,-,-,-,-,-,-,-,-,-,-,-,-,-,-,-,-,-,-,-,-,-,-,-,-,-,-,-,-,-,-,-,-,-,-,-,+,-,-,-,-,+,-,-,-
BIPA_nt_u006Eu0074,nt,pre-nasalized voiceless alveolar stop consonant,ⁿt,-,-,-,-,-,-,-,-,-,+,-,-,+,-,-,-,-,-,-,-,-,-,-,-,+,-,-,-,-,-,-,-,-,+,-,+,-,-,-,-,-,-,-,-,-,-,-,-,-,-,-,-,-,+,-,-,-,+,-,-,-,-,-,-,-,-,-,-,-,-
BIPA__u0294,ʔ,voiceless glottal stop consonant,ʔ,-,-,-,-,-,-,-,-,-,-,-,-,-,-,-,-,-,-,-,-,-,-,-,-,+,-,-,-,-,-,-,-,-,-,-,+,-,-,-,-,-,-,-,-,-,-,-,-,-,-,-,-,-,-,-,-,-,+,-,-,-,-,-,+,-,-,-,-,-,-
BIPA_ngh_u014Bu0325u01C1u0068u0303,ŋ̥ǁh̃,pre-nasalized aspirated voiceless lateral click consonant,ⁿǁʰ,-,-,-,-,-,-,-,-,-,-,+,-,-,-,-,-,-,-,+,-,+,-,-,-,-,-,-,-,-,-,-,-,-,-,+,+,-,-,-,-,-,+,-,-,-,-,-,-,-,-,-,-,-,-,-,-,-,-,-,-,-,+,-,+,-,-,+,-,-,-
BIPA_au_u0251u0075,ɑu,from unrounded open back to rounded close back diphthong,ɑu,-,-,-,+,-,+,-,-,-,-,-,-,-,-,-,-,-,+,-,-,-,-,-,-,-,-,-,-,-,-,-,-,-,-,-,-,-,-,+,-,-,-,-,+,-,-,-,-,+,-,-,-,+,-,-,-,-,-,-,+,-,-,-,-,-,-,-,-,-,-
BIPA_l_u006Cu032Au0330,l̪̰,creaky voiced dental lateral approximant consonant,l̪̰,-,-,-,-,-,-,-,-,-,-,-,-,-,-,-,-,-,-,-,-,+,-,+,+,+,-,-,-,-,-,-,-,-,-,-,-,-,-,-,-,+,-,-,-,-,+,-,-,-,-,-,-,-,-,-,-,-,-,-,-,-,-,-,-,-,-,-,-,-,-
BIPA_k_u006Bu0330,k̰,creaky voiceless velar stop consonant,k̰,-,-,-,-,-,-,-,-,-,-,-,-,-,-,-,-,-,-,-,-,-,-,-,-,+,-,-,-,-,-,-,-,-,-,+,+,-,-,-,-,+,-,-,-,-,-,-,-,-,-,-,-,-,-,-,-,-,+,-,-,-,-,-,-,-,-,-,-,-,-
BIPA_r_u027Au0323,ɺ̣,voiced retroflex lateral tap consonant,ɺ̣,-,-,-,-,-,-,-,+,-,-,-,-,-,-,-,-,-,-,-,-,+,-,-,-,+,-,-,-,-,-,-,-,-,-,-,-,-,-,-,-,-,-,-,-,-,-,-,+,-,-,-,-,-,-,-,-,-,-,-,-,-,-,-,-,-,-,-,-,-,-
BIPA_i_u0268u0330u0303,ɨ̰̃,nasalized creaky unrounded close central vowel,ɨ̰̃,-,-,-,-,-,+,-,-,-,-,-,-,-,-,-,-,-,-,+,-,-,-,-,-,-,-,-,-,-,-,-,-,-,-,-,-,-,-,-,-,+,-,-,+,-,-,-,-,-,-,-,-,-,-,-,-,-,-,-,-,-,-,+,-,-,-,-,-,-,-
BIPA_ai_u0061u02D0u0268,aːɨ,from long unrounded open front to unrounded close central diphthong,aːɨ,-,-,-,+,-,+,-,-,-,-,-,-,-,-,-,-,-,-,-,+,-,-,-,-,-,-,-,-,-,-,-,-,-,-,-,-,-,-,-,-,-,-,-,+,-,-,-,-,+,-,-,-,-,-,-,-,-,-,-,+,-,-,+,-,-,-,-,-,-,-
BIPA_l_u006Cu0303,l̃,nasalized voiced alveolar lateral approximant consonant,l̃,-,-,-,-,-,-,-,-,-,+,-,-,-,-,-,-,-,-,+,-,+,-,-,+,+,-,-,-,-,-,-,-,-,+,-,-,-,-,-,-,-,-,-,-,-,+,-,-,-,-,-,-,-,+,-,-,-,-,-,-,-,-,-,-,-,-,-,-,-,-
BIPA_i_u026A,ɪ,unrounded near-close near-front vowel,ɪ,+,-,-,-,-,+,-,-,-,-,-,-,-,+,-,-,-,-,-,-,-,-,-,-,-,-,-,-,-,-,-,-,-,-,-,-,-,-,-,-,-,-,-,+,-,-,-,-,-,-,-,-,-,-,-,-,-,-,-,-,-,-,-,-,-,-,-,-,-,-
BIPA_o_u00F5u02D0,õː,long nasalized rounded close-mid back vowel,õː,-,-,-,-,-,-,-,-,-,-,-,-,-,-,-,-,-,+,+,+,-,-,-,-,-,-,-,-,-,-,-,+,-,+,-,-,-,-,-,-,-,-,-,-,-,-,-,-,-,-,-,-,+,-,-,-,-,-,-,-,-,-,-,-,-,-,-,-,-,-
BIPA_n_u006Eu032A,n̪,voiced dental nasal consonant,n̪,-,-,-,-,-,-,-,-,-,-,+,-,-,-,-,-,-,-,-,-,-,-,+,+,+,-,-,-,-,-,-,-,-,-,-,-,-,-,-,-,-,-,-,-,-,-,-,-,-,-,-,-,-,-,-,-,-,-,-,-,-,-,-,-,-,-,-,-,-,-
BIPA_sj_u0073u032Au02B2,s̪ʲ,palatalized voiceless dental sibilant fricative consonant,s̪ʲ,-,-,-,-,-,-,-,-,-,-,-,-,-,-,-,-,-,-,-,-,-,-,+,-,+,-,-,-,-,-,-,-,-,-,-,+,+,-,-,-,-,-,-,-,-,-,+,-,-,-,-,-,-,-,-,-,-,-,-,-,-,-,-,-,-,-,+,-,-,-
BIPA_dj_u0257u032Au02B2,ɗ̪ʲ,palatalized voiced dental implosive consonant,ɗʲ,-,-,-,-,-,-,-,-,-,-,-,-,-,-,-,-,+,-,-,-,-,-,+,+,-,-,-,-,-,-,-,-,-,-,-,-,+,-,-,-,-,-,-,-,-,-,-,-,-,-,-,-,-,-,-,-,-,+,-,-,-,-,-,-,-,-,-,-,-,-
BIPA_d_u0256,ɖ,voiced retroflex stop consonant,ɖ,-,-,-,-,-,-,-,-,-,-,-,-,-,-,-,-,-,-,-,-,-,-,-,+,+,-,-,-,-,-,-,-,-,-,-,-,-,-,-,-,-,-,-,-,-,-,-,+,-,-,-,-,-,-,-,-,-,+,-,-,-,-,-,-,-,-,-,-,-,-
BIPA_nth_u006Eu032Au0074u032Au02B0,n̪t̪ʰ,pre-nasalized aspirated voiceless dental stop consonant,ⁿt̪ʰ,-,-,-,-,-,-,-,-,-,-,-,-,+,-,-,-,-,-,-,-,-,-,+,-,+,-,-,-,-,-,-,-,-,-,-,+,-,-,-,-,-,-,-,-,-,-,-,-,-,-,+,-,-,-,-,-,-,+,-,-,-,+,-,-,-,-,-,-,-,-
BIPA_ou_u006Fu028A,oʊ,from rounded close-mid back to rounded near-close near-back diphthong,oʊ,+,-,-,+,-,+,-,-,-,-,-,-,-,-,-,-,-,+,-,-,-,-,-,-,-,-,+,-,-,-,-,+,-,-,-,-,-,-,-,-,-,-,-,-,-,-,-,-,-,-,-,-,+,-,-,-,-,-,-,+,-,-,-,-,-,-,-,-,-,-
BIPA_th_u03B8u02BC,θʼ,voiceless dental ejective fricative consonant,θ’,-,-,-,-,-,-,-,-,-,-,-,+,-,-,-,-,-,-,-,-,-,-,+,-,-,-,-,-,-,-,-,-,-,-,-,-,-,-,-,-,-,-,-,-,-,-,-,-,-,-,-,-,-,-,-,-,-,-,-,-,-,-,-,-,-,-,+,-,-,-
BIPA_o_u014F,ŏ,ultra-short rounded close-mid back vowel,ŏ,-,-,-,-,-,-,-,-,-,-,-,-,-,-,-,-,-,+,-,-,-,-,-,-,-,-,+,-,-,-,-,+,-,-,-,-,-,-,-,-,-,-,-,-,-,-,-,-,-,+,-,-,+,-,-,-,-,-,-,-,-,-,-,-,-,-,-,-,-,-
BIPA_x_u0078,x,voiceless velar fricative consonant,x,-,-,-,-,-,-,-,-,-,-,-,-,-,-,-,-,-,-,-,-,-,-,-,-,+,-,-,-,-,-,-,-,-,-,+,+,-,-,-,-,-,-,-,-,-,-,-,-,-,-,-,-,-,-,-,-,-,-,-,-,-,-,-,-,-,-,+,-,-,-
BIPA_cc_u0063u00E7,cç,voiceless palatal affricate consonant,cç,-,-,-,-,-,-,-,-,-,-,-,-,-,-,-,-,-,-,-,-,-,-,-,-,+,-,-,-,-,-,-,-,-,-,-,+,-,-,-,-,-,-,+,-,-,-,-,-,-,-,-,-,-,-,-,-,-,-,-,-,-,-,-,-,+,-,-,-,-,-
BIPA_w_u026Fu0330,ɯ̰,creaky unrounded close back vowel,ɯ̰,-,-,-,-,-,+,-,-,-,-,-,-,-,-,-,-,-,-,-,-,-,-,-,-,-,-,-,-,-,-,-,-,-,-,-,-,-,-,-,-,+,-,-,+,-,-,-,-,-,-,-,-,+,-,-,-,-,-,-,-,-,-,-,-,-,-,-,-,-,-
BIPA_d_u0064u0324,d̤,breathy voiced alveolar stop consonant,dʱ,-,-,-,-,-,-,-,-,-,-,-,-,-,-,-,-,-,-,-,-,-,-,-,+,+,-,-,-,-,-,-,-,-,-,-,-,-,-,-,-,-,-,-,-,+,-,-,-,-,-,-,-,-,-,-,-,-,+,-,-,-,+,-,-,-,-,-,-,-,-
BIPA_nts_u006Eu0320u0074u0320u0283,n̠t̠ʃ,pre-nasalized voiceless post-alveolar sibilant affricate consonant,ⁿtʃ,-,-,-,-,-,-,-,-,-,-,-,-,+,-,-,-,-,-,-,-,-,-,-,-,+,-,-,-,-,-,-,-,-,-,-,+,-,-,-,-,-,-,-,-,-,-,+,-,-,-,-,-,-,-,-,-,-,-,-,-,-,-,-,-,+,-,-,+,-,-
BIPA_ui_u0075u0069,ui,from rounded close back to unrounded close front diphthong,ui,-,-,-,-,-,+,-,-,-,-,-,-,-,+,-,+,-,+,-,-,-,-,-,-,-,-,-,-,-,-,-,-,-,-,-,-,-,-,-,-,-,-,-,+,-,-,-,-,-,-,-,-,+,-,-,-,-,-,-,+,-,-,-,-,-,-,-,-,+,-
BIPA_ntj_u006Eu0074u02B2,ntʲ,pre-nasalized palatalized voiceless alveolar stop consonant,ⁿtʲ,-,-,-,-,-,-,-,-,-,-,-,-,+,-,-,-,-,-,-,-,-,-,-,-,+,-,-,-,-,-,-,-,-,-,-,+,+,-,-,-,-,-,-,-,-,-,-,-,-,-,-,-,-,-,-,-,-,+,-,-,-,+,-,-,-,-,-,-,-,-
BIPA_r_u027E,ɾ,voiced alveolar tap consonant,ɾ,-,-,-,-,-,-,-,+,-,+,-,-,-,-,-,-,-,-,-,-,-,-,-,+,+,-,-,-,-,-,-,-,-,+,-,-,-,-,-,-,-,-,-,-,-,-,-,-,-,-,-,-,-,+,-,-,-,-,-,-,-,-,-,-,-,-,-,-,-,-
BIPA_r_u027Eu0330,ɾ̰,creaky voiced alveolar tap consonant,ɾ̰,-,-,-,-,-,-,-,+,-,-,-,-,-,-,-,-,-,-,-,-,-,-,-,+,+,-,-,-,-,-,-,-,-,-,-,-,-,-,-,-,+,-,-,-,-,-,-,-,-,-,-,-,-,-,-,-,-,-,-,-,-,+,-,-,-,-,-,-,-,-
BIPA_q_u0071,q,voiceless uvular stop consonant,q,-,-,-,-,-,-,-,-,-,-,-,-,-,-,-,-,-,-,-,-,-,-,-,-,+,+,-,-,-,-,-,-,-,-,-,+,-,-,-,-,-,-,-,-,-,-,-,-,-,-,-,-,-,-,-,-,-,+,-,-,-,-,-,-,-,-,-,-,-,-
BIPA_i_u0069u02D0,iː,long unrounded close front vowel,iː,-,-,-,-,-,+,-,-,-,-,-,-,-,+,-,-,-,-,-,+,-,-,-,-,-,-,-,-,-,-,-,-,-,-,-,-,-,-,-,-,-,-,-,+,-,-,-,-,-,-,-,-,-,-,-,-,-,-,-,-,-,-,-,-,-,-,-,-,-,-
BIPA_ua_u0075u0061,ua,from rounded close back to unrounded open front diphthong,ua,-,-,-,-,-,+,-,-,-,-,-,-,-,-,-,+,-,+,-,-,-,-,-,-,-,-,-,-,-,-,-,-,-,-,-,-,-,-,-,-,-,-,-,+,-,-,-,-,+,-,-,-,+,-,-,-,-,-,-,+,-,-,+,-,-,-,-,-,+,+
BIPA_o_u0275,ɵ,rounded close-mid central vowel,ɵ,-,-,-,-,-,-,-,-,-,-,-,-,-,-,-,-,-,+,-,-,-,-,-,-,-,-,-,-,-,-,-,+,-,+,-,-,-,-,-,-,-,-,-,-,-,-,-,-,-,-,-,-,-,-,-,-,-,-,-,-,-,-,+,-,-,-,-,-,-,-
BIPA_mbj_u006Du0062u02B2,mbʲ,pre-nasalized palatalized voiced bilabial stop consonant,ⁿbʲ,-,-,-,-,-,-,-,-,-,-,-,-,+,-,-,-,-,-,-,-,-,-,-,+,+,-,-,-,-,-,-,-,-,-,-,-,+,-,-,-,-,-,-,-,-,-,-,-,-,-,-,-,-,-,-,-,+,+,-,-,-,-,-,-,-,-,-,-,-,-
BIPA_oa_u0254u0061,ɔa,from rounded open-mid back to unrounded open front diphthong,ɔa,-,-,-,-,-,-,-,-,-,-,-,-,-,-,-,+,-,+,-,-,-,-,-,-,-,-,-,-,-,-,-,+,-,-,-,-,-,-,-,-,-,-,-,+,-,-,-,-,+,-,-,-,+,-,+,-,-,-,-,+,-,-,+,-,-,-,-,-,+,+
BIPA_ndj_u006Eu0320u0064u0320u02B2,n̠d̠ʲ,from retracted voiced alveolar nasal to palatalized voiced post-alveolar stop cluster,n̠d̠ʲ,-,-,-,-,-,-,-,-,-,-,-,-,+,-,-,-,-,-,-,-,-,-,-,+,+,-,-,-,-,-,-,-,-,-,-,-,+,-,-,-,-,-,-,-,-,-,-,-,-,-,-,-,-,-,-,-,-,+,-,-,-,-,-,-,-,-,-,+,-,-
BIPA_o_u00F5u0330,õ̰,nasalized creaky rounded close-mid back vowel,õ̰,-,-,-,-,-,-,-,-,-,-,-,-,-,-,-,-,-,+,+,-,-,-,-,-,-,-,+,-,-,-,-,+,-,-,-,-,-,-,-,-,+,-,-,-,-,-,-,-,-,-,-,-,+,-,-,-,-,-,-,-,-,-,-,-,-,-,-,-,-,-
BIPA_dbv_u0238u0076,ȸv,voiced labio-dental affricate consonant,bv,-,-,-,-,-,-,-,-,-,-,-,-,-,-,-,-,-,-,-,-,-,-,-,+,+,-,-,-,-,+,-,-,-,-,-,-,-,-,-,-,-,-,-,-,-,-,+,-,-,-,-,-,-,-,-,-,-,-,-,-,-,-,-,-,+,-,-,-,-,-
BIPA_mbj_u006Du03B2u02B2,mβʲ,pre-nasalized palatalized voiced bilabial fricative consonant,ⁿβʲ,-,-,-,-,-,-,-,-,-,-,-,-,+,-,-,-,-,-,-,-,-,-,-,+,+,-,-,-,-,-,-,-,-,-,-,-,+,-,-,-,-,-,-,-,-,-,-,-,-,-,-,-,-,-,-,-,+,-,-,-,-,-,-,-,-,-,+,-,-,-
BIPA_e_u025Bu0259,ɛə,from unrounded open-mid front to unrounded mid central diphthong,ɛə,-,-,-,+,+,-,-,-,-,-,-,-,-,+,-,-,-,-,-,-,-,-,-,-,-,-,+,-,-,-,-,+,-,-,-,-,-,-,-,-,-,-,-,+,-,-,-,-,-,-,-,-,-,-,+,-,-,-,-,+,-,-,+,-,-,-,-,-,-,-
BIPA_au_u0061u028A,aʊ,from unrounded open front to rounded near-close near-back diphthong,aʊ,+,-,-,+,+,+,-,-,-,-,-,-,-,-,-,-,-,+,-,-,-,-,-,-,-,-,-,-,-,-,-,-,-,-,-,-,-,-,+,-,-,-,-,+,-,-,-,-,+,-,-,-,+,-,-,-,-,-,-,+,-,-,+,-,-,-,-,-,-,-
BIPA__u028C,ʌ,unrounded open-mid back vowel,ʌ,-,-,-,-,-,-,-,-,-,-,-,-,-,-,-,-,-,-,-,-,-,-,-,-,-,-,-,-,-,-,-,+,-,-,-,-,-,-,-,-,-,-,-,+,-,-,-,-,-,-,-,-,+,-,+,-,-,-,-,-,-,-,-,-,-,-,-,-,-,-
BIPA_nd_u006Eu0064,nd,pre-nasalized voiced alveolar stop consonant,ⁿd,-,-,-,-,-,-,-,-,-,+,-,-,+,-,-,-,-,-,-,-,-,-,-,+,+,-,-,-,-,-,-,-,-,+,-,-,-,-,-,-,-,-,-,-,-,-,-,-,-,-,-,-,-,+,-,-,-,+,-,-,-,-,-,-,-,-,-,-,-,-
BIPA_dw_u0064u02B7,dʷ,labialized voiced alveolar stop consonant,dʷ,-,-,-,-,-,-,-,-,-,-,-,-,-,-,-,-,-,-,-,-,-,-,-,+,+,-,-,+,-,-,-,-,-,-,-,-,-,-,-,-,-,-,-,-,-,-,-,-,-,-,-,-,-,-,-,-,-,+,-,-,-,+,-,-,-,-,-,-,-,-
BIPA_d_u0257u032A,ɗ̪,voiced dental implosive consonant,ɗ,-,-,-,-,-,-,-,-,-,-,-,-,-,-,-,-,+,-,-,-,-,-,+,+,-,-,-,-,-,-,-,-,-,-,-,-,-,-,-,-,-,-,-,-,-,-,-,-,-,-,-,-,-,-,-,-,-,+,-,-,-,-,-,-,-,-,-,-,-,-
BIPA_u_u0289,ʉ,rounded close central vowel,ʉ,-,-,-,-,-,+,-,-,-,-,-,-,-,-,-,-,-,+,-,-,-,-,-,-,-,-,-,-,-,-,-,-,-,-,-,-,-,-,-,-,-,-,-,-,-,-,-,-,-,-,-,-,-,-,-,-,-,-,-,-,-,-,+,-,-,-,-,-,-,-
BIPA_bv_u0062u0076,bv,voiced labio-dental affricate consonant,bv,-,-,-,-,-,-,-,-,-,-,-,-,-,-,-,-,-,-,-,-,-,-,-,+,+,-,-,-,-,+,-,-,-,-,-,-,-,-,-,-,-,-,-,-,-,-,-,-,-,-,-,-,-,-,-,-,+,-,-,-,-,-,-,-,+,-,-,-,-,-
BIPA_dz_u0064u0324u007Au0324,d̤z̤,breathy voiced alveolar sibilant affricate consonant,dzʱ,-,-,-,-,-,-,-,-,-,-,-,-,-,-,-,-,-,-,-,-,-,-,-,+,+,-,-,-,-,-,-,-,-,-,-,-,-,-,-,-,-,-,-,-,+,-,+,-,-,-,-,-,-,-,-,-,-,-,-,-,-,+,-,-,+,-,-,-,-,-
BIPA_u_u0169u0259u0303,ũə̃,from nasalized rounded close back to nasalized unrounded mid central diphthong,ũə̃,-,-,-,-,-,+,-,-,-,-,-,-,-,-,-,+,-,+,-,-,-,-,-,-,-,-,+,-,-,-,-,+,+,-,-,-,-,-,-,-,-,-,-,+,-,-,-,-,-,-,-,-,+,-,-,-,-,-,-,+,-,-,+,-,-,-,-,-,+,+
BIPA_kx_u006Bu0078,kx,voiceless velar affricate consonant,kx,-,-,-,-,-,-,-,-,-,-,-,-,-,-,-,-,-,-,-,-,-,-,-,-,+,-,-,-,-,-,-,-,-,-,+,+,-,-,-,-,-,-,-,-,-,-,-,-,-,-,-,-,-,-,-,-,-,-,-,-,-,-,-,-,+,-,-,-,-,-
BIPA_r_u0279u0330,ɹ̰,creaky voiced alveolar approximant consonant,ɹ̰,-,-,-,-,-,-,-,-,-,-,-,-,-,-,-,-,-,-,-,-,-,-,-,+,+,-,-,-,-,-,-,-,-,-,-,-,-,-,-,-,+,-,-,-,-,+,-,-,-,-,-,-,-,-,-,-,-,-,-,-,-,+,-,-,-,-,-,-,-,-
BIPA_ndz_u006Eu032Au0064u032Au007Au032A,n̪d̪z̪,pre-nasalized voiced dental sibilant affricate consonant,ⁿdz̪,-,-,-,-,-,-,-,-,-,-,-,-,+,-,-,-,-,-,-,-,-,-,+,+,+,-,-,-,-,-,-,-,-,-,-,-,-,-,-,-,-,-,-,-,-,-,+,-,-,-,-,-,-,-,-,-,-,-,-,-,-,-,-,-,+,-,-,-,-,-
BIPA_ts_u0074u0320u0283,t̠ʃ,voiceless post-alveolar sibilant affricate consonant,tʃ,-,-,-,-,-,-,-,-,-,-,-,-,-,-,-,-,-,-,-,-,-,-,-,-,+,-,-,-,-,-,-,-,-,-,-,+,-,-,-,-,-,-,-,-,-,-,+,-,-,-,-,-,-,-,-,-,-,-,-,-,-,-,-,-,+,-,-,+,-,-
BIPA_au_u0061u0330u1E75,a̰ṵ,from creaky unrounded open front to creaky rounded close back diphthong,a̰ṵ,-,-,-,+,+,+,-,-,-,-,-,-,-,-,-,-,-,+,-,-,-,-,-,-,-,-,-,-,-,-,-,-,-,-,-,-,-,-,+,-,+,-,-,+,-,-,-,-,+,-,-,-,+,-,-,-,-,-,-,+,-,-,+,-,-,-,-,-,-,-
BIPA_o_u0254,ɔ,rounded open-mid back vowel,ɔ,-,-,-,-,-,-,-,-,-,-,-,-,-,-,-,-,-,+,-,-,-,-,-,-,-,-,-,-,-,-,-,+,-,-,-,-,-,-,-,-,-,-,-,-,-,-,-,-,-,-,-,-,+,-,+,-,-,-,-,-,-,-,-,-,-,-,-,-,-,-
BIPA_ts_u0288u0282u02BC,ʈʂʼ,voiceless retroflex ejective sibilant affricate consonant,ʈʂ’,-,-,-,-,-,-,-,-,-,-,-,+,-,-,-,-,-,-,-,-,-,-,-,-,-,-,-,-,-,-,-,-,-,-,-,-,-,-,-,-,-,-,-,-,-,-,+,+,-,-,-,-,-,-,-,-,-,-,-,-,-,-,-,-,+,-,-,-,-,-
UNK_rrj_u0072u0072u02B2,rrʲ,,,-,+,-,-,-,-,-,-,-,+,-,-,-,-,-,-,-,-,-,-,-,-,-,+,+,-,-,-,-,-,-,-,-,+,-,-,+,-,-,-,-,-,-,-,-,-,-,-,-,-,-,-,-,+,-,-,-,-,-,-,-,-,-,-,-,-,-,-,-,-
BIPA_t_u0074u032Au02E4,t̪ˤ,pharyngealized voiceless dental stop consonant,t̪ˤ,-,-,+,-,-,-,-,-,-,-,-,-,-,-,-,-,-,-,-,-,-,-,+,-,+,-,-,-,-,-,-,-,-,-,-,+,-,-,-,-,-,-,-,-,-,-,-,-,-,-,-,-,-,-,-,-,-,+,-,-,-,-,-,-,-,-,-,-,-,-
BIPA_s_u0073u02E4,sˤ,pharyngealized voiceless alveolar sibilant fricative consonant,sˤ,-,-,+,-,-,-,-,-,-,+,-,-,-,-,-,-,-,-,-,-,-,-,-,-,+,-,-,-,-,-,-,-,-,+,-,+,-,-,-,-,-,-,-,-,-,-,+,-,-,-,-,-,-,+,-,-,-,-,-,-,-,-,-,-,-,-,+,-,-,-
BIPA_ts_u0074u0320u0283u02E4u02BC,t̠ʃˤʼ,pharyngealized voiceless post-alveolar ejective sibilant affricate consonant,tʃ’ˤ,-,-,+,-,-,-,-,-,-,-,-,+,-,-,-,-,-,-,-,-,-,-,-,-,-,-,-,-,+,-,-,-,-,-,-,-,-,-,-,-,-,-,-,-,-,-,+,-,-,-,-,-,-,-,-,-,-,-,-,-,-,-,-,-,+,-,-,+,-,-
BIPA_d_u00F0,ð,voiced dental fricative consonant,ð,-,-,-,-,-,-,-,-,-,-,-,-,-,-,-,-,-,-,-,-,-,-,+,+,+,-,-,-,-,-,-,-,-,-,-,-,-,-,-,-,-,-,-,-,-,-,-,-,-,-,-,-,-,-,-,-,-,-,-,-,-,-,-,-,-,-,+,-,-,-
BIPA_r_u0072,r,voiced alveolar trill consonant,r,-,-,-,-,-,-,-,-,-,+,-,-,-,-,-,-,-,-,-,-,-,-,-,+,+,-,-,-,-,-,-,-,-,+,-,-,-,+,-,-,-,-,-,-,-,-,-,-,-,-,-,-,-,+,-,-,-,-,-,-,-,-,-,-,-,-,-,-,-,-
BIPA_dz_u0064u0320u0292u0324,d̠ʒ̤,breathy voiced post-alveolar sibilant affricate consonant,dʒʱ,-,-,-,-,-,-,-,-,-,-,-,-,-,-,-,-,-,-,-,-,-,-,-,+,+,-,-,-,+,-,-,-,-,-,-,-,-,-,-,-,-,-,-,-,+,-,+,-,-,-,-,-,-,-,-,-,-,-,-,-,-,-,-,-,+,-,-,+,-,-
BIPA__u0259,ə,unrounded mid central vowel,ə,-,-,-,-,-,-,-,-,-,-,-,-,-,-,-,-,-,-,-,-,-,-,-,-,-,-,-,-,-,-,-,+,-,+,-,-,-,-,-,-,-,-,-,+,-,-,-,-,-,-,-,-,-,-,-,-,-,-,-,-,-,-,+,-,-,-,-,-,-,-
BIPA_e_u1E1Bu0259u0330,ḛə̰,from creaky unrounded close-mid front to creaky unrounded mid central diphthong,ḛə̰,-,-,-,-,+,-,-,-,-,-,-,-,-,+,-,-,-,-,-,-,-,-,-,-,-,-,+,-,-,-,-,+,-,-,-,-,-,-,-,-,+,-,-,+,-,-,-,-,-,-,-,-,-,-,-,-,-,-,-,+,-,-,+,-,-,-,-,-,-,-
BIPA_g_u0261u01C0,ɡǀ,voiced dental click consonant,gǀ,-,-,-,-,-,-,-,-,-,-,-,-,-,-,-,-,-,-,-,-,-,-,+,+,-,-,-,-,-,-,-,-,-,-,+,-,-,-,-,-,-,+,-,-,-,-,-,-,-,-,-,-,-,-,-,-,-,+,-,-,-,-,-,-,-,-,-,-,-,-
BIPA_tjh_u0074u032Au02B2u02B0,t̪ʲʰ,palatalized aspirated voiceless dental stop consonant,t̪ʲʰ,-,-,-,-,-,-,-,-,-,-,-,-,-,-,-,-,-,-,-,-,-,-,+,-,+,-,-,-,-,-,-,-,-,-,-,+,+,-,-,-,-,-,-,-,-,-,-,-,-,-,+,-,-,-,-,-,-,+,-,-,-,-,-,-,-,-,-,-,-,-
BIPA_nq_u0274u0071,ɴq,pre-nasalized voiceless uvular stop consonant,ⁿq,-,-,-,-,-,-,-,-,-,-,-,-,+,-,-,-,-,-,-,-,-,-,-,-,+,+,-,-,-,-,-,-,-,-,-,+,-,-,-,-,-,-,-,-,-,-,-,-,-,-,-,-,-,-,-,-,-,+,-,-,-,-,-,-,-,-,-,-,-,-
BIPA_tr_u0074u0072,tr,with-trilled-release voiceless alveolar stop consonant,tʳ,-,-,-,-,-,-,-,-,-,-,-,-,-,-,+,-,-,-,-,-,-,-,-,-,+,-,-,-,-,-,-,-,-,-,-,+,-,-,-,-,-,-,-,-,-,-,-,-,-,-,-,-,-,-,-,+,-,+,-,-,-,+,-,-,-,-,-,-,-,-
BIPA_r_u0072u02E4,rˤ,pharyngealized voiced alveolar trill consonant,rˤ,-,-,+,-,-,-,-,-,-,-,-,-,-,-,-,-,-,-,-,-,-,-,-,+,+,-,-,-,-,-,-,-,-,-,-,-,-,+,-,-,-,-,-,-,-,-,-,-,-,-,-,-,-,-,-,-,-,-,-,-,-,+,-,-,-,-,-,-,-,-
BIPA_i_u0129u02D0,ĩː,long nasalized unrounded close front vowel,ĩː,-,-,-,-,-,+,-,-,-,-,-,-,-,+,-,-,-,-,+,+,-,-,-,-,-,-,-,-,-,-,-,-,-,-,-,-,-,-,-,-,-,-,-,+,-,-,-,-,-,-,-,-,-,-,-,-,-,-,-,-,-,-,-,-,-,-,-,-,-,-
BIPA_tl_u0074u032Au026Cu032A,t̪ɬ̪,voiceless dental lateral affricate consonant,tɬ̪,-,-,-,-,-,-,-,-,-,-,-,-,-,-,-,-,-,-,-,-,+,-,+,-,+,-,-,-,-,-,-,-,-,-,-,+,-,-,-,-,-,-,-,-,-,-,-,-,-,-,-,-,-,-,-,-,-,-,-,-,-,+,-,-,+,-,-,-,-,-
BIPA_e_u025Bu0324,ɛ̤,breathy unrounded open-mid front vowel,ɛ̤,-,-,-,-,-,-,-,-,-,-,-,-,-,+,-,-,-,-,-,-,-,-,-,+,-,-,-,-,-,-,-,+,-,-,-,-,-,-,-,-,-,-,-,+,+,-,-,-,-,-,-,-,-,-,+,-,-,-,-,-,-,-,-,-,-,-,-,-,-,-
BIPA_a_u0252u0303u02D0,ɒ̃ː,long nasalized rounded open back vowel,ɒ̃ː,-,-,-,-,-,-,-,-,-,-,-,-,-,-,-,-,-,+,+,+,-,-,-,-,-,-,-,-,-,-,-,-,-,-,-,-,-,-,-,-,-,-,-,-,-,-,-,-,+,-,-,-,+,-,-,-,-,-,-,-,-,-,-,-,-,-,-,-,-,-
BIPA_kh_u03C7u02D0,χː,long voiceless uvular fricative consonant,χː,-,-,-,-,-,-,-,-,-,-,-,-,-,-,-,-,-,-,-,+,-,-,-,-,+,+,-,-,-,-,-,-,-,-,-,+,-,-,-,-,-,-,-,-,-,-,-,-,-,-,-,-,-,-,-,-,-,-,-,-,-,-,-,-,-,-,+,-,-,-
BIPA_ph_u0070u02B0,pʰ,aspirated voiceless bilabial stop consonant,pʰ,-,-,-,-,-,-,-,-,-,-,-,-,-,-,-,-,-,-,-,-,-,-,-,-,+,-,-,-,-,-,-,-,-,-,-,+,-,-,-,-,-,-,-,-,-,-,-,-,-,-,+,-,-,-,-,-,+,+,-,-,-,-,-,-,-,-,-,-,-,-
BIPA_qh_u0071u02B0,qʰ,aspirated voiceless uvular stop consonant,qʰ,-,-,-,-,-,-,-,-,-,-,-,-,-,-,-,-,-,-,-,-,-,-,-,-,+,+,-,-,-,-,-,-,-,-,-,+,-,-,-,-,-,-,-,-,-,-,-,-,-,-,+,-,-,-,-,-,-,+,-,-,-,-,-,-,-,-,-,-,-,-
