ID,Name,Description,BIPA,lowered,rhotic,pharyngealized,rising,backing,high,rhotacized,tapflap,velarized,place,nasal,ejective,prenasalized,front,release,fronting,implosive,rounded,nasalized,long,lateral,whistled,dental,voiced,pulmonic,uvular,higher,labialized,retracted,labiodental,pharyngeal,mid,nasalizing,unspecified,velar,voiceless,palatalized,trill,rounding,supra,laryngealized,click,palatal,unrounded,breathy,approximant,sibilant,retroflex,low,overshort,aspirated,epiglottal,back,coronal,lower,trilled,bilabial,stop,prestopped,diphtong,raised,alveolar,central,glottal,affricate,preaspirated,fricative,palatoalveolar,unrounding,lowering
BIPA_c_u0255,ɕ,voiceless alveolo-palatal sibilant fricative consonant,ɕ,-,-,-,-,-,-,-,-,-,-,-,-,-,-,-,-,-,-,-,-,-,-,-,-,+,-,-,-,-,-,-,-,-,-,-,+,+,-,-,-,-,-,-,-,-,-,+,-,-,-,-,-,-,-,-,-,-,-,-,-,-,-,-,-,-,-,+,+,-,-
BIPA_g_u0260,ɠ,voiced velar implosive consonant,ɠ,-,-,-,-,-,-,-,-,-,-,-,-,-,-,-,-,+,-,-,-,-,-,-,+,-,-,-,-,-,-,-,-,-,-,+,-,-,-,-,-,-,-,-,-,-,-,-,-,-,-,-,-,-,-,-,-,-,+,-,-,-,-,-,-,-,-,-,-,-,-
BIPA_n_u0273u0324,ɳ̤,breathy voiced retroflex nasal consonant,ɳʱ,-,-,-,-,-,-,-,-,-,-,+,-,-,-,-,-,-,-,-,-,-,-,-,+,+,-,-,-,-,-,-,-,-,-,-,-,-,-,-,-,-,-,-,-,+,-,-,+,-,-,-,-,-,-,-,-,-,-,-,-,-,-,-,-,-,-,-,-,-,-
BIPA_uu_u0075u0075,uu,long rounded close back vowel,uː,-,-,-,-,-,+,-,-,-,-,-,-,-,-,-,-,-,+,-,-,-,-,-,-,-,-,-,-,-,-,-,-,-,-,-,-,-,-,-,-,-,-,-,-,-,-,-,-,-,-,-,-,+,-,-,-,-,-,-,+,-,-,-,-,-,-,-,-,-,-
BIPA_ae_u00E6,æ,unrounded near-open front vowel,æ,-,-,-,-,-,-,-,-,-,-,-,-,-,+,-,-,-,-,-,-,-,-,-,-,-,-,-,-,-,-,-,-,-,-,-,-,-,-,-,-,-,-,-,+,-,-,-,-,+,-,-,-,-,-,-,-,-,-,-,-,+,-,-,-,-,-,-,-,-,-
BIPA_u_u1E75u0303u0259u0330u0303,ṵ̃ə̰̃,from nasalized creaky rounded close back to nasalized creaky unrounded mid central diphthong,ṵ̃ə̰̃,-,-,-,-,-,+,-,-,-,-,-,-,-,-,-,+,-,+,-,-,-,-,-,-,-,-,+,-,-,-,-,+,+,-,-,-,-,-,-,-,+,-,-,+,-,-,-,-,-,-,-,-,+,-,-,-,-,-,-,+,-,-,+,-,-,-,-,-,+,+
BIPA_nd_u006Eu0320u0064u0320,n̠d̠,retracted pre-nasalized voiced alveolar stop consonant,ⁿd̠,-,-,-,-,-,-,-,-,-,-,-,-,+,-,-,-,-,-,-,-,-,-,-,+,+,-,-,-,-,-,-,-,-,-,-,-,-,-,-,-,-,-,-,-,-,-,-,-,-,-,-,-,-,-,-,-,-,+,-,-,-,-,-,-,-,-,-,+,-,-
BIPA_o_u00F5,õ,nasalized rounded close-mid back vowel,õ,-,-,-,-,-,-,-,-,-,-,-,-,-,-,-,-,-,+,+,-,-,-,-,-,-,-,-,-,-,-,-,+,-,+,-,-,-,-,-,-,-,-,-,-,-,-,-,-,-,-,-,-,+,-,-,-,-,-,-,-,-,-,-,-,-,-,-,-,-,-
BIPA_k_u006Bu01C2,kǂ,voiceless palatal click consonant,ǂ,-,-,-,-,-,-,-,-,-,-,-,-,-,-,-,-,-,-,-,-,-,-,-,-,-,-,-,-,-,-,-,-,-,-,+,+,-,-,-,-,-,+,+,-,-,-,-,-,-,-,-,-,-,-,-,-,-,+,-,-,-,-,-,-,-,-,-,-,-,-
BIPA_vj_u0076u02B2,vʲ,palatalized voiced labio-dental fricative consonant,vʲ,-,-,-,-,-,-,-,-,-,-,-,-,-,-,-,-,-,-,-,-,-,-,-,+,+,-,-,-,-,+,-,-,-,-,-,-,+,-,-,-,-,-,-,-,-,-,-,-,-,-,-,-,-,-,-,-,-,-,-,-,-,-,-,-,-,-,+,-,-,-
BIPA_tsh_u0074u032Au0073u032Au02B0,t̪s̪ʰ,aspirated voiceless dental sibilant affricate consonant,ts̪ʰ,-,-,-,-,-,-,-,-,-,-,-,-,-,-,-,-,-,-,-,-,-,-,+,-,+,-,-,-,-,-,-,-,-,-,-,+,-,-,-,-,-,-,-,-,-,-,+,-,-,-,+,-,-,-,-,-,-,-,-,-,-,-,-,-,+,-,-,-,-,-
BIPA_n_u006Eu02D0,nː,long voiced alveolar nasal consonant,nː,-,-,-,-,-,-,-,-,-,+,+,-,-,-,-,-,-,-,-,+,-,-,-,+,+,-,-,-,-,-,-,-,-,+,-,-,-,-,-,-,-,-,-,-,-,-,-,-,-,-,-,-,-,+,-,-,-,-,-,-,-,-,-,-,-,-,-,-,-,-
BIPA_a_u0061u031F,a̟,advanced unrounded open front vowel,a̟,-,-,-,-,-,-,-,-,-,-,-,-,-,+,-,-,-,-,-,-,-,-,-,-,-,-,-,-,-,-,-,-,-,-,-,-,-,-,-,-,-,-,-,+,-,-,-,-,+,-,-,-,-,-,-,-,-,-,-,-,-,-,-,-,-,-,-,-,-,-
BIPA_x_u0078u02D0,xː,long voiceless velar fricative consonant,xː,-,-,-,-,-,-,-,-,-,-,-,-,-,-,-,-,-,-,-,+,-,-,-,-,+,-,-,-,-,-,-,-,-,-,+,+,-,-,-,-,-,-,-,-,-,-,-,-,-,-,-,-,-,-,-,-,-,-,-,-,-,-,-,-,-,-,+,-,-,-
BIPA_e_u025B,ɛ,unrounded open-mid front vowel,ɛ,-,-,-,-,-,-,-,-,-,-,-,-,-,+,-,-,-,-,-,-,-,-,-,-,-,-,-,-,-,-,-,+,-,-,-,-,-,-,-,-,-,-,-,+,-,-,-,-,-,-,-,-,-,-,+,-,-,-,-,-,-,-,-,-,-,-,-,-,-,-
BIPA_nj_u006Eu032Au02B2,n̪ʲ,palatalized voiced dental nasal consonant,n̪ʲ,-,-,-,-,-,-,-,-,-,-,+,-,-,-,-,-,-,-,-,-,-,-,+,+,+,-,-,-,-,-,-,-,-,-,-,-,+,-,-,-,-,-,-,-,-,-,-,-,-,-,-,-,-,-,-,-,-,-,-,-,-,-,-,-,-,-,-,-,-,-
BIPA_x_u0078u02BC,xʼ,voiceless velar ejective fricative consonant,xʼ,-,-,-,-,-,-,-,-,-,-,-,+,-,-,-,-,-,-,-,-,-,-,-,-,-,-,-,-,-,-,-,-,-,-,+,-,-,-,-,-,-,-,-,-,-,-,-,-,-,-,-,-,-,-,-,-,-,-,-,-,-,-,-,-,-,-,+,-,-,-
BIPA_i_u0129,ĩ,nasalized unrounded close front vowel,ĩ,-,-,-,-,-,+,-,-,-,-,-,-,-,+,-,-,-,-,+,-,-,-,-,-,-,-,-,-,-,-,-,-,-,-,-,-,-,-,-,-,-,-,-,+,-,-,-,-,-,-,-,-,-,-,-,-,-,-,-,-,-,-,-,-,-,-,-,-,-,-
BIPA_u_u0075u031D,u̝,raised rounded close back vowel,u̝,-,-,-,-,-,+,-,-,-,-,-,-,-,-,-,-,-,+,-,-,-,-,-,-,-,-,-,-,-,-,-,-,-,-,-,-,-,-,-,+,-,-,-,-,-,-,-,-,-,-,-,-,+,-,-,-,-,-,-,-,-,-,-,-,-,-,-,-,-,-
BIPA_ns_u006Eu0073,ns,pre-nasalized voiceless alveolar sibilant fricative consonant,ⁿs,-,-,-,-,-,-,-,-,-,-,-,-,+,-,-,-,-,-,-,-,-,-,-,-,+,-,-,-,-,-,-,-,-,-,-,+,-,-,-,-,-,-,-,-,-,-,+,-,-,-,-,-,-,-,-,-,-,-,-,-,-,+,-,-,-,-,+,-,-,-
BIPA__u0295,ʕ,voiced pharyngeal fricative consonant,ʕ,-,-,-,-,-,-,-,-,-,-,-,-,-,-,-,-,-,-,-,-,-,-,-,+,+,-,-,-,-,-,+,-,-,-,-,-,-,-,-,-,-,-,-,-,-,-,-,-,-,-,-,-,-,-,-,-,-,-,-,-,-,-,-,-,-,-,+,-,-,-
BIPA_ncc_u0272u0063u0255,ɲcɕ,pre-nasalized palatalized voiceless alveolo-palatal sibilant affricate consonant,ⁿtɕʲ,-,-,-,-,-,-,-,-,-,-,-,-,+,-,-,-,-,-,-,-,-,-,-,-,+,-,-,-,-,-,-,-,-,-,-,+,+,-,-,-,-,-,-,-,-,-,-,-,-,-,-,-,-,-,-,-,-,-,-,-,-,-,-,-,+,-,-,+,-,-
BIPA_k_u006Bu02D0,kː,long voiceless velar stop consonant,kː,-,-,-,-,-,-,-,-,-,-,-,-,-,-,-,-,-,-,-,+,-,-,-,-,+,-,-,-,-,-,-,-,-,-,+,+,-,-,-,-,-,-,-,-,-,-,-,-,-,-,-,-,-,-,-,-,-,+,-,-,-,-,-,-,-,-,-,-,-,-
BIPA_phw_u0070u02B0u02B7,pʰʷ,labialized aspirated voiceless bilabial stop consonant,pʷʰ,-,-,-,-,-,-,-,-,-,-,-,-,-,-,-,-,-,-,-,-,-,-,-,-,+,-,-,+,-,-,-,-,-,-,-,+,-,-,-,-,-,-,-,-,-,-,-,-,-,-,+,-,-,-,-,-,+,+,-,-,-,-,-,-,-,-,-,-,-,-
BIPA_ou_u00F5u0169,õũ,from nasalized rounded close-mid back to nasalized rounded close back diphthong,õũ,-,-,-,+,-,+,-,-,-,-,-,-,-,-,-,-,-,+,+,-,-,-,-,-,-,-,+,-,-,-,-,+,-,-,-,-,-,-,-,-,-,-,-,-,-,-,-,-,-,-,-,-,+,-,-,-,-,-,-,+,-,-,-,-,-,-,-,-,-,-
BIPA_ie_u1E2Du1E1B,ḭḛ,from creaky unrounded close front to creaky unrounded close-mid front diphthong,ḭḛ,-,-,-,-,-,+,-,-,-,-,-,-,-,+,-,-,-,-,-,-,-,-,-,-,-,-,+,-,-,-,-,+,-,-,-,-,-,-,-,-,+,-,-,+,-,-,-,-,-,-,-,-,-,-,-,-,-,-,-,+,-,-,-,-,-,-,-,-,-,+
BIPA_eu_u0065u028A,eʊ,from unrounded close-mid front to rounded near-close near-back diphthong,eʊ,+,-,-,+,+,+,-,-,-,-,-,-,-,+,-,-,-,+,-,-,-,-,-,-,-,-,+,-,-,-,-,+,-,-,-,-,-,-,+,-,-,-,-,+,-,-,-,-,-,-,-,-,+,-,-,-,-,-,-,+,-,-,-,-,-,-,-,-,-,-
BIPA_ts_u0074u0320u0283u02BC,t̠ʃʼ,voiceless post-alveolar ejective sibilant affricate consonant,tʃʼ,-,-,-,-,-,-,-,-,-,-,-,+,-,-,-,-,-,-,-,-,-,-,-,-,-,-,-,-,-,-,-,-,-,-,-,-,-,-,-,-,-,-,-,-,-,-,+,-,-,-,-,-,-,-,-,-,-,-,-,-,-,-,-,-,+,-,-,+,-,-
BIPA_hw_u0127u02B7,ħʷ,labialized voiceless pharyngeal fricative consonant,ħʷ,-,-,-,-,-,-,-,-,-,-,-,-,-,-,-,-,-,-,-,-,-,-,-,-,+,-,-,+,-,-,+,-,-,-,-,+,-,-,-,-,-,-,-,-,-,-,-,-,-,-,-,-,-,-,-,-,-,-,-,-,-,-,-,-,-,-,+,-,-,-
BIPA_s_u0073u032B,s̫,voiceless alveolar whistled-sibilant fricative consonant,s̫,-,-,-,-,-,-,-,-,-,-,-,-,-,-,-,-,-,-,-,-,-,+,-,-,+,-,-,-,-,-,-,-,-,-,-,+,-,-,-,-,-,-,-,-,-,-,+,-,-,-,-,-,-,-,-,-,-,-,-,-,-,+,-,-,-,-,+,-,-,-
BIPA_i_u0069u031D,i̝,raised unrounded close front vowel,i̝,-,-,-,-,-,+,-,-,-,-,-,-,-,+,-,-,-,-,-,-,-,-,-,-,-,-,-,-,-,-,-,-,-,-,-,-,-,-,-,+,-,-,-,+,-,-,-,-,-,-,-,-,-,-,-,-,-,-,-,-,-,-,-,-,-,-,-,-,-,-
BIPA_oe_u006Fu0065,oe,from rounded close-mid back to unrounded close-mid front diphthong,oe,-,-,-,-,-,-,-,-,-,-,-,-,-,+,-,+,-,+,-,-,-,-,-,-,-,-,+,-,-,-,-,+,-,-,-,-,-,-,-,-,-,-,-,+,-,-,-,-,-,-,-,-,+,-,-,-,-,-,-,+,-,-,-,-,-,-,-,-,+,-
BIPA_ng_u014Bu0325u01C3u0294,ŋ̥ǃʔ,pre-nasalized glottalized voiceless alveolar click consonant,ⁿǃˀ,-,-,-,-,-,-,-,-,-,-,+,-,-,-,-,-,-,-,-,-,-,-,-,-,-,-,-,-,-,-,-,-,-,-,+,+,-,-,-,-,-,+,-,-,-,-,-,-,-,-,-,-,-,-,-,-,-,+,-,-,-,-,-,+,-,-,-,+,-,-
BIPA_r_u027A,ɺ,voiced alveolar lateral tap consonant,ɺ,-,-,-,-,-,-,-,+,-,-,-,-,-,-,-,-,-,-,-,-,+,-,-,-,+,-,-,-,-,-,-,-,-,-,-,-,-,-,-,-,-,-,-,-,-,-,-,-,-,-,-,-,-,-,-,-,-,-,-,-,-,+,-,-,-,-,-,-,-,-
BIPA_dz_u0064u032Au007Au032A,d̪z̪,voiced dental sibilant affricate consonant,dz̪,-,-,-,-,-,-,-,-,-,-,-,-,-,-,-,-,-,-,-,-,-,-,+,+,+,-,-,-,-,-,-,-,-,-,-,-,-,-,-,-,-,-,-,-,-,-,+,-,-,-,-,-,-,-,-,-,-,-,-,-,-,-,-,-,+,-,-,-,-,-
BIPA_hts_u02B0u0074u0320u0283,ʰt̠ʃ,pre-aspirated voiceless post-alveolar sibilant affricate consonant,ʰtʃ,-,-,-,-,-,-,-,-,-,-,-,-,-,-,-,-,-,-,-,-,-,-,-,-,+,-,-,-,-,-,-,-,-,-,-,+,-,-,-,-,-,-,-,-,-,-,+,-,-,-,-,-,-,-,-,-,-,-,-,-,-,-,-,-,+,+,-,+,-,-
BIPA_sj_u0073u02B2,sʲ,palatalized voiceless alveolar sibilant fricative consonant,sʲ,-,-,-,-,-,-,-,-,-,-,-,-,-,-,-,-,-,-,-,-,-,-,-,-,+,-,-,-,-,-,-,-,-,-,-,+,+,-,-,-,-,-,-,-,-,-,+,-,-,-,-,-,-,-,-,-,-,-,-,-,-,+,-,-,-,-,+,-,-,-
BIPA_j_u025Fu0324,ɟ̤,breathy voiced palatal stop consonant,ɟʱ,-,-,-,-,-,-,-,-,-,-,-,-,-,-,-,-,-,-,-,-,-,-,-,+,+,-,-,-,-,-,-,-,-,-,-,-,-,-,-,-,-,-,+,-,+,-,-,-,-,-,-,-,-,-,-,-,-,+,-,-,-,-,-,-,-,-,-,-,-,-
BIPA_io_u0069u006F,io,from unrounded close front to rounded close-mid back diphthong,io,-,-,-,-,+,+,-,-,-,-,-,-,-,+,-,-,-,+,-,-,-,-,-,-,-,-,+,-,-,-,-,+,-,-,-,-,-,-,+,-,-,-,-,+,-,-,-,-,-,-,-,-,+,-,-,-,-,-,-,+,-,-,-,-,-,-,-,-,-,+
BIPA_ng_u014Bu01C0,ŋǀ,voiced dental nasal-click consonant,ŋǀ,-,-,-,-,-,-,-,-,-,-,+,-,-,-,-,-,-,-,-,-,-,-,+,+,-,-,-,-,-,-,-,-,-,-,+,-,-,-,-,-,-,+,-,-,-,-,-,-,-,-,-,-,-,-,-,-,-,-,-,-,-,-,-,-,-,-,-,-,-,-
BIPA_oi_u0254u026A,ɔɪ,from rounded open-mid back to unrounded near-close near-front diphthong,ɔɪ,+,-,-,+,-,+,-,-,-,-,-,-,-,+,-,+,-,+,-,-,-,-,-,-,-,-,-,-,-,-,-,+,-,-,-,-,-,-,-,-,-,-,-,+,-,-,-,-,-,-,-,-,+,-,+,-,-,-,-,+,-,-,-,-,-,-,-,-,+,-
BIPA_zj_u007Au032Au02B2,z̪ʲ,palatalized voiced dental sibilant fricative consonant,z̪ʲ,-,-,-,-,-,-,-,-,-,-,-,-,-,-,-,-,-,-,-,-,-,-,+,+,+,-,-,-,-,-,-,-,-,-,-,-,+,-,-,-,-,-,-,-,-,-,+,-,-,-,-,-,-,-,-,-,-,-,-,-,-,-,-,-,-,-,+,-,-,-
BIPA_nts_u006Eu0074u0073,nts,from voiced alveolar nasal to voiceless alveolar sibilant affricate cluster,nts,-,-,-,-,-,-,-,-,-,+,-,-,+,-,-,-,-,-,-,-,-,-,-,-,+,-,-,-,-,-,-,-,-,+,-,+,-,-,-,-,-,-,-,-,-,-,+,-,-,-,-,-,-,+,-,-,-,-,-,-,-,-,-,-,+,-,-,-,-,-
BIPA_ue_u0075u0065,ue,from rounded close back to unrounded close-mid front diphthong,ue,-,-,-,-,-,+,-,-,-,-,-,-,-,+,-,+,-,+,-,-,-,-,-,-,-,-,+,-,-,-,-,+,-,-,-,-,-,-,-,-,-,-,-,+,-,-,-,-,-,-,-,-,+,-,-,-,-,-,-,+,-,-,-,-,-,-,-,-,+,+
BIPA_au_u00E3u0169,ãũ,from nasalized unrounded open front to nasalized rounded close back diphthong,ãũ,-,-,-,+,+,+,-,-,-,-,-,-,-,-,-,-,-,+,+,-,-,-,-,-,-,-,-,-,-,-,-,-,-,-,-,-,-,-,+,-,-,-,-,+,-,-,-,-,+,-,-,-,+,-,-,-,-,-,-,+,-,-,+,-,-,-,-,-,-,-
BIPA_mbb_u006Du0062u03B2,mbβ,pre-nasalized voiced bilabial affricate consonant,ⁿbβ,-,-,-,-,-,-,-,-,-,-,-,-,+,-,-,-,-,-,-,-,-,-,-,+,+,-,-,-,-,-,-,-,-,-,-,-,-,-,-,-,-,-,-,-,-,-,-,-,-,-,-,-,-,-,-,-,+,-,-,-,-,-,-,-,+,-,-,-,-,-
BIPA_w_u026Fu02D0,ɯː,long unrounded close back vowel,ɯː,-,-,-,-,-,+,-,-,-,-,-,-,-,-,-,-,-,-,-,+,-,-,-,-,-,-,-,-,-,-,-,-,-,-,-,-,-,-,-,-,-,-,-,+,-,-,-,-,-,-,-,-,+,-,-,-,-,-,-,-,-,-,-,-,-,-,-,-,-,-
BIPA_tp_u0074u0070,tp,voiceless alveolar-and-bilabial stop consonant,tp,-,-,-,-,-,-,-,-,-,-,-,-,-,-,-,-,-,-,-,-,-,-,-,-,+,-,-,-,-,-,-,-,-,-,-,+,-,-,-,-,-,-,-,-,-,-,-,-,-,-,-,-,-,-,-,-,+,+,-,-,-,+,-,-,-,-,-,-,-,-
BIPA_ng_u014Bu0325u01C2u0294,ŋ̥ǂʔ,pre-nasalized glottalized voiceless palatal click consonant,ⁿǂˀ,-,-,-,-,-,-,-,-,-,-,+,-,-,-,-,-,-,-,-,-,-,-,-,-,-,-,-,-,-,-,-,-,-,-,+,+,-,-,-,-,-,+,+,-,-,-,-,-,-,-,-,-,-,-,-,-,-,+,-,-,-,-,-,+,-,-,-,-,-,-
BIPA_ngmkp_u014Bu006Du006Bu0070,ŋmkp,from pre-nasalized voiceless velar stop to voiceless bilabial stop cluster,ⁿkp,-,-,-,-,-,-,-,-,-,-,-,-,+,-,-,-,-,-,-,-,-,-,-,-,+,-,-,-,-,-,-,-,-,-,+,+,-,-,-,-,-,-,-,-,-,-,-,-,-,-,-,-,-,-,-,-,+,+,-,-,-,-,-,-,-,-,-,-,-,-
BIPA_pj_u0070u02B2,pʲ,palatalized voiceless bilabial stop consonant,pʲ,-,-,-,-,-,-,-,-,-,-,-,-,-,-,-,-,-,-,-,-,-,-,-,-,+,-,-,-,-,-,-,-,-,-,-,+,+,-,-,-,-,-,-,-,-,-,-,-,-,-,-,-,-,-,-,-,+,+,-,-,-,-,-,-,-,-,-,-,-,-
BIPA_n_u006Eu0330,n̰,creaky voiced alveolar nasal consonant,n̰,-,-,-,-,-,-,-,-,-,+,+,-,-,-,-,-,-,-,-,-,-,-,-,+,+,-,-,-,-,-,-,-,-,+,-,-,-,-,-,-,+,-,-,-,-,-,-,-,-,-,-,-,-,+,-,-,-,-,-,-,-,-,-,-,-,-,-,-,-,-
BIPA_a_u0252,ɒ,rounded open back vowel,ɒ,-,-,-,-,-,-,-,-,-,-,-,-,-,-,-,-,-,+,-,-,-,-,-,-,-,-,-,-,-,-,-,-,-,-,-,-,-,-,-,-,-,-,-,-,-,-,-,-,+,-,-,-,+,-,-,-,-,-,-,-,-,-,-,-,-,-,-,-,-,-
BIPA_tsjh_u0074u0073u02B2u02B0,tsʲʰ,palatalized aspirated voiceless alveolar sibilant affricate consonant,tsʲʰ,-,-,-,-,-,-,-,-,-,+,-,-,-,-,-,-,-,-,-,-,-,-,-,-,+,-,-,-,-,-,-,-,-,+,-,+,+,-,-,-,-,-,-,-,-,-,+,-,-,-,+,-,-,+,-,-,-,-,-,-,-,-,-,-,+,-,-,-,-,-
BIPA_d_u0256u0330,ɖ̰,creaky voiced retroflex stop consonant,ɖ̰,-,-,-,-,-,-,-,-,-,-,-,-,-,-,-,-,-,-,-,-,-,-,-,+,+,-,-,-,-,-,-,-,-,-,-,-,-,-,-,-,+,-,-,-,-,-,-,+,-,-,-,-,-,-,-,-,-,+,-,-,-,-,-,-,-,-,-,-,-,-
BIPA_nm_u006Eu006D,nm,voiced alveolar-and-bilabial nasal consonant,nm,-,-,-,-,-,-,-,-,-,-,+,-,-,-,-,-,-,-,-,-,-,-,-,+,+,-,-,-,-,-,-,-,-,-,-,-,-,-,-,-,-,-,-,-,-,-,-,-,-,-,-,-,-,-,-,-,+,-,-,-,-,+,-,-,-,-,-,-,-,-
BIPA_hk_u02B0u006B,ʰk,pre-aspirated voiceless velar stop consonant,ʰk,-,-,-,-,-,-,-,-,-,-,-,-,-,-,-,-,-,-,-,-,-,-,-,-,+,-,-,-,-,-,-,-,-,-,+,+,-,-,-,-,-,-,-,-,-,-,-,-,-,-,-,-,-,-,-,-,-,+,-,-,-,-,-,-,-,+,-,-,-,-
BIPA_l_u029F,ʟ,voiced velar lateral approximant consonant,ʟ,-,-,-,-,-,-,-,-,-,-,-,-,-,-,-,-,-,-,-,-,+,-,-,+,+,-,-,-,-,-,-,-,-,-,+,-,-,-,-,-,-,-,-,-,-,+,-,-,-,-,-,-,-,-,-,-,-,-,-,-,-,-,-,-,-,-,-,-,-,-
BIPA_o_u00F8u0306,ø̆,ultra-short rounded close-mid front vowel,ø̆,-,-,-,-,-,-,-,-,-,-,-,-,-,+,-,-,-,+,-,-,-,-,-,-,-,-,+,-,-,-,-,+,-,-,-,-,-,-,-,-,-,-,-,-,-,-,-,-,-,+,-,-,-,-,-,-,-,-,-,-,-,-,-,-,-,-,-,-,-,-
BIPA_pf_u0070u0066,pf,voiceless labio-dental affricate consonant,pf,-,-,-,-,-,-,-,-,-,-,-,-,-,-,-,-,-,-,-,-,-,-,-,-,+,-,-,-,-,+,-,-,-,-,-,+,-,-,-,-,-,-,-,-,-,-,-,-,-,-,-,-,-,-,-,-,+,-,-,-,-,-,-,-,+,-,-,-,-,-
BIPA_h_u0068u0303,h̃,nasalized voiceless glottal fricative consonant,h̃,-,-,-,-,-,-,-,-,-,-,-,-,-,-,-,-,-,-,+,-,-,-,-,-,+,-,-,-,-,-,-,-,-,-,-,+,-,-,-,-,-,-,-,-,-,-,-,-,-,-,-,-,-,-,-,-,-,-,-,-,-,-,-,+,-,-,+,-,-,-
BIPA_ndz_u006Eu0320u0064u0320u0291,n̠d̠ʑ,pre-nasalized voiced alveolo-palatal sibilant affricate consonant,ⁿdʑ,-,-,-,-,-,-,-,-,-,-,-,-,+,-,-,-,-,-,-,-,-,-,-,+,+,-,-,-,+,-,-,-,-,-,-,-,+,-,-,-,-,-,-,-,-,-,+,-,-,-,-,-,-,-,-,-,-,-,-,-,-,-,-,-,+,-,-,+,-,-
BIPA_kw_u006Bu02B7,kʷ,labialized voiceless velar stop consonant,kʷ,-,-,-,-,-,-,-,-,-,-,-,-,-,-,-,-,-,-,-,-,-,-,-,-,+,-,-,+,-,-,-,-,-,-,+,+,-,-,-,-,-,-,-,-,-,-,-,-,-,-,-,-,-,-,-,-,-,+,-,-,-,-,-,-,-,-,-,-,-,-
BIPA_s_u0073u032Au02E4,s̪ˤ,pharyngealized voiceless dental sibilant fricative consonant,s̪ˤ,-,-,+,-,-,-,-,-,-,-,-,-,-,-,-,-,-,-,-,-,-,-,+,-,+,-,-,-,-,-,-,-,-,-,-,+,-,-,-,-,-,-,-,-,-,-,+,-,-,-,-,-,-,-,-,-,-,-,-,-,-,-,-,-,-,-,+,-,-,-
BIPA_m_u006D,m,voiced bilabial nasal consonant,m,-,-,-,-,-,-,-,-,-,-,+,-,-,-,-,-,-,-,-,-,-,-,-,+,+,-,-,-,-,-,-,-,-,-,-,-,-,-,-,-,-,-,-,-,-,-,-,-,-,-,-,-,-,-,-,-,+,-,-,-,-,-,-,-,-,-,-,-,-,-
BIPA_l_u006Cu02E4,lˤ,pharyngealized voiced alveolar lateral approximant consonant,lˤ,-,-,+,-,-,-,-,-,-,+,-,-,-,-,-,-,-,-,-,-,+,-,-,+,+,-,-,-,-,-,-,-,-,+,-,-,-,-,-,-,-,-,-,-,-,+,-,-,-,-,-,-,-,+,-,-,-,-,-,-,-,-,-,-,-,-,-,-,-,-
UNK_dl_u0064u006C,dl,,,-,-,-,-,-,-,-,-,-,-,-,-,-,-,-,-,-,-,-,-,+,-,-,+,+,-,-,-,-,-,-,-,-,-,-,-,-,-,-,-,-,-,-,-,-,+,-,-,-,-,-,-,-,-,-,-,-,+,-,-,-,+,-,-,-,-,-,-,-,-
BIPA_u_u0075,u,rounded close back vowel,u,-,-,-,-,-,+,-,-,-,-,-,-,-,-,-,-,-,+,-,-,-,-,-,-,-,-,-,-,-,-,-,-,-,-,-,-,-,-,-,-,-,-,-,-,-,-,-,-,-,-,-,-,+,-,-,-,-,-,-,-,-,-,-,-,-,-,-,-,-,-
BIPA_b_u0253,ɓ,voiced bilabial implosive consonant,ɓ,-,-,-,-,-,-,-,-,-,-,-,-,-,-,-,-,+,-,-,-,-,-,-,+,-,-,-,-,-,-,-,-,-,-,-,-,-,-,-,-,-,-,-,-,-,-,-,-,-,-,-,-,-,-,-,-,+,+,-,-,-,-,-,-,-,-,-,-,-,-
BIPA_n_u0273u0325,ɳ̥,devoiced voiced retroflex nasal consonant,ɳ̊,-,-,-,-,-,-,-,-,-,-,+,-,-,-,-,-,-,-,-,-,-,-,-,-,+,-,-,-,-,-,-,-,-,-,-,+,-,-,-,-,-,-,-,-,-,-,-,+,-,-,-,-,-,-,-,-,-,-,-,-,-,-,-,-,-,-,-,-,-,-
BIPA_n_u0272u0325,ɲ̥,devoiced voiced palatal nasal consonant,ɲ̊,-,-,-,-,-,-,-,-,-,-,+,-,-,-,-,-,-,-,-,-,-,-,-,-,+,-,-,-,-,-,-,-,-,-,-,+,-,-,-,-,-,-,+,-,-,-,-,-,-,-,-,-,-,-,-,-,-,-,-,-,-,-,-,-,-,-,-,-,-,-
BIPA_h_u0266u0303,ɦ̃,nasalized voiced glottal fricative consonant,ɦ̃,-,-,-,-,-,-,-,-,-,-,-,-,-,-,-,-,-,-,+,-,-,-,-,+,+,-,-,-,-,-,-,-,-,-,-,-,-,-,-,-,-,-,-,-,-,-,-,-,-,-,-,-,-,-,-,-,-,-,-,-,-,-,-,+,-,-,+,-,-,-
BIPA_w_u028D,ʍ,voiceless labio-velar approximant consonant,ʍ,-,-,-,-,-,-,-,-,-,-,-,-,-,-,-,-,-,-,-,-,-,-,-,-,+,-,-,-,-,-,-,-,-,-,+,+,-,-,-,-,-,-,-,-,-,+,-,-,-,-,-,-,-,-,-,-,+,-,-,-,-,-,-,-,-,-,-,-,-,-
BIPA_ng_u014Bu01C2,ŋǂ,voiced palatal nasal-click consonant,ŋǂ,-,-,-,-,-,-,-,-,-,-,+,-,-,-,-,-,-,-,-,-,-,-,-,+,-,-,-,-,-,-,-,-,-,-,+,-,-,-,-,-,-,+,+,-,-,-,-,-,-,-,-,-,-,-,-,-,-,-,-,-,-,-,-,-,-,-,-,-,-,-
BIPA_z_u007Au032B,z̫,voiced alveolar whistled-sibilant fricative consonant,z̫,-,-,-,-,-,-,-,-,-,-,-,-,-,-,-,-,-,-,-,-,-,+,-,+,+,-,-,-,-,-,-,-,-,-,-,-,-,-,-,-,-,-,-,-,-,-,+,-,-,-,-,-,-,-,-,-,-,-,-,-,-,+,-,-,-,-,+,-,-,-
BIPA_e_u0065u0259,eə,from unrounded close-mid front to unrounded mid central diphthong,eə,-,-,-,-,+,-,-,-,-,-,-,-,-,+,-,-,-,-,-,-,-,-,-,-,-,-,+,-,-,-,-,+,-,-,-,-,-,-,-,-,-,-,-,+,-,-,-,-,-,-,-,-,-,-,-,-,-,-,-,+,-,-,+,-,-,-,-,-,-,-
BIPA__u028Cu0303u02D0,ʌ̃ː,long nasalized unrounded open-mid back vowel,ʌ̃ː,-,-,-,-,-,-,-,-,-,-,-,-,-,-,-,-,-,-,+,+,-,-,-,-,-,-,-,-,-,-,-,+,-,-,-,-,-,-,-,-,-,-,-,+,-,-,-,-,-,-,-,-,+,-,+,-,-,-,-,-,-,-,-,-,-,-,-,-,-,-
BIPA_i_u026Au02D0,ɪː,long unrounded near-close near-front vowel,ɪː,+,-,-,-,-,+,-,-,-,-,-,-,-,+,-,-,-,-,-,+,-,-,-,-,-,-,-,-,-,-,-,-,-,-,-,-,-,-,-,-,-,-,-,+,-,-,-,-,-,-,-,-,-,-,-,-,-,-,-,-,-,-,-,-,-,-,-,-,-,-
BIPA_n_u0272u0324,ɲ̤,breathy voiced palatal nasal consonant,ɲʱ,-,-,-,-,-,-,-,-,-,-,+,-,-,-,-,-,-,-,-,-,-,-,-,+,+,-,-,-,-,-,-,-,-,-,-,-,-,-,-,-,-,-,+,-,+,-,-,-,-,-,-,-,-,-,-,-,-,-,-,-,-,-,-,-,-,-,-,-,-,-
BIPA_zw_u007Au02B7,zʷ,labialized voiced alveolar sibilant fricative consonant,zʷ,-,-,-,-,-,-,-,-,-,-,-,-,-,-,-,-,-,-,-,-,-,-,-,+,+,-,-,+,-,-,-,-,-,-,-,-,-,-,-,-,-,-,-,-,-,-,+,-,-,-,-,-,-,-,-,-,-,-,-,-,-,+,-,-,-,-,+,-,-,-
BIPA_u_u0075u02D0,uː,long rounded close back vowel,uː,-,-,-,-,-,+,-,-,-,-,-,-,-,-,-,-,-,+,-,+,-,-,-,-,-,-,-,-,-,-,-,-,-,-,-,-,-,-,-,-,-,-,-,-,-,-,-,-,-,-,-,-,+,-,-,-,-,-,-,-,-,-,-,-,-,-,-,-,-,-
BIPA_hts_u02B0u0074u0073,ʰts,pre-aspirated voiceless alveolar sibilant affricate consonant,ʰts,-,-,-,-,-,-,-,-,-,-,-,-,-,-,-,-,-,-,-,-,-,-,-,-,+,-,-,-,-,-,-,-,-,-,-,+,-,-,-,-,-,-,-,-,-,-,+,-,-,-,-,-,-,-,-,-,-,-,-,-,-,+,-,-,+,+,-,-,-,-
BIPA_tlh_u0074u032Au026Cu032Au02B0,t̪ɬ̪ʰ,aspirated voiceless dental lateral affricate consonant,tɬ̪ʰ,-,-,-,-,-,-,-,-,-,-,-,-,-,-,-,-,-,-,-,-,+,-,+,-,+,-,-,-,-,-,-,-,-,-,-,+,-,-,-,-,-,-,-,-,-,-,-,-,-,-,+,-,-,-,-,-,-,-,-,-,-,+,-,-,+,-,-,-,-,-
BIPA_y_u0079u0330,y̰,creaky rounded close front vowel,y̰,-,-,-,-,-,+,-,-,-,-,-,-,-,+,-,-,-,+,-,-,-,-,-,-,-,-,-,-,-,-,-,-,-,-,-,-,-,-,-,-,+,-,-,-,-,-,-,-,-,-,-,-,-,-,-,-,-,-,-,-,-,-,-,-,-,-,-,-,-,-
BIPA_nz_u006Eu032Au007Au032A,n̪z̪,pre-nasalized voiced dental sibilant fricative consonant,ⁿz̪,-,-,-,-,-,-,-,-,-,-,-,-,+,-,-,-,-,-,-,-,-,-,+,+,+,-,-,-,-,-,-,-,-,-,-,-,-,-,-,-,-,-,-,-,-,-,+,-,-,-,-,-,-,-,-,-,-,-,-,-,-,-,-,-,-,-,+,-,-,-
BIPA_s_u0073u0320,s̠,retracted voiceless alveolar sibilant fricative consonant,s̠,-,-,-,-,-,-,-,-,-,-,-,-,-,-,-,-,-,-,-,-,-,-,-,-,+,-,-,-,+,-,-,-,-,-,-,+,-,-,-,-,-,-,-,-,-,-,+,-,-,-,-,-,-,-,-,-,-,-,-,-,-,-,-,-,-,-,+,-,-,-
BIPA_dz_u0064u0291,dʑ,voiced alveolo-palatal sibilant affricate consonant,dʑ,-,-,-,-,-,-,-,-,-,-,-,-,-,-,-,-,-,-,-,-,-,-,-,+,+,-,-,-,-,-,-,-,-,-,-,-,+,-,-,-,-,-,-,-,-,-,+,-,-,-,-,-,-,-,-,-,-,-,-,-,-,-,-,-,+,-,-,+,-,-
BIPA_u_u0075u0259,uə,from rounded close back to unrounded mid central diphthong,uə,-,-,-,-,-,+,-,-,-,-,-,-,-,-,-,+,-,+,-,-,-,-,-,-,-,-,+,-,-,-,-,+,-,-,-,-,-,-,-,-,-,-,-,+,-,-,-,-,-,-,-,-,+,-,-,-,-,-,-,+,-,-,+,-,-,-,-,-,+,+
BIPA_twh_u0074u032Au02B7u02B0,t̪ʷʰ,labialized aspirated voiceless dental stop consonant,t̪ʷʰ,-,-,-,-,-,-,-,-,-,-,-,-,-,-,-,-,-,-,-,-,-,-,+,-,+,-,-,+,-,-,-,-,-,-,-,+,-,-,-,-,-,-,-,-,-,-,-,-,-,-,+,-,-,-,-,-,-,+,-,-,-,-,-,-,-,-,-,-,-,-
BIPA_i_u012D,ĭ,ultra-short unrounded close front vowel,ĭ,-,-,-,-,-,+,-,-,-,-,-,-,-,+,-,-,-,-,-,-,-,-,-,-,-,-,-,-,-,-,-,-,-,-,-,-,-,-,-,-,-,-,-,+,-,-,-,-,-,+,-,-,-,-,-,-,-,-,-,-,-,-,-,-,-,-,-,-,-,-
BIPA_r_u027Du0324,ɽ̤,breathy voiced retroflex tap consonant,ɽʱ,-,-,-,-,-,-,-,+,-,-,-,-,-,-,-,-,-,-,-,-,-,-,-,+,+,-,-,-,-,-,-,-,-,-,-,-,-,-,-,-,-,-,-,-,+,-,-,+,-,-,-,-,-,-,-,-,-,-,-,-,-,-,-,-,-,-,-,-,-,-
BIPA_iu_u0069u0264,iɤ,from unrounded close front to unrounded close-mid back diphthong,iɤ,-,-,-,-,+,+,-,-,-,-,-,-,-,+,-,-,-,-,-,-,-,-,-,-,-,-,+,-,-,-,-,+,-,-,-,-,-,-,-,-,-,-,-,+,-,-,-,-,-,-,-,-,+,-,-,-,-,-,-,+,-,-,-,-,-,-,-,-,-,+
BIPA_k_u006Bu01C1u0294,kǁʔ,from voiceless lateral click to voiceless glottal stop cluster,ǁʔ,-,-,-,-,-,-,-,-,-,-,-,-,-,-,-,-,-,-,-,-,+,-,-,-,-,-,-,-,-,-,-,-,-,-,+,+,-,-,-,-,-,+,-,-,-,-,-,-,-,-,-,-,-,-,-,-,-,+,-,-,-,+,-,+,-,-,-,-,-,-
BIPA_dzj_u0064u032Au007Au032Au02B2,d̪z̪ʲ,palatalized voiced dental sibilant affricate consonant,dz̪ʲ,-,-,-,-,-,-,-,-,-,-,-,-,-,-,-,-,-,-,-,-,-,-,+,+,+,-,-,-,-,-,-,-,-,-,-,-,+,-,-,-,-,-,-,-,-,-,+,-,-,-,-,-,-,-,-,-,-,-,-,-,-,+,-,-,+,-,-,-,-,-
BIPA_wi_u026Fu0069,ɯi,from unrounded close back to unrounded close front diphthong,ɯi,-,-,-,-,-,+,-,-,-,-,-,-,-,+,-,+,-,-,-,-,-,-,-,-,-,-,-,-,-,-,-,-,-,-,-,-,-,-,-,-,-,-,-,+,-,-,-,-,-,-,-,-,+,-,-,-,-,-,-,+,-,-,-,-,-,-,-,-,-,-
BIPA_ii_u0268u0069,ɨi,from unrounded close central to unrounded close front diphthong,ɨi,-,-,-,-,-,+,-,-,-,-,-,-,-,+,-,+,-,-,-,-,-,-,-,-,-,-,-,-,-,-,-,-,-,-,-,-,-,-,-,-,-,-,-,+,-,-,-,-,-,-,-,-,-,-,-,-,-,-,-,+,-,-,+,-,-,-,-,-,-,-
BIPA_o_u0275u02D0,ɵː,long rounded close-mid central vowel,ɵː,-,-,-,-,-,-,-,-,-,-,-,-,-,-,-,-,-,+,-,+,-,-,-,-,-,-,+,-,-,-,-,+,-,-,-,-,-,-,-,-,-,-,-,-,-,-,-,-,-,-,-,-,-,-,-,-,-,-,-,-,-,-,+,-,-,-,-,-,-,-
BIPA_g_u0263,ɣ,voiced velar fricative consonant,ɣ,-,-,-,-,-,-,-,-,-,-,-,-,-,-,-,-,-,-,-,-,-,-,-,+,+,-,-,-,-,-,-,-,-,-,+,-,-,-,-,-,-,-,-,-,-,-,-,-,-,-,-,-,-,-,-,-,-,-,-,-,-,-,-,-,-,-,+,-,-,-
BIPA_ngh_u014Bu0325u01C2u0068u0303,ŋ̥ǂh̃,pre-nasalized aspirated voiceless palatal click consonant,ⁿǂʰ,-,-,-,-,-,-,-,-,-,-,+,-,-,-,-,-,-,-,+,-,-,-,-,-,-,-,-,-,-,-,-,-,-,-,+,+,-,-,-,-,-,+,+,-,-,-,-,-,-,-,-,-,-,-,-,-,-,-,-,-,-,-,-,+,-,-,+,-,-,-
BIPA_dz_u0064u007A,dz,voiced alveolar sibilant affricate consonant,dz,-,-,-,-,-,-,-,-,-,+,-,-,-,-,-,-,-,-,-,-,-,-,-,+,+,-,-,-,-,-,-,-,-,+,-,-,-,-,-,-,-,-,-,-,-,-,+,-,-,-,-,-,-,+,-,-,-,-,-,-,-,-,-,-,+,-,-,-,-,-
BIPA_ngx_u014Bu0325u01C1u0078,ŋ̥ǁx,pre-nasalized voiceless lateral click consonant,ⁿǁ,-,-,-,-,-,-,-,-,-,-,+,-,-,-,-,-,-,-,-,-,+,-,-,-,-,-,-,-,-,-,-,-,-,-,+,+,-,-,-,-,-,+,-,-,-,-,-,-,-,-,-,-,-,-,-,-,-,-,-,-,-,+,-,-,-,-,+,-,-,-
BIPA_rj_u0280u02B2,ʀʲ,palatalized voiced uvular trill consonant,ʀʲ,-,-,-,-,-,-,-,-,-,-,-,-,-,-,-,-,-,-,-,-,-,-,-,+,+,+,-,-,-,-,-,-,-,-,-,-,+,+,-,-,-,-,-,-,-,-,-,-,-,-,-,-,-,-,-,-,-,-,-,-,-,-,-,-,-,-,-,-,-,-
BIPA_e_u0065,e,unrounded close-mid front vowel,e,-,-,-,-,-,-,-,-,-,-,-,-,-,+,-,-,-,-,-,-,-,-,-,-,-,-,-,-,-,-,-,+,-,+,-,-,-,-,-,-,-,-,-,+,-,-,-,-,-,-,-,-,-,-,-,-,-,-,-,-,-,-,-,-,-,-,-,-,-,-
BIPA_u_u0075u0325,u̥,devoiced rounded close back vowel,u̥,-,-,-,-,-,+,-,-,-,-,-,-,-,-,-,-,-,+,-,-,-,-,-,-,-,-,-,-,-,-,-,-,-,-,-,+,-,-,-,-,-,-,-,-,-,-,-,-,-,-,-,-,+,-,-,-,-,-,-,-,-,-,-,-,-,-,-,-,-,-
BIPA_bb_u0062u03B2,bβ,voiced bilabial affricate consonant,bβ,-,-,-,-,-,-,-,-,-,-,-,-,-,-,-,-,-,-,-,-,-,-,-,+,+,-,-,-,-,-,-,-,-,-,-,-,-,-,-,-,-,-,-,-,-,-,-,-,-,-,-,-,-,-,-,-,+,-,-,-,-,-,-,-,+,-,-,-,-,-
BIPA_ntsh_u006Eu032Au0074u032Au0073u032Au02B0,n̪t̪s̪ʰ,pre-nasalized aspirated voiceless dental sibilant affricate consonant,ⁿts̪ʰ,-,-,-,-,-,-,-,-,-,-,-,-,+,-,-,-,-,-,-,-,-,-,-,-,+,-,-,-,-,-,-,-,-,-,-,+,-,-,-,-,-,-,-,-,-,-,+,-,-,-,+,-,-,-,-,-,-,-,-,-,-,+,-,-,+,-,-,-,-,-
BIPA_gw_u0262u02B7,ɢʷ,labialized voiced uvular stop consonant,ɢʷ,-,-,-,-,-,-,-,-,-,-,-,-,-,-,-,-,-,-,-,-,-,-,-,+,+,+,-,+,-,-,-,-,-,-,-,-,-,-,-,-,-,-,-,-,-,-,-,-,-,-,-,-,-,-,-,-,-,+,-,-,-,-,-,-,-,-,-,-,-,-
BIPA_dz_u0256u0290,ɖʐ,voiced retroflex sibilant affricate consonant,ɖʐ,-,-,-,-,-,-,-,-,-,-,-,-,-,-,-,-,-,-,-,-,-,-,-,+,+,-,-,-,-,-,-,-,-,-,-,-,-,-,-,-,-,-,-,-,-,-,+,+,-,-,-,-,-,-,-,-,-,-,-,-,-,-,-,-,+,-,-,-,-,-
BIPA_g_u0261u01C1,ɡǁ,voiced lateral click consonant,gǁ,-,-,-,-,-,-,-,-,-,-,-,-,-,-,-,-,-,-,-,-,+,-,-,+,-,-,-,-,-,-,-,-,-,-,+,-,-,-,-,-,-,+,-,-,-,-,-,-,-,-,-,-,-,-,-,-,-,+,-,-,-,+,-,-,-,-,-,-,-,-
BIPA_e_u025Cu02D0,ɜː,long unrounded open-mid central vowel,ɜː,-,-,-,-,-,-,-,-,-,-,-,-,-,-,-,-,-,-,-,+,-,-,-,-,-,-,-,-,-,-,-,+,-,-,-,-,-,-,-,-,-,-,-,+,-,-,-,-,-,-,-,-,-,-,+,-,-,-,-,-,-,-,+,-,-,-,-,-,-,-
BIPA_m_u006Du02E4,mˤ,pharyngealized voiced bilabial nasal consonant,mˤ,-,-,+,-,-,-,-,-,-,-,+,-,-,-,-,-,-,-,-,-,-,-,-,+,+,-,-,-,-,-,-,-,-,-,-,-,-,-,-,-,-,-,-,-,-,-,-,-,-,-,-,-,-,-,-,-,+,-,-,-,-,-,-,-,-,-,-,-,-,-
BIPA_fj_u0066u02B2,fʲ,palatalized voiceless labio-dental fricative consonant,fʲ,-,-,-,-,-,-,-,-,-,-,-,-,-,-,-,-,-,-,-,-,-,-,-,-,+,-,-,-,-,+,-,-,-,-,-,+,+,-,-,-,-,-,-,-,-,-,-,-,-,-,-,-,-,-,-,-,-,-,-,-,-,-,-,-,-,-,+,-,-,-
BIPA_b_u0062,b,voiced bilabial stop consonant,b,-,-,-,-,-,-,-,-,-,-,-,-,-,-,-,-,-,-,-,-,-,-,-,+,+,-,-,-,-,-,-,-,-,-,-,-,-,-,-,-,-,-,-,-,-,-,-,-,-,-,-,-,-,-,-,-,+,+,-,-,-,-,-,-,-,-,-,-,-,-
BIPA_ai_u0061u0069,ai,from unrounded open front to unrounded close front diphthong,ai,-,-,-,+,-,+,-,-,-,-,-,-,-,+,-,+,-,-,-,-,-,-,-,-,-,-,-,-,-,-,-,-,-,-,-,-,-,-,-,-,-,-,-,+,-,-,-,-,+,-,-,-,-,-,-,-,-,-,-,+,-,-,+,-,-,-,-,-,-,-
BIPA_uo_u0075u006F,uo,from rounded close back to rounded close-mid back diphthong,uo,-,-,-,-,-,+,-,-,-,-,-,-,-,-,-,-,-,+,-,-,-,-,-,-,-,-,+,-,-,-,-,+,-,-,-,-,-,-,-,-,-,-,-,-,-,-,-,-,-,-,-,-,+,-,-,-,-,-,-,+,-,-,-,-,-,-,-,-,-,+
