ID,Name,Description,BIPA,lowered,rhotic,pharyngealized,rising,backing,high,rhotacized,tapflap,velarized,place,nasal,ejective,prenasalized,front,release,fronting,implosive,rounded,nasalized,long,lateral,whistled,dental,voiced,pulmonic,uvular,higher,labialized,retracted,labiodental,pharyngeal,mid,nasalizing,unspecified,velar,voiceless,palatalized,trill,rounding,supra,laryngealized,click,palatal,unrounded,breathy,approximant,sibilant,retroflex,low,overshort,aspirated,epiglottal,back,coronal,lower,trilled,bilabial,stop,prestopped,diphtong,raised,alveolar,central,glottal,affricate,preaspirated,fricative,palatoalveolar,unrounding,lowering
BIPA_tj_u0074u0320u02B2,t̠ʲ,palatalized voiceless post-alveolar stop consonant,t̠ʲ,-,-,-,-,-,-,-,-,-,-,-,-,-,-,-,-,-,-,-,-,-,-,-,-,+,-,-,-,+,-,-,-,-,-,-,+,+,-,-,-,-,-,-,-,-,-,-,-,-,-,-,-,-,-,-,-,-,+,-,-,-,-,-,-,-,-,-,-,-,-
BIPA_kw_u006Bu02B7u02BC,kʷʼ,labialized voiceless velar ejective stop consonant,kʼʷ,-,-,-,-,-,-,-,-,-,-,-,+,-,-,-,-,-,-,-,-,-,-,-,-,-,-,-,+,-,-,-,-,-,-,+,-,-,-,-,-,-,-,-,-,-,-,-,-,-,-,-,-,-,-,-,-,-,+,-,-,-,-,-,-,-,-,-,-,-,-
BIPA_h_u0127,ħ,voiceless pharyngeal fricative consonant,ħ,-,-,-,-,-,-,-,-,-,-,-,-,-,-,-,-,-,-,-,-,-,-,-,-,+,-,-,-,-,-,+,-,-,-,-,+,-,-,-,-,-,-,-,-,-,-,-,-,-,-,-,-,-,-,-,-,-,-,-,-,-,-,-,-,-,-,+,-,-,-
BIPA_bg_u03B2u031Eu02E0,β̞ˠ,velarized voiced bilabial approximant consonant,β̞ˠ,-,-,-,-,-,-,-,-,+,-,-,-,-,-,-,-,-,-,-,-,-,-,-,+,+,-,-,-,-,-,-,-,-,-,-,-,-,-,-,-,-,-,-,-,-,+,-,-,-,-,-,-,-,-,-,-,+,-,-,-,-,-,-,-,-,-,-,-,-,-
BIPA_ng_u006Eu032Au02E0,n̪ˠ,velarized voiced dental nasal consonant,n̪ˠ,-,-,-,-,-,-,-,-,+,-,+,-,-,-,-,-,-,-,-,-,-,-,+,+,+,-,-,-,-,-,-,-,-,-,-,-,-,-,-,-,-,-,-,-,-,-,-,-,-,-,-,-,-,-,-,-,-,-,-,-,-,-,-,-,-,-,-,-,-,-
BIPA_tpj_u0074u0320u0070u02B2,t̠pʲ,from voiceless post-alveolar stop to palatalized voiceless bilabial stop cluster,t̠pʲ,-,-,-,-,-,-,-,-,-,-,-,-,-,-,-,-,-,-,-,-,-,-,-,-,+,-,-,-,+,-,-,-,-,-,-,+,+,-,-,-,-,-,-,-,-,-,-,-,-,-,-,-,-,-,-,-,+,+,-,-,-,-,-,-,-,-,-,-,-,-
BIPA_n_u006Eu0325,n̥,devoiced voiced alveolar nasal consonant,n̥,-,-,-,-,-,-,-,-,-,+,+,-,-,-,-,-,-,-,-,-,-,-,-,-,+,-,-,-,-,-,-,-,-,+,-,+,-,-,-,-,-,-,-,-,-,-,-,-,-,-,-,-,-,+,-,-,-,-,-,-,-,-,-,-,-,-,-,-,-,-
BIPA_au_u0061u0289,aʉ,from unrounded open front to rounded close central diphthong,aʉ,-,-,-,+,-,+,-,-,-,-,-,-,-,-,-,-,-,+,-,-,-,-,-,-,-,-,-,-,-,-,-,-,-,-,-,-,-,-,+,-,-,-,-,+,-,-,-,-,+,-,-,-,-,-,-,-,-,-,-,+,-,-,+,-,-,-,-,-,-,-
BIPA_f_u0278,ɸ,voiceless bilabial fricative consonant,ɸ,-,-,-,-,-,-,-,-,-,-,-,-,-,-,-,-,-,-,-,-,-,-,-,-,+,-,-,-,-,-,-,-,-,-,-,+,-,-,-,-,-,-,-,-,-,-,-,-,-,-,-,-,-,-,-,-,+,-,-,-,-,-,-,-,-,-,+,-,-,-
BIPA_g_u0262,ɢ,voiced uvular stop consonant,ɢ,-,-,-,-,-,-,-,-,-,-,-,-,-,-,-,-,-,-,-,-,-,-,-,+,+,+,-,-,-,-,-,-,-,-,-,-,-,-,-,-,-,-,-,-,-,-,-,-,-,-,-,-,-,-,-,-,-,+,-,-,-,-,-,-,-,-,-,-,-,-
BIPA_o_u006Fu0324,o̤,breathy rounded close-mid back vowel,o̤,-,-,-,-,-,-,-,-,-,-,-,-,-,-,-,-,-,+,-,-,-,-,-,+,-,-,+,-,-,-,-,+,-,-,-,-,-,-,-,-,-,-,-,-,+,-,-,-,-,-,-,-,+,-,-,-,-,-,-,-,-,-,-,-,-,-,-,-,-,-
BIPA_s_u0073,s,voiceless alveolar sibilant fricative consonant,s,-,-,-,-,-,-,-,-,-,+,-,-,-,-,-,-,-,-,-,-,-,-,-,-,+,-,-,-,-,-,-,-,-,+,-,+,-,-,-,-,-,-,-,-,-,-,+,-,-,-,-,-,-,+,-,-,-,-,-,-,-,-,-,-,-,-,+,-,-,-
BIPA_i_u0268u031E,ɨ̞,lowered unrounded close central vowel,ɨ̞,+,-,-,-,-,+,-,-,-,-,-,-,-,-,-,-,-,-,-,-,-,-,-,-,-,-,-,-,-,-,-,-,-,-,-,-,-,-,-,-,-,-,-,+,-,-,-,-,-,-,-,-,-,-,-,-,-,-,-,-,-,-,+,-,-,-,-,-,-,-
BIPA__u028Cu0303,ʌ̃,nasalized unrounded open-mid back vowel,ʌ̃,-,-,-,-,-,-,-,-,-,-,-,-,-,-,-,-,-,-,+,-,-,-,-,-,-,-,-,-,-,-,-,+,-,-,-,-,-,-,-,-,-,-,-,+,-,-,-,-,-,-,-,-,+,-,+,-,-,-,-,-,-,-,-,-,-,-,-,-,-,-
BIPA_mbw_u006Du0062u02B7,mbʷ,pre-nasalized labialized voiced bilabial stop consonant,ⁿbʷ,-,-,-,-,-,-,-,-,-,-,-,-,+,-,-,-,-,-,-,-,-,-,-,+,+,-,-,+,-,-,-,-,-,-,-,-,-,-,-,-,-,-,-,-,-,-,-,-,-,-,-,-,-,-,-,-,+,+,-,-,-,-,-,-,-,-,-,-,-,-
BIPA_ei_u025Bu0069,ɛi,from unrounded open-mid front to unrounded close front diphthong,ɛi,-,-,-,+,-,+,-,-,-,-,-,-,-,+,-,-,-,-,-,-,-,-,-,-,-,-,-,-,-,-,-,+,-,-,-,-,-,-,-,-,-,-,-,+,-,-,-,-,-,-,-,-,-,-,+,-,-,-,-,+,-,-,-,-,-,-,-,-,-,-
BIPA_d_u0064u0320,d̠,voiced post-alveolar stop consonant,d̠,-,-,-,-,-,-,-,-,-,-,-,-,-,-,-,-,-,-,-,-,-,-,-,+,+,-,-,-,-,-,-,-,-,-,-,-,-,-,-,-,-,-,-,-,-,-,-,-,-,-,-,-,-,-,-,-,-,+,-,-,-,-,-,-,-,-,-,+,-,-
BIPA_g_u029B,ʛ,voiced uvular implosive consonant,ʛ,-,-,-,-,-,-,-,-,-,-,-,-,-,-,-,-,+,-,-,-,-,-,-,+,-,+,-,-,-,-,-,-,-,-,-,-,-,-,-,-,-,-,-,-,-,-,-,-,-,-,-,-,-,-,-,-,-,+,-,-,-,-,-,-,-,-,-,-,-,-
BIPA_i_u1E2Du0303u0259u0330u0303,ḭ̃ə̰̃,from nasalized creaky unrounded close front to nasalized creaky unrounded mid central diphthong,ḭ̃ə̰̃,-,-,-,-,+,+,-,-,-,-,-,-,-,+,-,-,-,-,-,-,-,-,-,-,-,-,+,-,-,-,-,+,+,-,-,-,-,-,-,-,+,-,-,+,-,-,-,-,-,-,-,-,-,-,-,-,-,-,-,+,-,-,+,-,-,-,-,-,-,+
BIPA_a_u0061,a,unrounded open front vowel,a,-,-,-,-,-,-,-,-,-,-,-,-,-,-,-,-,-,-,-,-,-,-,-,-,-,-,-,-,-,-,-,-,-,-,-,-,-,-,-,-,-,-,-,+,-,-,-,-,+,-,-,-,-,-,-,-,-,-,-,-,-,-,+,-,-,-,-,-,-,-
BIPA_u_u1E73,ṳ,breathy rounded close back vowel,ṳ,-,-,-,-,-,+,-,-,-,-,-,-,-,-,-,-,-,+,-,-,-,-,-,+,-,-,-,-,-,-,-,-,-,-,-,-,-,-,-,-,-,-,-,-,+,-,-,-,-,-,-,-,+,-,-,-,-,-,-,-,-,-,-,-,-,-,-,-,-,-
BIPA_ui_u028Au0069,ʊi,from rounded near-close near-back to unrounded close front diphthong,ʊi,+,-,-,+,-,+,-,-,-,-,-,-,-,+,-,+,-,+,-,-,-,-,-,-,-,-,-,-,-,-,-,-,-,-,-,-,-,-,-,-,-,-,-,+,-,-,-,-,-,-,-,-,+,-,-,-,-,-,-,+,-,-,-,-,-,-,-,-,+,-
BIPA_q_u0071u02BC,qʼ,voiceless uvular ejective stop consonant,qʼ,-,-,-,-,-,-,-,-,-,-,-,+,-,-,-,-,-,-,-,-,-,-,-,-,-,+,-,-,-,-,-,-,-,-,-,-,-,-,-,-,-,-,-,-,-,-,-,-,-,-,-,-,-,-,-,-,-,+,-,-,-,-,-,-,-,-,-,-,-,-
BIPA_tch_u0074u00E7u02B0,tçʰ,aspirated voiceless alveolo-palatal sibilant affricate consonant,tɕʰ,-,-,-,-,-,-,-,-,-,-,-,-,-,-,-,-,-,-,-,-,-,-,-,-,+,-,-,-,-,-,-,-,-,-,-,+,-,-,-,-,-,-,+,-,-,-,-,-,-,-,+,-,-,-,-,-,-,-,-,-,-,+,-,-,+,-,-,-,-,-
BIPA_g_u0261u0330,ɡ̰,creaky voiced velar stop consonant,g̰,-,-,-,-,-,-,-,-,-,-,-,-,-,-,-,-,-,-,-,-,-,-,-,+,+,-,-,-,-,-,-,-,-,-,+,-,-,-,-,-,+,-,-,-,-,-,-,-,-,-,-,-,-,-,-,-,-,+,-,-,-,-,-,-,-,-,-,-,-,-
BIPA_l_u026Cu02BC,ɬʼ,voiceless alveolar ejective lateral fricative consonant,ɬʼ,-,-,-,-,-,-,-,-,-,-,-,+,-,-,-,-,-,-,-,-,+,-,-,-,-,-,-,-,-,-,-,-,-,-,-,-,-,-,-,-,-,-,-,-,-,-,-,-,-,-,-,-,-,-,-,-,-,-,-,-,-,+,-,-,-,-,+,-,-,-
BIPA_kh_u03C7u02E4,χˤ,pharyngealized voiceless uvular fricative consonant,χˤ,-,-,+,-,-,-,-,-,-,-,-,-,-,-,-,-,-,-,-,-,-,-,-,-,+,+,-,-,-,-,-,-,-,-,-,+,-,-,-,-,-,-,-,-,-,-,-,-,-,-,-,-,-,-,-,-,-,-,-,-,-,-,-,-,-,-,+,-,-,-
BIPA_i_u0268u0303,ɨ̃,nasalized unrounded close central vowel,ɨ̃,-,-,-,-,-,+,-,-,-,-,-,-,-,-,-,-,-,-,+,-,-,-,-,-,-,-,-,-,-,-,-,-,-,-,-,-,-,-,-,-,-,-,-,+,-,-,-,-,-,-,-,-,-,-,-,-,-,-,-,-,-,-,+,-,-,-,-,-,-,-
BIPA_ng_u014Bu0325u01C1u0294,ŋ̥ǁʔ,pre-nasalized glottalized voiceless lateral click consonant,ⁿǁˀ,-,-,-,-,-,-,-,-,-,-,+,-,-,-,-,-,-,-,-,-,+,-,-,-,-,-,-,-,-,-,-,-,-,-,+,+,-,-,-,-,-,+,-,-,-,-,-,-,-,-,-,-,-,-,-,-,-,+,-,-,-,+,-,+,-,-,-,-,-,-
BIPA_a_u00E3u0330,ã̰,nasalized creaky unrounded open front vowel,ã̰,-,-,-,-,-,-,-,-,-,-,-,-,-,-,-,-,-,-,+,-,-,-,-,-,-,-,-,-,-,-,-,-,-,-,-,-,-,-,-,-,+,-,-,+,-,-,-,-,+,-,-,-,-,-,-,-,-,-,-,-,-,-,+,-,-,-,-,-,-,-
BIPA_w_u026F,ɯ,unrounded close back vowel,ɯ,-,-,-,-,-,+,-,-,-,-,-,-,-,-,-,-,-,-,-,-,-,-,-,-,-,-,-,-,-,-,-,-,-,-,-,-,-,-,-,-,-,-,-,+,-,-,-,-,-,-,-,-,+,-,-,-,-,-,-,-,-,-,-,-,-,-,-,-,-,-
BIPA_p_u0070,p,voiceless bilabial stop consonant,p,-,-,-,-,-,-,-,-,-,-,-,-,-,-,-,-,-,-,-,-,-,-,-,-,+,-,-,-,-,-,-,-,-,-,-,+,-,-,-,-,-,-,-,-,-,-,-,-,-,-,-,-,-,-,-,-,+,+,-,-,-,-,-,-,-,-,-,-,-,-
BIPA_ts_u0074u0073,ts,voiceless alveolar sibilant affricate consonant,ts,-,-,-,-,-,-,-,-,-,+,-,-,-,-,-,-,-,-,-,-,-,-,-,-,+,-,-,-,-,-,-,-,-,+,-,+,-,-,-,-,-,-,-,-,-,-,+,-,-,-,-,-,-,+,-,-,-,-,-,-,-,-,-,-,+,-,-,-,-,-
BIPA_nj_u0272u025F,ɲɟ,pre-nasalized voiced palatal stop consonant,ⁿɟ,-,-,-,-,-,-,-,-,-,-,-,-,+,-,-,-,-,-,-,-,-,-,-,+,+,-,-,-,-,-,-,-,-,-,-,-,-,-,-,-,-,-,+,-,-,-,-,-,-,-,-,-,-,-,-,-,-,+,-,-,-,-,-,-,-,-,-,-,-,-
BIPA_oo_u00F8u00F8u0325,øø̥,long devoiced rounded close-mid front vowel,ø̥ː,-,-,-,-,-,-,-,-,-,-,-,-,-,+,-,-,-,+,-,-,-,-,-,-,-,-,+,-,-,-,-,+,-,-,-,+,-,-,-,-,-,-,-,-,-,-,-,-,-,-,-,-,-,-,-,-,-,-,-,+,-,-,-,-,-,-,-,-,-,-
BIPA_r_u0259u02DE,ə˞,rhotacized unrounded mid central vowel,ə˞,-,-,-,-,-,-,+,-,-,-,-,-,-,-,-,-,-,-,-,-,-,-,-,-,-,-,-,-,-,-,-,+,-,+,-,-,-,-,-,-,-,-,-,+,-,-,-,-,-,-,-,-,-,-,-,-,-,-,-,-,-,-,+,-,-,-,-,-,-,-
BIPA_oey_u0153u0079,œy,from rounded open-mid front to rounded close front diphthong,œy,-,-,-,+,-,+,-,-,-,-,-,-,-,+,-,-,-,+,-,-,-,-,-,-,-,-,-,-,-,-,-,+,-,-,-,-,-,-,-,-,-,-,-,-,-,-,-,-,-,-,-,-,-,-,+,-,-,-,-,+,-,-,-,-,-,-,-,-,-,-
BIPA_a_u0251u0303,ɑ̃,nasalized unrounded open back vowel,ɑ̃,-,-,-,-,-,-,-,-,-,-,-,-,-,-,-,-,-,-,+,-,-,-,-,-,-,-,-,-,-,-,-,-,-,-,-,-,-,-,-,-,-,-,-,+,-,-,-,-,+,-,-,-,+,-,-,-,-,-,-,-,-,-,-,-,-,-,-,-,-,-
BIPA_l_u026Cu02E4,ɬˤ,pharyngealized voiceless alveolar lateral fricative consonant,ɬˤ,-,-,+,-,-,-,-,-,-,-,-,-,-,-,-,-,-,-,-,-,+,-,-,-,+,-,-,-,-,-,-,-,-,-,-,+,-,-,-,-,-,-,-,-,-,-,-,-,-,-,-,-,-,-,-,-,-,-,-,-,-,+,-,-,-,-,+,-,-,-
BIPA_r_u0072u0320,r̠,retracted voiced alveolar trill consonant,r̠,-,-,-,-,-,-,-,-,-,-,-,-,-,-,-,-,-,-,-,-,-,-,-,+,+,-,-,-,+,-,-,-,-,-,-,-,-,+,-,-,-,-,-,-,-,-,-,-,-,-,-,-,-,-,-,-,-,-,-,-,-,-,-,-,-,-,-,-,-,-
BIPA_o_u0254u0303,ɔ̃,nasalized rounded open-mid back vowel,ɔ̃,-,-,-,-,-,-,-,-,-,-,-,-,-,-,-,-,-,+,+,-,-,-,-,-,-,-,-,-,-,-,-,+,-,-,-,-,-,-,-,-,-,-,-,-,-,-,-,-,-,-,-,-,+,-,+,-,-,-,-,-,-,-,-,-,-,-,-,-,-,-
BIPA_ai_u00E3u0129,ãĩ,from nasalized unrounded open front to nasalized unrounded close front diphthong,ãĩ,-,-,-,+,-,+,-,-,-,-,-,-,-,+,-,+,-,-,+,-,-,-,-,-,-,-,-,-,-,-,-,-,-,-,-,-,-,-,-,-,-,-,-,+,-,-,-,-,+,-,-,-,-,-,-,-,-,-,-,+,-,-,+,-,-,-,-,-,-,-
BIPA_nts_u006Eu032Au0074u032Au0073u032A,n̪t̪s̪,pre-nasalized voiceless dental sibilant affricate consonant,ⁿts̪,-,-,-,-,-,-,-,-,-,-,-,-,+,-,-,-,-,-,-,-,-,-,-,-,+,-,-,-,-,-,-,-,-,-,-,+,-,-,-,-,-,-,-,-,-,-,+,-,-,-,-,-,-,-,-,-,-,-,-,-,-,+,-,-,+,-,-,-,-,-
BIPA_tl_u0074u026C,tɬ,voiceless alveolar lateral affricate consonant,tɬ,-,-,-,-,-,-,-,-,-,+,-,-,-,-,-,-,-,-,-,-,+,-,-,-,+,-,-,-,-,-,-,-,-,+,-,+,-,-,-,-,-,-,-,-,-,-,-,-,-,-,-,-,-,+,-,-,-,-,-,-,-,-,-,-,+,-,-,-,-,-
BIPA_ts_u0074u0320u0283u02D0,t̠ʃː,long voiceless post-alveolar sibilant affricate consonant,tʃː,-,-,-,-,-,-,-,-,-,-,-,-,-,-,-,-,-,-,-,+,-,-,-,-,+,-,-,-,-,-,-,-,-,-,-,+,-,-,-,-,-,-,-,-,-,-,+,-,-,-,-,-,-,-,-,-,-,-,-,-,-,-,-,-,+,-,-,+,-,-
BIPA_ndz_u006Eu0064u007A,ndz,pre-nasalized voiced alveolar sibilant affricate consonant,ⁿdz,-,-,-,-,-,-,-,-,-,-,-,-,+,-,-,-,-,-,-,-,-,-,-,+,+,-,-,-,-,-,-,-,-,-,-,-,-,-,-,-,-,-,-,-,-,-,+,-,-,-,-,-,-,-,-,-,-,+,-,-,-,+,-,-,+,-,-,-,-,-
BIPA_sh_u0073u02B0,sʰ,aspirated voiceless alveolar sibilant fricative consonant,sʰ,-,-,-,-,-,-,-,-,-,-,-,-,-,-,-,-,-,-,-,-,-,-,-,-,+,-,-,-,-,-,-,-,-,-,-,+,-,-,-,-,-,-,-,-,-,-,+,-,-,-,+,-,-,-,-,-,-,-,-,-,-,+,-,-,-,-,+,-,-,-
BIPA_u_u028A,ʊ,rounded near-close near-back vowel,ʊ,+,-,-,-,-,+,-,-,-,-,-,-,-,-,-,-,-,+,-,-,-,-,-,-,-,-,-,-,-,-,-,-,-,-,-,-,-,-,-,-,-,-,-,-,-,-,-,-,-,-,-,-,+,-,-,-,-,-,-,-,-,-,-,-,-,-,-,-,-,-
BIPA_vj_u028Bu02B2,ʋʲ,palatalized voiced labio-dental approximant consonant,ʋʲ,-,-,-,-,-,-,-,-,-,-,-,-,-,-,-,-,-,-,-,-,-,-,-,+,+,-,-,-,-,+,-,-,-,-,-,-,+,-,-,-,-,-,-,-,-,+,-,-,-,-,-,-,-,-,-,-,-,-,-,-,-,-,-,-,-,-,-,-,-,-
BIPA_z_u007Au032Au02E4,z̪ˤ,pharyngealized voiced dental sibilant fricative consonant,z̪ˤ,-,-,+,-,-,-,-,-,-,-,-,-,-,-,-,-,-,-,-,-,-,-,+,+,+,-,-,-,-,-,-,-,-,-,-,-,-,-,-,-,-,-,-,-,-,-,+,-,-,-,-,-,-,-,-,-,-,-,-,-,-,-,-,-,-,-,+,-,-,-
BIPA_ei_u0065u026A,eɪ,from unrounded close-mid front to unrounded near-close near-front diphthong,eɪ,+,-,-,+,-,+,-,-,-,-,-,-,-,+,-,-,-,-,-,-,-,-,-,-,-,-,+,-,-,-,-,+,-,-,-,-,-,-,-,-,-,-,-,+,-,-,-,-,-,-,-,-,-,-,-,-,-,-,-,+,-,-,-,-,-,-,-,-,-,-
BIPA_dj_u0064u02B2,dʲ,palatalized voiced alveolar stop consonant,dʲ,-,-,-,-,-,-,-,-,-,-,-,-,-,-,-,-,-,-,-,-,-,-,-,+,+,-,-,-,-,-,-,-,-,-,-,-,+,-,-,-,-,-,-,-,-,-,-,-,-,-,-,-,-,-,-,-,-,+,-,-,-,+,-,-,-,-,-,-,-,-
BIPA_l_u006Cu0325,l̥,devoiced voiced alveolar lateral approximant consonant,l̥,-,-,-,-,-,-,-,-,-,+,-,-,-,-,-,-,-,-,-,-,+,-,-,-,+,-,-,-,-,-,-,-,-,+,-,+,-,-,-,-,-,-,-,-,-,+,-,-,-,-,-,-,-,+,-,-,-,-,-,-,-,-,-,-,-,-,-,-,-,-
BIPA_kh_u03C7u02BC,χʼ,voiceless uvular ejective fricative consonant,χʼ,-,-,-,-,-,-,-,-,-,-,-,+,-,-,-,-,-,-,-,-,-,-,-,-,-,+,-,-,-,-,-,-,-,-,-,-,-,-,-,-,-,-,-,-,-,-,-,-,-,-,-,-,-,-,-,-,-,-,-,-,-,-,-,-,-,-,+,-,-,-
BIPA_ng_u014Bu0325u01C0u0294,ŋ̥ǀʔ,pre-nasalized glottalized voiceless dental click consonant,ⁿǀˀ,-,-,-,-,-,-,-,-,-,-,+,-,-,-,-,-,-,-,-,-,-,-,+,-,-,-,-,-,-,-,-,-,-,-,+,+,-,-,-,-,-,+,-,-,-,-,-,-,-,-,-,-,-,-,-,-,-,+,-,-,-,-,-,+,-,-,-,-,-,-
BIPA_r_u0280,ʀ,voiced uvular trill consonant,ʀ,-,-,-,-,-,-,-,-,-,-,-,-,-,-,-,-,-,-,-,-,-,-,-,+,+,+,-,-,-,-,-,-,-,-,-,-,-,+,-,-,-,-,-,-,-,-,-,-,-,-,-,-,-,-,-,-,-,-,-,-,-,-,-,-,-,-,-,-,-,-
BIPA_u_u0075u028C,uʌ,from rounded close back to unrounded open-mid back diphthong,uʌ,-,-,-,-,-,+,-,-,-,-,-,-,-,-,-,-,-,+,-,-,-,-,-,-,-,-,-,-,-,-,-,+,-,-,-,-,-,-,-,-,-,-,-,+,-,-,-,-,-,-,-,-,+,-,+,-,-,-,-,+,-,-,-,-,-,-,-,-,+,+
BIPA_k_u006Bu01C0u0294,kǀʔ,from voiceless dental click to voiceless glottal stop cluster,ǀʔ,-,-,-,-,-,-,-,-,-,-,-,-,-,-,-,-,-,-,-,-,-,-,+,-,-,-,-,-,-,-,-,-,-,-,+,+,-,-,-,-,-,+,-,-,-,-,-,-,-,-,-,-,-,-,-,-,-,+,-,-,-,-,-,+,-,-,-,-,-,-
BIPA_u_u0169,ũ,nasalized rounded close back vowel,ũ,-,-,-,-,-,+,-,-,-,-,-,-,-,-,-,-,-,+,+,-,-,-,-,-,-,-,-,-,-,-,-,-,-,-,-,-,-,-,-,-,-,-,-,-,-,-,-,-,-,-,-,-,+,-,-,-,-,-,-,-,-,-,-,-,-,-,-,-,-,-
BIPA_r_u0072u0330,r̰,creaky voiced alveolar trill consonant,r̰,-,-,-,-,-,-,-,-,-,-,-,-,-,-,-,-,-,-,-,-,-,-,-,+,+,-,-,-,-,-,-,-,-,-,-,-,-,+,-,-,+,-,-,-,-,-,-,-,-,-,-,-,-,-,-,-,-,-,-,-,-,+,-,-,-,-,-,-,-,-
BIPA_d_u0064u032Au02E4,d̪ˤ,pharyngealized voiced dental stop consonant,d̪ˤ,-,-,+,-,-,-,-,-,-,-,-,-,-,-,-,-,-,-,-,-,-,-,+,+,+,-,-,-,-,-,-,-,-,-,-,-,-,-,-,-,-,-,-,-,-,-,-,-,-,-,-,-,-,-,-,-,-,+,-,-,-,-,-,-,-,-,-,-,-,-
BIPA_y_u0265,ɥ,voiced labio-palatal approximant consonant,ɥ,-,-,-,-,-,-,-,-,-,-,-,-,-,-,-,-,-,-,-,-,-,-,-,+,+,-,-,-,-,-,-,-,-,-,-,-,-,-,-,-,-,-,+,-,-,+,-,-,-,-,-,-,-,-,-,-,+,-,-,-,-,-,-,-,-,-,-,-,-,-
BIPA_dj_u00F0u031Eu02B2,ð̞ʲ,palatalized voiced dental approximant consonant,ɹ̪ʲ,-,-,-,-,-,-,-,-,-,-,-,-,-,-,-,-,-,-,-,-,-,-,+,+,+,-,-,-,-,-,-,-,-,-,-,-,+,-,-,-,-,-,-,-,-,+,-,-,-,-,-,-,-,-,-,-,-,-,-,-,-,-,-,-,-,-,-,-,-,-
BIPA_l_u026D,ɭ,voiced retroflex lateral approximant consonant,ɭ,-,-,-,-,-,-,-,-,-,-,-,-,-,-,-,-,-,-,-,-,+,-,-,+,+,-,-,-,-,-,-,-,-,-,-,-,-,-,-,-,-,-,-,-,-,+,-,+,-,-,-,-,-,-,-,-,-,-,-,-,-,-,-,-,-,-,-,-,-,-
BIPA_z_u007A,z,voiced alveolar sibilant fricative consonant,z,-,-,-,-,-,-,-,-,-,+,-,-,-,-,-,-,-,-,-,-,-,-,-,+,+,-,-,-,-,-,-,-,-,+,-,-,-,-,-,-,-,-,-,-,-,-,+,-,-,-,-,-,-,+,-,-,-,-,-,-,-,-,-,-,-,-,+,-,-,-
BIPA_ii_u0268u0303u0129,ɨ̃ĩ,from nasalized unrounded close central to nasalized unrounded close front diphthong,ɨ̃ĩ,-,-,-,-,-,+,-,-,-,-,-,-,-,+,-,+,-,-,+,-,-,-,-,-,-,-,-,-,-,-,-,-,-,-,-,-,-,-,-,-,-,-,-,+,-,-,-,-,-,-,-,-,-,-,-,-,-,-,-,+,-,-,+,-,-,-,-,-,-,-
BIPA_i_u0259u0268,əɨ,from unrounded mid central to unrounded close central diphthong,əɨ,-,-,-,+,-,+,-,-,-,-,-,-,-,-,-,-,-,-,-,-,-,-,-,-,-,-,+,-,-,-,-,+,-,-,-,-,-,-,-,-,-,-,-,+,-,-,-,-,-,-,-,-,-,-,-,-,-,-,-,+,-,-,+,-,-,-,-,-,-,-
BIPA_dj_u0064u032Au0324u02B2,d̪̤ʲ,palatalized breathy voiced dental stop consonant,d̪ʲʱ,-,-,-,-,-,-,-,-,-,-,-,-,-,-,-,-,-,-,-,-,-,-,+,+,+,-,-,-,-,-,-,-,-,-,-,-,+,-,-,-,-,-,-,-,+,-,-,-,-,-,-,-,-,-,-,-,-,+,-,-,-,-,-,-,-,-,-,-,-,-
BIPA_ww_u026Fu026Fu0325,ɯɯ̥,long devoiced unrounded close back vowel,ɯ̥ː,-,-,-,-,-,+,-,-,-,-,-,-,-,-,-,-,-,-,-,-,-,-,-,-,-,-,-,-,-,-,-,-,-,-,-,+,-,-,-,-,-,-,-,+,-,-,-,-,-,-,-,-,+,-,-,-,-,-,-,+,-,-,-,-,-,-,-,-,-,-
BIPA_a_u0252u0303,ɒ̃,nasalized rounded open back vowel,ɒ̃,-,-,-,-,-,-,-,-,-,-,-,-,-,-,-,-,-,+,+,-,-,-,-,-,-,-,-,-,-,-,-,-,-,-,-,-,-,-,-,-,-,-,-,-,-,-,-,-,+,-,-,-,+,-,-,-,-,-,-,-,-,-,-,-,-,-,-,-,-,-
BIPA_nt_u006Eu032Au0074u032A,n̪t̪,pre-nasalized voiceless dental stop consonant,ⁿt̪,-,-,-,-,-,-,-,-,-,-,-,-,+,-,-,-,-,-,-,-,-,-,+,-,+,-,-,-,-,-,-,-,-,-,-,+,-,-,-,-,-,-,-,-,-,-,-,-,-,-,-,-,-,-,-,-,-,+,-,-,-,-,-,-,-,-,-,-,-,-
BIPA_w_u0294u02B7,ʔʷ,labialized voiceless glottal stop consonant,ʔʷ,-,-,-,-,-,-,-,-,-,-,-,-,-,-,-,-,-,-,-,-,-,-,-,-,+,-,-,+,-,-,-,-,-,-,-,+,-,-,-,-,-,-,-,-,-,-,-,-,-,-,-,-,-,-,-,-,-,+,-,-,-,-,-,+,-,-,-,-,-,-
BIPA_p_u0070u02D0,pː,long voiceless bilabial stop consonant,pː,-,-,-,-,-,-,-,-,-,-,-,-,-,-,-,-,-,-,-,+,-,-,-,-,+,-,-,-,-,-,-,-,-,-,-,+,-,-,-,-,-,-,-,-,-,-,-,-,-,-,-,-,-,-,-,-,+,+,-,-,-,-,-,-,-,-,-,-,-,-
BIPA_o_u00F8u0303,ø̃,nasalized rounded close-mid front vowel,ø̃,-,-,-,-,-,-,-,-,-,-,-,-,-,+,-,-,-,+,+,-,-,-,-,-,-,-,+,-,-,-,-,+,-,-,-,-,-,-,-,-,-,-,-,-,-,-,-,-,-,-,-,-,-,-,-,-,-,-,-,-,-,-,-,-,-,-,-,-,-,-
BIPA_gw_u0261u0330u02B7,ɡ̰ʷ,labialized creaky voiced velar stop consonant,g̰ʷ,-,-,-,-,-,-,-,-,-,-,-,-,-,-,-,-,-,-,-,-,-,-,-,+,+,-,-,+,-,-,-,-,-,-,+,-,-,-,-,-,+,-,-,-,-,-,-,-,-,-,-,-,-,-,-,-,-,+,-,-,-,-,-,-,-,-,-,-,-,-
BIPA_ae_u00E6u0303u02D0,æ̃ː,long nasalized unrounded near-open front vowel,æ̃ː,-,-,-,-,-,-,-,-,-,-,-,-,-,+,-,-,-,-,+,+,-,-,-,-,-,-,-,-,-,-,-,-,-,-,-,-,-,-,-,-,-,-,-,+,-,-,-,-,+,-,-,-,-,-,-,-,-,-,-,-,+,-,-,-,-,-,-,-,-,-
BIPA_a_u00E3,ã,nasalized unrounded open front vowel,ã,-,-,-,-,-,-,-,-,-,-,-,-,-,-,-,-,-,-,+,-,-,-,-,-,-,-,-,-,-,-,-,-,-,-,-,-,-,-,-,-,-,-,-,+,-,-,-,-,+,-,-,-,-,-,-,-,-,-,-,-,-,-,+,-,-,-,-,-,-,-
UNK_tr_u0288u027D,ʈɽ,,,-,-,-,-,-,-,-,+,-,-,-,-,-,-,-,-,-,-,-,-,-,-,-,+,+,-,-,-,-,-,-,-,-,-,-,+,-,-,-,-,-,-,-,-,-,-,-,+,-,-,-,-,-,-,-,-,-,+,-,-,-,-,-,-,-,-,-,-,-,-
BIPA_s_u0283u02E4,ʃˤ,pharyngealized voiceless post-alveolar sibilant fricative consonant,ʃˤ,-,-,+,-,-,-,-,-,-,-,-,-,-,-,-,-,-,-,-,-,-,-,-,-,+,-,-,-,-,-,-,-,-,-,-,+,-,-,-,-,-,-,-,-,-,-,+,-,-,-,-,-,-,-,-,-,-,-,-,-,-,-,-,-,-,-,+,+,-,-
BIPA_dz_u0064u0320u0324u0292u0324,d̠̤ʒ̤,breathy voiced post-alveolar sibilant affricate consonant,dʒʱ,-,-,-,-,-,-,-,-,-,-,-,-,-,-,-,-,-,-,-,-,-,-,-,+,+,-,-,-,+,-,-,-,-,-,-,-,-,-,-,-,-,-,-,-,+,-,+,-,-,-,-,-,-,-,-,-,-,-,-,-,-,-,-,-,+,-,-,+,-,-
BIPA_tn_u0074u0320u006Eu0320,t̠n̠,with-nasal-release voiceless post-alveolar stop consonant,t̠ⁿ,-,-,-,-,-,-,-,-,-,-,+,-,-,-,+,-,-,-,-,-,-,-,-,-,+,-,-,-,-,-,-,-,-,-,-,+,-,-,-,-,-,-,-,-,-,-,-,-,-,-,-,-,-,-,-,-,-,+,-,-,-,-,-,-,-,-,-,+,-,-
BIPA_ae_u00E6u0303,æ̃,nasalized unrounded near-open front vowel,æ̃,-,-,-,-,-,-,-,-,-,-,-,-,-,+,-,-,-,-,+,-,-,-,-,-,-,-,-,-,-,-,-,-,-,-,-,-,-,-,-,-,-,-,-,+,-,-,-,-,+,-,-,-,-,-,-,-,-,-,-,-,+,-,-,-,-,-,-,-,-,-
BIPA_i_u1E2D,ḭ,creaky unrounded close front vowel,ḭ,-,-,-,-,-,+,-,-,-,-,-,-,-,+,-,-,-,-,-,-,-,-,-,-,-,-,-,-,-,-,-,-,-,-,-,-,-,-,-,-,+,-,-,+,-,-,-,-,-,-,-,-,-,-,-,-,-,-,-,-,-,-,-,-,-,-,-,-,-,-
BIPA_ngx_u014Bu0325u01C2u0078,ŋ̥ǂx,pre-nasalized voiceless palatal click consonant,ⁿǂ,-,-,-,-,-,-,-,-,-,-,+,-,-,-,-,-,-,-,-,-,-,-,-,-,-,-,-,-,-,-,-,-,-,-,+,+,-,-,-,-,-,+,+,-,-,-,-,-,-,-,-,-,-,-,-,-,-,-,-,-,-,-,-,-,-,-,+,-,-,-
BIPA_ae_u00E6u02D0,æː,long unrounded near-open front vowel,æː,-,-,-,-,-,-,-,-,-,-,-,-,-,+,-,-,-,-,-,+,-,-,-,-,-,-,-,-,-,-,-,-,-,-,-,-,-,-,-,-,-,-,-,+,-,-,-,-,+,-,-,-,-,-,-,-,-,-,-,-,+,-,-,-,-,-,-,-,-,-
BIPA_tl_u0074u0330u026Cu0330,t̰ɬ̰,creaky voiceless alveolar lateral affricate consonant,tɬ̰,-,-,-,-,-,-,-,-,-,-,-,-,-,-,-,-,-,-,-,-,+,-,-,-,+,-,-,-,-,-,-,-,-,-,-,+,-,-,-,-,+,-,-,-,-,-,-,-,-,-,-,-,-,-,-,-,-,-,-,-,-,+,-,-,+,-,-,-,-,-
BIPA_e_u025C,ɜ,unrounded open-mid central vowel,ɜ,-,-,-,-,-,-,-,-,-,-,-,-,-,-,-,-,-,-,-,-,-,-,-,-,-,-,-,-,-,-,-,+,-,-,-,-,-,-,-,-,-,-,-,+,-,-,-,-,-,-,-,-,-,-,+,-,-,-,-,-,-,-,+,-,-,-,-,-,-,-
BIPA_oi_u006Fu0268,oɨ,from rounded close-mid back to unrounded close central diphthong,oɨ,-,-,-,+,-,+,-,-,-,-,-,-,-,-,-,+,-,+,-,-,-,-,-,-,-,-,+,-,-,-,-,+,-,-,-,-,-,-,-,-,-,-,-,+,-,-,-,-,-,-,-,-,+,-,-,-,-,-,-,+,-,-,+,-,-,-,-,-,+,-
BIPA_m_u006Du0324,m̤,breathy voiced bilabial nasal consonant,mʱ,-,-,-,-,-,-,-,-,-,-,+,-,-,-,-,-,-,-,-,-,-,-,-,+,+,-,-,-,-,-,-,-,-,-,-,-,-,-,-,-,-,-,-,-,+,-,-,-,-,-,-,-,-,-,-,-,+,-,-,-,-,-,-,-,-,-,-,-,-,-
BIPA_ng_u006Eu02E0,nˠ,velarized voiced alveolar nasal consonant,nˠ,-,-,-,-,-,-,-,-,+,-,+,-,-,-,-,-,-,-,-,-,-,-,-,+,+,-,-,-,-,-,-,-,-,-,-,-,-,-,-,-,-,-,-,-,-,-,-,-,-,-,-,-,-,-,-,-,-,-,-,-,-,+,-,-,-,-,-,-,-,-
BIPA_nw_u006Eu02B7,nʷ,labialized voiced alveolar nasal consonant,nʷ,-,-,-,-,-,-,-,-,-,+,+,-,-,-,-,-,-,-,-,-,-,-,-,+,+,-,-,+,-,-,-,-,-,+,-,-,-,-,-,-,-,-,-,-,-,-,-,-,-,-,-,-,-,+,-,-,-,-,-,-,-,-,-,-,-,-,-,-,-,-
BIPA_r_u027Eu032A,ɾ̪,voiced dental tap consonant,ɾ̪,-,-,-,-,-,-,-,+,-,-,-,-,-,-,-,-,-,-,-,-,-,-,+,+,+,-,-,-,-,-,-,-,-,-,-,-,-,-,-,-,-,-,-,-,-,-,-,-,-,-,-,-,-,-,-,-,-,-,-,-,-,-,-,-,-,-,-,-,-,-
BIPA_e_u0115,ĕ,ultra-short unrounded close-mid front vowel,ĕ,-,-,-,-,-,-,-,-,-,-,-,-,-,+,-,-,-,-,-,-,-,-,-,-,-,-,+,-,-,-,-,+,-,-,-,-,-,-,-,-,-,-,-,+,-,-,-,-,-,+,-,-,-,-,-,-,-,-,-,-,-,-,-,-,-,-,-,-,-,-
BIPA_tsj_u0074u0320u0283u02B2,t̠ʃʲ,palatalized voiceless post-alveolar sibilant affricate consonant,tʃʲ,-,-,-,-,-,-,-,-,-,-,-,-,-,-,-,-,-,-,-,-,-,-,-,-,+,-,-,-,+,-,-,-,-,-,-,+,+,-,-,-,-,-,-,-,-,-,+,-,-,-,-,-,-,-,-,-,-,-,-,-,-,-,-,-,+,-,-,+,-,-
BIPA_l_u006Cu032A,l̪,voiced dental lateral approximant consonant,l̪,-,-,-,-,-,-,-,-,-,-,-,-,-,-,-,-,-,-,-,-,+,-,+,+,+,-,-,-,-,-,-,-,-,-,-,-,-,-,-,-,-,-,-,-,-,+,-,-,-,-,-,-,-,-,-,-,-,-,-,-,-,-,-,-,-,-,-,-,-,-
BIPA_j_u006Au0330,j̰,creaky voiced palatal approximant consonant,j̰,-,-,-,-,-,-,-,-,-,-,-,-,-,-,-,-,-,-,-,-,-,-,-,+,+,-,-,-,-,-,-,-,-,-,-,-,-,-,-,-,+,-,+,-,-,+,-,-,-,-,-,-,-,-,-,-,-,-,-,-,-,-,-,-,-,-,-,-,-,-
BIPA_au_u00E3u0289u0303,ãʉ̃,from nasalized unrounded open front to nasalized rounded close central diphthong,ãʉ̃,-,-,-,+,-,+,-,-,-,-,-,-,-,-,-,-,-,+,+,-,-,-,-,-,-,-,-,-,-,-,-,-,-,-,-,-,-,-,+,-,-,-,-,+,-,-,-,-,+,-,-,-,-,-,-,-,-,-,-,+,-,-,+,-,-,-,-,-,-,-
BIPA_nmj_u006Eu0320u006Du02B2,n̠mʲ,pre-nasalized palatalized voiced bilabial nasal consonant,ⁿmʲ,-,-,-,-,-,-,-,-,-,-,+,-,-,-,-,-,-,-,-,-,-,-,-,+,+,-,-,-,-,-,-,-,-,-,-,-,+,-,-,-,-,-,-,-,-,-,-,-,-,-,-,-,-,-,-,-,+,-,-,-,-,-,-,-,-,-,-,+,-,-
BIPA_rj_u0072u02B2,rʲ,palatalized voiced alveolar trill consonant,rʲ,-,-,-,-,-,-,-,-,-,-,-,-,-,-,-,-,-,-,-,-,-,-,-,+,+,-,-,-,-,-,-,-,-,-,-,-,+,+,-,-,-,-,-,-,-,-,-,-,-,-,-,-,-,-,-,-,-,-,-,-,-,+,-,-,-,-,-,-,-,-
BIPA_h_u0266,ɦ,voiced glottal fricative consonant,ɦ,-,-,-,-,-,-,-,-,-,-,-,-,-,-,-,-,-,-,-,-,-,-,-,+,+,-,-,-,-,-,-,-,-,-,-,-,-,-,-,-,-,-,-,-,-,-,-,-,-,-,-,-,-,-,-,-,-,-,-,-,-,-,-,+,-,-,+,-,-,-
BIPA_xw_u0078u02B7u02BC,xʷʼ,labialized voiceless velar ejective fricative consonant,x’ʷ,-,-,-,-,-,-,-,-,-,-,-,+,-,-,-,-,-,-,-,-,-,-,-,-,-,-,-,+,-,-,-,-,-,-,+,-,-,-,-,-,-,-,-,-,-,-,-,-,-,-,-,-,-,-,-,-,-,-,-,-,-,-,-,-,-,-,+,-,-,-
BIPA_tlh_u0074u026Cu02B0,tɬʰ,aspirated voiceless alveolar lateral affricate consonant,tɬʰ,-,-,-,-,-,-,-,-,-,+,-,-,-,-,-,-,-,-,-,-,+,-,-,-,+,-,-,-,-,-,-,-,-,+,-,+,-,-,-,-,-,-,-,-,-,-,-,-,-,-,+,-,-,+,-,-,-,-,-,-,-,-,-,-,+,-,-,-,-,-
BIPA_u_u1E75u02D0,ṵː,long creaky rounded close back vowel,ṵː,-,-,-,-,-,+,-,-,-,-,-,-,-,-,-,-,-,+,-,+,-,-,-,-,-,-,-,-,-,-,-,-,-,-,-,-,-,-,-,-,+,-,-,-,-,-,-,-,-,-,-,-,+,-,-,-,-,-,-,-,-,-,-,-,-,-,-,-,-,-
BIPA_eu_u025Bu0075,ɛu,from unrounded open-mid front to rounded close back diphthong,ɛu,-,-,-,+,+,+,-,-,-,-,-,-,-,+,-,-,-,+,-,-,-,-,-,-,-,-,-,-,-,-,-,+,-,-,-,-,-,-,+,-,-,-,-,+,-,-,-,-,-,-,-,-,+,-,+,-,-,-,-,+,-,-,-,-,-,-,-,-,-,-
BIPA_u_u028Au02D0,ʊː,long rounded near-close near-back vowel,ʊː,+,-,-,-,-,+,-,-,-,-,-,-,-,-,-,-,-,+,-,+,-,-,-,-,-,-,-,-,-,-,-,-,-,-,-,-,-,-,-,-,-,-,-,-,-,-,-,-,-,-,-,-,+,-,-,-,-,-,-,-,-,-,-,-,-,-,-,-,-,-
BIPA_o_u0275u0303,ɵ̃,nasalized rounded close-mid central vowel,ɵ̃,-,-,-,-,-,-,-,-,-,-,-,-,-,-,-,-,-,+,+,-,-,-,-,-,-,-,+,-,-,-,-,+,-,-,-,-,-,-,-,-,-,-,-,-,-,-,-,-,-,-,-,-,-,-,-,-,-,-,-,-,-,-,+,-,-,-,-,-,-,-
BIPA_jj_u025Fu029D,ɟʝ,voiced palatal affricate consonant,ɟʝ,-,-,-,-,-,-,-,-,-,-,-,-,-,-,-,-,-,-,-,-,-,-,-,+,+,-,-,-,-,-,-,-,-,-,-,-,-,-,-,-,-,-,+,-,-,-,-,-,-,-,-,-,-,-,-,-,-,-,-,-,-,-,-,-,+,-,-,-,-,-
BIPA_c_u00E7,ç,voiceless palatal sibilant fricative consonant,ç,-,-,-,-,-,-,-,-,-,-,-,-,-,-,-,-,-,-,-,-,-,-,-,-,+,-,-,-,-,-,-,-,-,-,-,+,-,-,-,-,-,-,+,-,-,-,-,-,-,-,-,-,-,-,-,-,-,-,-,-,-,-,-,-,-,-,+,-,-,-
BIPA_r_u0072u0325,r̥,devoiced voiced alveolar trill consonant,r̥,-,-,-,-,-,-,-,-,-,-,-,-,-,-,-,-,-,-,-,-,-,-,-,-,+,-,-,-,-,-,-,-,-,-,-,+,-,+,-,-,-,-,-,-,-,-,-,-,-,-,-,-,-,-,-,-,-,-,-,-,-,+,-,-,-,-,-,-,-,-
BIPA_tw_u0074u02B7,tʷ,labialized voiceless alveolar stop consonant,tʷ,-,-,-,-,-,-,-,-,-,-,-,-,-,-,-,-,-,-,-,-,-,-,-,-,+,-,-,+,-,-,-,-,-,-,-,+,-,-,-,-,-,-,-,-,-,-,-,-,-,-,-,-,-,-,-,-,-,+,-,-,-,+,-,-,-,-,-,-,-,-
BIPA_mg_u006Du02E0,mˠ,velarized voiced bilabial nasal consonant,mˠ,-,-,-,-,-,-,-,-,+,-,+,-,-,-,-,-,-,-,-,-,-,-,-,+,+,-,-,-,-,-,-,-,-,-,-,-,-,-,-,-,-,-,-,-,-,-,-,-,-,-,-,-,-,-,-,-,+,-,-,-,-,-,-,-,-,-,-,-,-,-
BIPA_i_u0129u0259u0303,ĩə̃,from nasalized unrounded close front to nasalized unrounded mid central diphthong,ĩə̃,-,-,-,-,+,+,-,-,-,-,-,-,-,+,-,-,-,-,-,-,-,-,-,-,-,-,+,-,-,-,-,+,+,-,-,-,-,-,-,-,-,-,-,+,-,-,-,-,-,-,-,-,-,-,-,-,-,-,-,+,-,-,+,-,-,-,-,-,-,+
BIPA_kh_u006Bu01C3u02B0,kǃʰ,aspirated voiceless alveolar click consonant,ǃʰ,-,-,-,-,-,-,-,-,-,-,-,-,-,-,-,-,-,-,-,-,-,-,-,-,-,-,-,-,-,-,-,-,-,-,+,+,-,-,-,-,-,+,-,-,-,-,-,-,-,-,+,-,-,-,-,-,-,+,-,-,-,-,-,-,-,-,-,+,-,-
BIPA_hp_u02B0u0070,ʰp,pre-aspirated voiceless bilabial stop consonant,ʰp,-,-,-,-,-,-,-,-,-,-,-,-,-,-,-,-,-,-,-,-,-,-,-,-,+,-,-,-,-,-,-,-,-,-,-,+,-,-,-,-,-,-,-,-,-,-,-,-,-,-,-,-,-,-,-,-,+,+,-,-,-,-,-,-,-,+,-,-,-,-
BIPA_y_u0079u02D0,yː,long rounded close front vowel,yː,-,-,-,-,-,+,-,-,-,-,-,-,-,+,-,-,-,+,-,+,-,-,-,-,-,-,-,-,-,-,-,-,-,-,-,-,-,-,-,-,-,-,-,-,-,-,-,-,-,-,-,-,-,-,-,-,-,-,-,-,-,-,-,-,-,-,-,-,-,-
BIPA_mw_u006Du0325u02B7,m̥ʷ,labialized devoiced voiced bilabial nasal consonant,m̥ʷ,-,-,-,-,-,-,-,-,-,-,+,-,-,-,-,-,-,-,-,-,-,-,-,-,+,-,-,+,-,-,-,-,-,-,-,+,-,-,-,-,-,-,-,-,-,-,-,-,-,-,-,-,-,-,-,-,+,-,-,-,-,-,-,-,-,-,-,-,-,-
