ID,Name,Description,BIPA,lowered,rhotic,pharyngealized,rising,backing,high,rhotacized,tapflap,velarized,place,nasal,ejective,prenasalized,front,release,fronting,implosive,rounded,nasalized,long,lateral,whistled,dental,voiced,pulmonic,uvular,higher,labialized,retracted,labiodental,pharyngeal,mid,nasalizing,unspecified,velar,voiceless,palatalized,trill,rounding,supra,laryngealized,click,palatal,unrounded,breathy,approximant,sibilant,retroflex,low,overshort,aspirated,epiglottal,back,coronal,lower,trilled,bilabial,stop,prestopped,diphtong,raised,alveolar,central,glottal,affricate,preaspirated,fricative,palatoalveolar,unrounding,lowering
BIPA_bj_u0253u02B2,ɓʲ,palatalized voiced bilabial implosive consonant,ɓʲ,-,-,-,-,-,-,-,-,-,-,-,-,-,-,-,-,+,-,-,-,-,-,-,+,-,-,-,-,-,-,-,-,-,-,-,-,+,-,-,-,-,-,-,-,-,-,-,-,-,-,-,-,-,-,-,-,+,+,-,-,-,-,-,-,-,-,-,-,-,-
BIPA_a_u1E01,ḁ,devoiced unrounded open front vowel,ḁ,-,-,-,-,-,-,-,-,-,-,-,-,-,-,-,-,-,-,-,-,-,-,-,-,-,-,-,-,-,-,-,-,-,-,-,+,-,-,-,-,-,-,-,+,-,-,-,-,+,-,-,-,-,-,-,-,-,-,-,-,-,-,+,-,-,-,-,-,-,-
BIPA_w_u026Fu031E,ɯ̞,lowered unrounded close back vowel,ɯ̞,+,-,-,-,-,+,-,-,-,-,-,-,-,-,-,-,-,-,-,-,-,-,-,-,-,-,-,-,-,-,-,-,-,-,-,-,-,-,-,-,-,-,-,+,-,-,-,-,-,-,-,-,+,-,-,-,-,-,-,-,-,-,-,-,-,-,-,-,-,-
BIPA_i_u1E2Du0259u0330,ḭə̰,from creaky unrounded close front to creaky unrounded mid central diphthong,ḭə̰,-,-,-,-,+,+,-,-,-,-,-,-,-,+,-,-,-,-,-,-,-,-,-,-,-,-,+,-,-,-,-,+,-,-,-,-,-,-,-,-,+,-,-,+,-,-,-,-,-,-,-,-,-,-,-,-,-,-,-,+,-,-,+,-,-,-,-,-,-,+
BIPA_o_u006F,o,rounded close-mid back vowel,o,-,-,-,-,-,-,-,-,-,-,-,-,-,-,-,-,-,+,-,-,-,-,-,-,-,-,-,-,-,-,-,+,-,+,-,-,-,-,-,-,-,-,-,-,-,-,-,-,-,-,-,-,+,-,-,-,-,-,-,-,-,-,-,-,-,-,-,-,-,-
BIPA_zw_u0292u02B7,ʒʷ,labialized voiced post-alveolar sibilant fricative consonant,ʒʷ,-,-,-,-,-,-,-,-,-,-,-,-,-,-,-,-,-,-,-,-,-,-,-,+,+,-,-,+,-,-,-,-,-,-,-,-,-,-,-,-,-,-,-,-,-,-,+,-,-,-,-,-,-,-,-,-,-,-,-,-,-,-,-,-,-,-,+,+,-,-
BIPA_e_u1E1B,ḛ,creaky unrounded close-mid front vowel,ḛ,-,-,-,-,-,-,-,-,-,-,-,-,-,+,-,-,-,-,-,-,-,-,-,-,-,-,+,-,-,-,-,+,-,-,-,-,-,-,-,-,+,-,-,+,-,-,-,-,-,-,-,-,-,-,-,-,-,-,-,-,-,-,-,-,-,-,-,-,-,-
BIPA_tsw_u0074u0073u02B7,tsʷ,labialized voiceless alveolar sibilant affricate consonant,tsʷ,-,-,-,-,-,-,-,-,-,-,-,-,-,-,-,-,-,-,-,-,-,-,-,-,+,-,-,+,-,-,-,-,-,-,-,+,-,-,-,-,-,-,-,-,-,-,+,-,-,-,-,-,-,-,-,-,-,-,-,-,-,+,-,-,+,-,-,-,-,-
BIPA_nqh_u0274u0071u02B0,ɴqʰ,pre-nasalized aspirated voiceless uvular stop consonant,ⁿqʰ,-,-,-,-,-,-,-,-,-,-,-,-,+,-,-,-,-,-,-,-,-,-,-,-,+,+,-,-,-,-,-,-,-,-,-,+,-,-,-,-,-,-,-,-,-,-,-,-,-,-,+,-,-,-,-,-,-,+,-,-,-,-,-,-,-,-,-,-,-,-
BIPA_dz_u0064u0324u0292u0324,d̤ʒ̤,breathy voiced post-alveolar sibilant affricate consonant,dʒʱ,-,-,-,-,-,-,-,-,-,-,-,-,-,-,-,-,-,-,-,-,-,-,-,+,+,-,-,-,-,-,-,-,-,-,-,-,-,-,-,-,-,-,-,-,+,-,+,-,-,-,-,-,-,-,-,-,-,-,-,-,-,-,-,-,+,-,-,+,-,-
BIPA_w_u026Fu028C,ɯʌ,from unrounded close back to unrounded open-mid back diphthong,ɯʌ,-,-,-,-,-,+,-,-,-,-,-,-,-,-,-,-,-,-,-,-,-,-,-,-,-,-,-,-,-,-,-,+,-,-,-,-,-,-,-,-,-,-,-,+,-,-,-,-,-,-,-,-,+,-,+,-,-,-,-,+,-,-,-,-,-,-,-,-,-,+
BIPA_n_u006Eu0324,n̤,breathy voiced alveolar nasal consonant,nʱ,-,-,-,-,-,-,-,-,-,-,+,-,-,-,-,-,-,-,-,-,-,-,-,+,+,-,-,-,-,-,-,-,-,-,-,-,-,-,-,-,-,-,-,-,+,-,-,-,-,-,-,-,-,-,-,-,-,-,-,-,-,+,-,-,-,-,-,-,-,-
BIPA_khj_u006Bu02B0u02B2,kʰʲ,palatalized aspirated voiceless velar stop consonant,kʲʰ,-,-,-,-,-,-,-,-,-,-,-,-,-,-,-,-,-,-,-,-,-,-,-,-,+,-,-,-,-,-,-,-,-,-,+,+,+,-,-,-,-,-,-,-,-,-,-,-,-,-,+,-,-,-,-,-,-,+,-,-,-,-,-,-,-,-,-,-,-,-
BIPA_n_u0272u0330,ɲ̰,creaky voiced palatal nasal consonant,ɲ̰,-,-,-,-,-,-,-,-,-,-,+,-,-,-,-,-,-,-,-,-,-,-,-,+,+,-,-,-,-,-,-,-,-,-,-,-,-,-,-,-,+,-,+,-,-,-,-,-,-,-,-,-,-,-,-,-,-,-,-,-,-,-,-,-,-,-,-,-,-,-
BIPA_mwj_u006Du02B7u02B2,mʷʲ,palatalized labialized voiced bilabial nasal consonant,mʲʷ,-,-,-,-,-,-,-,-,-,-,+,-,-,-,-,-,-,-,-,-,-,-,-,+,+,-,-,+,-,-,-,-,-,-,-,-,+,-,-,-,-,-,-,-,-,-,-,-,-,-,-,-,-,-,-,-,+,-,-,-,-,-,-,-,-,-,-,-,-,-
BIPA_th_u0074u032Au02B0,t̪ʰ,aspirated voiceless dental stop consonant,t̪ʰ,-,-,-,-,-,-,-,-,-,-,-,-,-,-,-,-,-,-,-,-,-,-,+,-,+,-,-,-,-,-,-,-,-,-,-,+,-,-,-,-,-,-,-,-,-,-,-,-,-,-,+,-,-,-,-,-,-,+,-,-,-,-,-,-,-,-,-,-,-,-
BIPA_ts_u0074u0073u032B,ts̫,voiceless alveolar whistled-sibilant affricate consonant,ts̫,-,-,-,-,-,-,-,-,-,-,-,-,-,-,-,-,-,-,-,-,-,+,-,-,+,-,-,-,-,-,-,-,-,-,-,+,-,-,-,-,-,-,-,-,-,-,+,-,-,-,-,-,-,-,-,-,-,-,-,-,-,+,-,-,+,-,-,-,-,-
BIPA_s_u0283u032B,ʃ̫,voiceless post-alveolar whistled-sibilant fricative consonant,ʃ̫,-,-,-,-,-,-,-,-,-,-,-,-,-,-,-,-,-,-,-,-,-,+,-,-,+,-,-,-,-,-,-,-,-,-,-,+,-,-,-,-,-,-,-,-,-,-,+,-,-,-,-,-,-,-,-,-,-,-,-,-,-,-,-,-,-,-,+,+,-,-
BIPA_i_u0069,i,unrounded close front vowel,i,-,-,-,-,-,+,-,-,-,-,-,-,-,+,-,-,-,-,-,-,-,-,-,-,-,-,-,-,-,-,-,-,-,-,-,-,-,-,-,-,-,-,-,+,-,-,-,-,-,-,-,-,-,-,-,-,-,-,-,-,-,-,-,-,-,-,-,-,-,-
BIPA_u_u1E75u0259u0330,ṵə̰,from creaky rounded close back to creaky unrounded mid central diphthong,ṵə̰,-,-,-,-,-,+,-,-,-,-,-,-,-,-,-,+,-,+,-,-,-,-,-,-,-,-,+,-,-,-,-,+,-,-,-,-,-,-,-,-,+,-,-,+,-,-,-,-,-,-,-,-,+,-,-,-,-,-,-,+,-,-,+,-,-,-,-,-,+,+
BIPA_db_u0238,ȸ,voiced labio-dental stop consonant,b̪,-,-,-,-,-,-,-,-,-,-,-,-,-,-,-,-,-,-,-,-,-,-,-,+,+,-,-,-,-,+,-,-,-,-,-,-,-,-,-,-,-,-,-,-,-,-,-,-,-,-,-,-,-,-,-,-,-,+,-,-,-,-,-,-,-,-,-,-,-,-
BIPA_qwh_u0071u02B7u02B0,qʷʰ,labialized aspirated voiceless uvular stop consonant,qʷʰ,-,-,-,-,-,-,-,-,-,-,-,-,-,-,-,-,-,-,-,-,-,-,-,-,+,+,-,+,-,-,-,-,-,-,-,+,-,-,-,-,-,-,-,-,-,-,-,-,-,-,+,-,-,-,-,-,-,+,-,-,-,-,-,-,-,-,-,-,-,-
BIPA_n_u006Eu0320,n̠,retracted voiced alveolar nasal consonant,n̠,-,-,-,-,-,-,-,-,-,-,+,-,-,-,-,-,-,-,-,-,-,-,-,+,+,-,-,-,-,-,-,-,-,-,-,-,-,-,-,-,-,-,-,-,-,-,-,-,-,-,-,-,-,-,-,-,-,-,-,-,-,-,-,-,-,-,-,+,-,-
BIPA_s_u0283,ʃ,voiceless post-alveolar sibilant fricative consonant,ʃ,-,-,-,-,-,-,-,-,-,-,-,-,-,-,-,-,-,-,-,-,-,-,-,-,+,-,-,-,-,-,-,-,-,-,-,+,-,-,-,-,-,-,-,-,-,-,+,-,-,-,-,-,-,-,-,-,-,-,-,-,-,-,-,-,-,-,+,+,-,-
BIPA_nj_u006Eu02B2,nʲ,palatalized voiced alveolar nasal consonant,nʲ,-,-,-,-,-,-,-,-,-,+,+,-,-,-,-,-,-,-,-,-,-,-,-,+,+,-,-,-,-,-,-,-,-,+,-,-,+,-,-,-,-,-,-,-,-,-,-,-,-,-,-,-,-,+,-,-,-,-,-,-,-,-,-,-,-,-,-,-,-,-
BIPA_r_u0279,ɹ,voiced alveolar approximant consonant,ɹ,-,-,-,-,-,-,-,-,-,-,-,-,-,-,-,-,-,-,-,-,-,-,-,+,+,-,-,-,-,-,-,-,-,-,-,-,-,-,-,-,-,-,-,-,-,+,-,-,-,-,-,-,-,-,-,-,-,-,-,-,-,+,-,-,-,-,-,-,-,-
BIPA_ngmw_u014Bu006Du02B7,ŋmʷ,labialized voiced velar-and-bilabial nasal consonant,ŋmʷ,-,-,-,-,-,-,-,-,-,-,+,-,-,-,-,-,-,-,-,-,-,-,-,+,+,-,-,+,-,-,-,-,-,-,+,-,-,-,-,-,-,-,-,-,-,-,-,-,-,-,-,-,-,-,-,-,+,-,-,-,-,-,-,-,-,-,-,-,-,-
BIPA_f_u0066u02E4,fˤ,pharyngealized voiceless labio-dental fricative consonant,fˤ,-,-,+,-,-,-,-,-,-,-,-,-,-,-,-,-,-,-,-,-,-,-,-,-,+,-,-,-,-,+,-,-,-,-,-,+,-,-,-,-,-,-,-,-,-,-,-,-,-,-,-,-,-,-,-,-,-,-,-,-,-,-,-,-,-,-,+,-,-,-
BIPA_tsj_u0074u032Au0073u032Au02B2,t̪s̪ʲ,palatalized voiceless dental sibilant affricate consonant,ts̪ʲ,-,-,-,-,-,-,-,-,-,-,-,-,-,-,-,-,-,-,-,-,-,-,+,-,+,-,-,-,-,-,-,-,-,-,-,+,+,-,-,-,-,-,-,-,-,-,+,-,-,-,-,-,-,-,-,-,-,-,-,-,-,+,-,-,+,-,-,-,-,-
BIPA_n_u0272u02D0,ɲː,long voiced palatal nasal consonant,ɲː,-,-,-,-,-,-,-,-,-,-,+,-,-,-,-,-,-,-,-,+,-,-,-,+,+,-,-,-,-,-,-,-,-,-,-,-,-,-,-,-,-,-,+,-,-,-,-,-,-,-,-,-,-,-,-,-,-,-,-,-,-,-,-,-,-,-,-,-,-,-
BIPA_p_u0070u0330,p̰,creaky voiceless bilabial stop consonant,p̰,-,-,-,-,-,-,-,-,-,-,-,-,-,-,-,-,-,-,-,-,-,-,-,-,+,-,-,-,-,-,-,-,-,-,-,+,-,-,-,-,+,-,-,-,-,-,-,-,-,-,-,-,-,-,-,-,+,+,-,-,-,-,-,-,-,-,-,-,-,-
BIPA_o_u00F8,ø,rounded close-mid front vowel,ø,-,-,-,-,-,-,-,-,-,-,-,-,-,+,-,-,-,+,-,-,-,-,-,-,-,-,+,-,-,-,-,+,-,-,-,-,-,-,-,-,-,-,-,-,-,-,-,-,-,-,-,-,-,-,-,-,-,-,-,-,-,-,-,-,-,-,-,-,-,-
BIPA_ts_u0074u0330u0073u0330,t̰s̰,creaky voiceless alveolar sibilant affricate consonant,ts̰,-,-,-,-,-,-,-,-,-,-,-,-,-,-,-,-,-,-,-,-,-,-,-,-,+,-,-,-,-,-,-,-,-,-,-,+,-,-,-,-,+,-,-,-,-,-,+,-,-,-,-,-,-,-,-,-,-,-,-,-,-,+,-,-,+,-,-,-,-,-
BIPA_mpj_u006Du0070u02B2,mpʲ,pre-nasalized palatalized voiceless bilabial stop consonant,ⁿpʲ,-,-,-,-,-,-,-,-,-,-,-,-,+,-,-,-,-,-,-,-,-,-,-,-,+,-,-,-,-,-,-,-,-,-,-,+,+,-,-,-,-,-,-,-,-,-,-,-,-,-,-,-,-,-,-,-,+,+,-,-,-,-,-,-,-,-,-,-,-,-
BIPA_rg_u027Eu02E0,ɾˠ,velarized voiced alveolar tap consonant,ɾˠ,-,-,-,-,-,-,-,+,+,-,-,-,-,-,-,-,-,-,-,-,-,-,-,+,+,-,-,-,-,-,-,-,-,-,-,-,-,-,-,-,-,-,-,-,-,-,-,-,-,-,-,-,-,-,-,-,-,-,-,-,-,+,-,-,-,-,-,-,-,-
BIPA_tp_u0074u0320u0070,t̠p,from voiceless post-alveolar stop to voiceless bilabial stop cluster,t̠p,-,-,-,-,-,-,-,-,-,-,-,-,-,-,-,-,-,-,-,-,-,-,-,-,+,-,-,-,+,-,-,-,-,-,-,+,-,-,-,-,-,-,-,-,-,-,-,-,-,-,-,-,-,-,-,-,+,+,-,-,-,-,-,-,-,-,-,-,-,-
BIPA_d_u0256u02D0,ɖː,long voiced retroflex stop consonant,ɖː,-,-,-,-,-,-,-,-,-,-,-,-,-,-,-,-,-,-,-,+,-,-,-,+,+,-,-,-,-,-,-,-,-,-,-,-,-,-,-,-,-,-,-,-,-,-,-,+,-,-,-,-,-,-,-,-,-,+,-,-,-,-,-,-,-,-,-,-,-,-
BIPA_mph_u006Du0070u02B0,mpʰ,pre-nasalized aspirated voiceless bilabial stop consonant,ⁿpʰ,-,-,-,-,-,-,-,-,-,-,-,-,+,-,-,-,-,-,-,-,-,-,-,-,+,-,-,-,-,-,-,-,-,-,-,+,-,-,-,-,-,-,-,-,-,-,-,-,-,-,+,-,-,-,-,-,+,+,-,-,-,-,-,-,-,-,-,-,-,-
BIPA_o_u0254u0324,ɔ̤,breathy rounded open-mid back vowel,ɔ̤,-,-,-,-,-,-,-,-,-,-,-,-,-,-,-,-,-,+,-,-,-,-,-,+,-,-,-,-,-,-,-,+,-,-,-,-,-,-,-,-,-,-,-,-,+,-,-,-,-,-,-,-,+,-,+,-,-,-,-,-,-,-,-,-,-,-,-,-,-,-
BIPA_j_u0284,ʄ,voiced palatal implosive consonant,ʄ,-,-,-,-,-,-,-,-,-,-,-,-,-,-,-,-,+,-,-,-,-,-,-,+,-,-,-,-,-,-,-,-,-,-,-,-,-,-,-,-,-,-,+,-,-,-,-,-,-,-,-,-,-,-,-,-,-,+,-,-,-,-,-,-,-,-,-,-,-,-
BIPA_t_u0074u02BC,tʼ,voiceless alveolar ejective stop consonant,tʼ,-,-,-,-,-,-,-,-,-,+,-,+,-,-,-,-,-,-,-,-,-,-,-,-,-,-,-,-,-,-,-,-,-,+,-,-,-,-,-,-,-,-,-,-,-,-,-,-,-,-,-,-,-,+,-,-,-,+,-,-,-,-,-,-,-,-,-,-,-,-
BIPA_ei_u1EBDu0129,ẽĩ,from nasalized unrounded close-mid front to nasalized unrounded close front diphthong,ẽĩ,-,-,-,+,-,+,-,-,-,-,-,-,-,+,-,-,-,-,+,-,-,-,-,-,-,-,+,-,-,-,-,+,-,-,-,-,-,-,-,-,-,-,-,+,-,-,-,-,-,-,-,-,-,-,-,-,-,-,-,+,-,-,-,-,-,-,-,-,-,-
BIPA_lj_u006Cu02B2,lʲ,palatalized voiced alveolar lateral approximant consonant,lʲ,-,-,-,-,-,-,-,-,-,+,-,-,-,-,-,-,-,-,-,-,+,-,-,+,+,-,-,-,-,-,-,-,-,+,-,-,+,-,-,-,-,-,-,-,-,+,-,-,-,-,-,-,-,+,-,-,-,-,-,-,-,-,-,-,-,-,-,-,-,-
BIPA_lj_u006Cu0320u02B2,l̠ʲ,palatalized voiced post-alveolar lateral approximant consonant,l̠ʲ,-,-,-,-,-,-,-,-,-,-,-,-,-,-,-,-,-,-,-,-,+,-,-,+,+,-,-,-,+,-,-,-,-,-,-,-,+,-,-,-,-,-,-,-,-,+,-,-,-,-,-,-,-,-,-,-,-,-,-,-,-,-,-,-,-,-,-,-,-,-
BIPA_ngmgb_u014Bu006Du0261u0062,ŋmɡb,from pre-nasalized voiced velar stop to voiced bilabial stop cluster,ⁿgb,-,-,-,-,-,-,-,-,-,-,-,-,+,-,-,-,-,-,-,-,-,-,-,+,+,-,-,-,-,-,-,-,-,-,+,-,-,-,-,-,-,-,-,-,-,-,-,-,-,-,-,-,-,-,-,-,+,+,-,-,-,-,-,-,-,-,-,-,-,-
BIPA_w_u0077u0324,w̤,breathy voiced labio-velar approximant consonant,wʱ,-,-,-,-,-,-,-,-,-,-,-,-,-,-,-,-,-,-,-,-,-,-,-,+,+,-,-,-,-,-,-,-,-,-,+,-,-,-,-,-,-,-,-,-,+,+,-,-,-,-,-,-,-,-,-,-,+,-,-,-,-,-,-,-,-,-,-,-,-,-
BIPA_tsh_u0074u0073u032Bu02B0,ts̫ʰ,aspirated voiceless alveolar whistled-sibilant affricate consonant,ts̫ʰ,-,-,-,-,-,-,-,-,-,-,-,-,-,-,-,-,-,-,-,-,-,+,-,-,+,-,-,-,-,-,-,-,-,-,-,+,-,-,-,-,-,-,-,-,-,-,+,-,-,-,+,-,-,-,-,-,-,-,-,-,-,+,-,-,+,-,-,-,-,-
BIPA_n_u0274,ɴ,voiced uvular nasal consonant,ɴ,-,-,-,-,-,-,-,-,-,-,+,-,-,-,-,-,-,-,-,-,-,-,-,+,+,+,-,-,-,-,-,-,-,-,-,-,-,-,-,-,-,-,-,-,-,-,-,-,-,-,-,-,-,-,-,-,-,-,-,-,-,-,-,-,-,-,-,-,-,-
BIPA_ia_u0069u0061,ia,from unrounded close front to unrounded open front diphthong,ia,-,-,-,-,+,+,-,-,-,-,-,-,-,+,-,-,-,-,-,-,-,-,-,-,-,-,-,-,-,-,-,-,-,-,-,-,-,-,-,-,-,-,-,+,-,-,-,-,+,-,-,-,-,-,-,-,-,-,-,+,-,-,+,-,-,-,-,-,-,+
BIPA_ei_u0065u0069,ei,from unrounded close-mid front to unrounded close front diphthong,ei,-,-,-,+,-,+,-,-,-,-,-,-,-,+,-,-,-,-,-,-,-,-,-,-,-,-,+,-,-,-,-,+,-,-,-,-,-,-,-,-,-,-,-,+,-,-,-,-,-,-,-,-,-,-,-,-,-,-,-,+,-,-,-,-,-,-,-,-,-,-
BIPA_a_u00E3u031F,ã̟,advanced nasalized unrounded open front vowel,ã̟,-,-,-,-,-,-,-,-,-,-,-,-,-,+,-,-,-,-,+,-,-,-,-,-,-,-,-,-,-,-,-,-,-,-,-,-,-,-,-,-,-,-,-,+,-,-,-,-,+,-,-,-,-,-,-,-,-,-,-,-,-,-,-,-,-,-,-,-,-,-
BIPA_lg_u006Cu032Au02E0,l̪ˠ,velarized voiced dental lateral approximant consonant,l̪ˠ,-,-,-,-,-,-,-,-,+,-,-,-,-,-,-,-,-,-,-,-,+,-,+,+,+,-,-,-,-,-,-,-,-,-,-,-,-,-,-,-,-,-,-,-,-,+,-,-,-,-,-,-,-,-,-,-,-,-,-,-,-,-,-,-,-,-,-,-,-,-
BIPA_pw_u0070u02B7,pʷ,labialized voiceless bilabial stop consonant,pʷ,-,-,-,-,-,-,-,-,-,-,-,-,-,-,-,-,-,-,-,-,-,-,-,-,+,-,-,+,-,-,-,-,-,-,-,+,-,-,-,-,-,-,-,-,-,-,-,-,-,-,-,-,-,-,-,-,+,+,-,-,-,-,-,-,-,-,-,-,-,-
BIPA_rj_u027Au02B2,ɺʲ,palatalized voiced alveolar lateral tap consonant,ɺʲ,-,-,-,-,-,-,-,+,-,-,-,-,-,-,-,-,-,-,-,-,+,-,-,-,+,-,-,-,-,-,-,-,-,-,-,-,+,-,-,-,-,-,-,-,-,-,-,-,-,-,-,-,-,-,-,-,-,-,-,-,-,+,-,-,-,-,-,-,-,-
BIPA_dz_u0064u0320u0292,d̠ʒ,voiced post-alveolar sibilant affricate consonant,dʒ,-,-,-,-,-,-,-,-,-,-,-,-,-,-,-,-,-,-,-,-,-,-,-,+,+,-,-,-,-,-,-,-,-,-,-,-,-,-,-,-,-,-,-,-,-,-,+,-,-,-,-,-,-,-,-,-,-,-,-,-,-,-,-,-,+,-,-,+,-,-
BIPA_tj_u0074u02B2,tʲ,palatalized voiceless alveolar stop consonant,tʲ,-,-,-,-,-,-,-,-,-,+,-,-,-,-,-,-,-,-,-,-,-,-,-,-,+,-,-,-,-,-,-,-,-,+,-,+,+,-,-,-,-,-,-,-,-,-,-,-,-,-,-,-,-,+,-,-,-,+,-,-,-,-,-,-,-,-,-,-,-,-
BIPA_nmj_u006Eu006Du02B2,nmʲ,palatalized voiced alveolar-and-bilabial nasal consonant,nmʲ,-,-,-,-,-,-,-,-,-,-,+,-,-,-,-,-,-,-,-,-,-,-,-,+,+,-,-,-,-,-,-,-,-,-,-,-,+,-,-,-,-,-,-,-,-,-,-,-,-,-,-,-,-,-,-,-,+,-,-,-,-,+,-,-,-,-,-,-,-,-
BIPA_u_u0259u0075,əu,from unrounded mid central to rounded close back diphthong,əu,-,-,-,+,+,+,-,-,-,-,-,-,-,-,-,-,-,+,-,-,-,-,-,-,-,-,+,-,-,-,-,+,-,-,-,-,-,-,+,-,-,-,-,+,-,-,-,-,-,-,-,-,+,-,-,-,-,-,-,+,-,-,+,-,-,-,-,-,-,-
BIPA_oy_u0254u0079,ɔy,from rounded open-mid back to rounded close front diphthong,ɔy,-,-,-,+,-,+,-,-,-,-,-,-,-,+,-,+,-,+,-,-,-,-,-,-,-,-,-,-,-,-,-,+,-,-,-,-,-,-,-,-,-,-,-,-,-,-,-,-,-,-,-,-,+,-,+,-,-,-,-,+,-,-,-,-,-,-,-,-,-,-
BIPA__u1D91,ᶑ,voiced retroflex implosive consonant,ᶑ,-,-,-,-,-,-,-,-,-,-,-,-,-,-,-,-,+,-,-,-,-,-,-,+,-,-,-,-,-,-,-,-,-,-,-,-,-,-,-,-,-,-,-,-,-,-,-,+,-,-,-,-,-,-,-,-,-,+,-,-,-,-,-,-,-,-,-,-,-,-
BIPA_hj_u0266u02B2,ɦʲ,palatalized voiced glottal fricative consonant,ɦʲ,-,-,-,-,-,-,-,-,-,-,-,-,-,-,-,-,-,-,-,-,-,-,-,+,+,-,-,-,-,-,-,-,-,-,-,-,+,-,-,-,-,-,-,-,-,-,-,-,-,-,-,-,-,-,-,-,-,-,-,-,-,-,-,+,-,-,+,-,-,-
BIPA_j_u029D,ʝ,voiced palatal fricative consonant,ʝ,-,-,-,-,-,-,-,-,-,-,-,-,-,-,-,-,-,-,-,-,-,-,-,+,+,-,-,-,-,-,-,-,-,-,-,-,-,-,-,-,-,-,+,-,-,-,-,-,-,-,-,-,-,-,-,-,-,-,-,-,-,-,-,-,-,-,+,-,-,-
BIPA_oa_u00F5u00E3,õã,from nasalized rounded close-mid back to nasalized unrounded open front diphthong,õã,-,-,-,-,-,-,-,-,-,-,-,-,-,-,-,+,-,+,+,-,-,-,-,-,-,-,+,-,-,-,-,+,-,-,-,-,-,-,-,-,-,-,-,+,-,-,-,-,+,-,-,-,+,-,-,-,-,-,-,+,-,-,+,-,-,-,-,-,+,+
BIPA_tc_u0074u00E7,tç,voiceless alveolo-palatal sibilant affricate consonant,tɕ,-,-,-,-,-,-,-,-,-,-,-,-,-,-,-,-,-,-,-,-,-,-,-,-,+,-,-,-,-,-,-,-,-,-,-,+,-,-,-,-,-,-,+,-,-,-,-,-,-,-,-,-,-,-,-,-,-,-,-,-,-,+,-,-,+,-,-,-,-,-
BIPA_dz_u0064u007Au032B,dz̫,voiced alveolar whistled-sibilant affricate consonant,dz̫,-,-,-,-,-,-,-,-,-,-,-,-,-,-,-,-,-,-,-,-,-,+,-,+,+,-,-,-,-,-,-,-,-,-,-,-,-,-,-,-,-,-,-,-,-,-,+,-,-,-,-,-,-,-,-,-,-,-,-,-,-,+,-,-,+,-,-,-,-,-
BIPA_ai_u00E3u0330u1E2Du0303,ã̰ḭ̃,from nasalized creaky unrounded open front to nasalized creaky unrounded close front diphthong,ã̰ḭ̃,-,-,-,+,-,+,-,-,-,-,-,-,-,+,-,+,-,-,+,-,-,-,-,-,-,-,-,-,-,-,-,-,-,-,-,-,-,-,-,-,+,-,-,+,-,-,-,-,+,-,-,-,-,-,-,-,-,-,-,+,-,-,+,-,-,-,-,-,-,-
BIPA_u_u0169u02D0,ũː,long nasalized rounded close back vowel,ũː,-,-,-,-,-,+,-,-,-,-,-,-,-,-,-,-,-,+,+,+,-,-,-,-,-,-,-,-,-,-,-,-,-,-,-,-,-,-,-,-,-,-,-,-,-,-,-,-,-,-,-,-,+,-,-,-,-,-,-,-,-,-,-,-,-,-,-,-,-,-
BIPA_y_u0079,y,rounded close front vowel,y,-,-,-,-,-,+,-,-,-,-,-,-,-,+,-,-,-,+,-,-,-,-,-,-,-,-,-,-,-,-,-,-,-,-,-,-,-,-,-,-,-,-,-,-,-,-,-,-,-,-,-,-,-,-,-,-,-,-,-,-,-,-,-,-,-,-,-,-,-,-
BIPA_pg_u0070u02E0,pˠ,velarized voiceless bilabial stop consonant,pˠ,-,-,-,-,-,-,-,-,+,-,-,-,-,-,-,-,-,-,-,-,-,-,-,-,+,-,-,-,-,-,-,-,-,-,-,+,-,-,-,-,-,-,-,-,-,-,-,-,-,-,-,-,-,-,-,-,+,+,-,-,-,-,-,-,-,-,-,-,-,-
BIPA_iu_u0069u0075,iu,from unrounded close front to rounded close back diphthong,iu,-,-,-,-,+,+,-,-,-,-,-,-,-,+,-,-,-,+,-,-,-,-,-,-,-,-,-,-,-,-,-,-,-,-,-,-,-,-,+,-,-,-,-,+,-,-,-,-,-,-,-,-,+,-,-,-,-,-,-,+,-,-,-,-,-,-,-,-,-,-
BIPA_a_u0061u0330,a̰,creaky unrounded open front vowel,a̰,-,-,-,-,-,-,-,-,-,-,-,-,-,-,-,-,-,-,-,-,-,-,-,-,-,-,-,-,-,-,-,-,-,-,-,-,-,-,-,-,+,-,-,+,-,-,-,-,+,-,-,-,-,-,-,-,-,-,-,-,-,-,+,-,-,-,-,-,-,-
BIPA_rw_u0281u02B7,ʁʷ,labialized voiced uvular fricative consonant,ʁʷ,-,-,-,-,-,-,-,-,-,-,-,-,-,-,-,-,-,-,-,-,-,-,-,+,+,+,-,+,-,-,-,-,-,-,-,-,-,-,-,-,-,-,-,-,-,-,-,-,-,-,-,-,-,-,-,-,-,-,-,-,-,-,-,-,-,-,+,-,-,-
BIPA__uF25F,,voiced labio-dental tap consonant,ⱱ,-,-,-,-,-,-,-,+,-,-,-,-,-,-,-,-,-,-,-,-,-,-,-,+,+,-,-,-,-,+,-,-,-,-,-,-,-,-,-,-,-,-,-,-,-,-,-,-,-,-,-,-,-,-,-,-,-,-,-,-,-,-,-,-,-,-,-,-,-,-
BIPA_tw_u0074u02B7u02BC,tʷʼ,labialized voiceless alveolar ejective stop consonant,t’ʷ,-,-,-,-,-,-,-,-,-,-,-,+,-,-,-,-,-,-,-,-,-,-,-,-,-,-,-,+,-,-,-,-,-,-,-,-,-,-,-,-,-,-,-,-,-,-,-,-,-,-,-,-,-,-,-,-,-,+,-,-,-,+,-,-,-,-,-,-,-,-
BIPA_a_u0251u02D0,ɑː,long unrounded open back vowel,ɑː,-,-,-,-,-,-,-,-,-,-,-,-,-,-,-,-,-,-,-,+,-,-,-,-,-,-,-,-,-,-,-,-,-,-,-,-,-,-,-,-,-,-,-,+,-,-,-,-,+,-,-,-,+,-,-,-,-,-,-,-,-,-,-,-,-,-,-,-,-,-
BIPA_pwj_u0070u02B7u02B2,pʷʲ,palatalized labialized voiceless bilabial stop consonant,pʲʷ,-,-,-,-,-,-,-,-,-,-,-,-,-,-,-,-,-,-,-,-,-,-,-,-,+,-,-,+,-,-,-,-,-,-,-,+,+,-,-,-,-,-,-,-,-,-,-,-,-,-,-,-,-,-,-,-,+,+,-,-,-,-,-,-,-,-,-,-,-,-
BIPA_b_u03B2u031E,β̞,voiced bilabial approximant consonant,β̞,-,-,-,-,-,-,-,-,-,-,-,-,-,-,-,-,-,-,-,-,-,-,-,+,+,-,-,-,-,-,-,-,-,-,-,-,-,-,-,-,-,-,-,-,-,+,-,-,-,-,-,-,-,-,-,-,+,-,-,-,-,-,-,-,-,-,-,-,-,-
BIPA_a_u0061u0259,aə,from unrounded open front to unrounded mid central diphthong,aə,-,-,-,+,-,-,-,-,-,-,-,-,-,-,-,-,-,-,-,-,-,-,-,-,-,-,+,-,-,-,-,+,-,-,-,-,-,-,-,-,-,-,-,+,-,-,-,-,+,-,-,-,-,-,-,-,-,-,-,+,-,-,+,-,-,-,-,-,-,-
BIPA_r_u027Eu0325,ɾ̥,devoiced voiced alveolar tap consonant,ɾ̥,-,-,-,-,-,-,-,+,-,-,-,-,-,-,-,-,-,-,-,-,-,-,-,-,+,-,-,-,-,-,-,-,-,-,-,+,-,-,-,-,-,-,-,-,-,-,-,-,-,-,-,-,-,-,-,-,-,-,-,-,-,+,-,-,-,-,-,-,-,-
BIPA_k_u006Bu01C0,kǀ,voiceless dental click consonant,ǀ,-,-,-,-,-,-,-,-,-,-,-,-,-,-,-,-,-,-,-,-,-,-,+,-,-,-,-,-,-,-,-,-,-,-,+,+,-,-,-,-,-,+,-,-,-,-,-,-,-,-,-,-,-,-,-,-,-,+,-,-,-,-,-,-,-,-,-,-,-,-
BIPA_i_u0268u02D0,ɨː,long unrounded close central vowel,ɨː,-,-,-,-,-,+,-,-,-,-,-,-,-,-,-,-,-,-,-,+,-,-,-,-,-,-,-,-,-,-,-,-,-,-,-,-,-,-,-,-,-,-,-,+,-,-,-,-,-,-,-,-,-,-,-,-,-,-,-,-,-,-,+,-,-,-,-,-,-,-
BIPA_t_u0074,t,voiceless alveolar stop consonant,t,-,-,-,-,-,-,-,-,-,+,-,-,-,-,-,-,-,-,-,-,-,-,-,-,+,-,-,-,-,-,-,-,-,+,-,+,-,-,-,-,-,-,-,-,-,-,-,-,-,-,-,-,-,+,-,-,-,+,-,-,-,-,-,-,-,-,-,-,-,-
BIPA_ndz_u006Eu0320u0064u0320u0292,n̠d̠ʒ,pre-nasalized voiced post-alveolar affricate consonant,ⁿdʒ,-,-,-,-,-,-,-,-,-,-,-,-,+,-,-,-,-,-,-,-,-,-,-,+,+,-,-,-,-,-,-,-,-,-,-,-,-,-,-,-,-,-,-,-,-,-,+,-,-,-,-,-,-,-,-,-,-,-,-,-,-,-,-,-,+,-,-,+,-,-
BIPA_oe_u0153u0303,œ̃,nasalized rounded open-mid front vowel,œ̃,-,-,-,-,-,-,-,-,-,-,-,-,-,+,-,-,-,+,+,-,-,-,-,-,-,-,-,-,-,-,-,+,-,-,-,-,-,-,-,-,-,-,-,-,-,-,-,-,-,-,-,-,-,-,+,-,-,-,-,-,-,-,-,-,-,-,-,-,-,-
BIPA_n_u006Eu032Au0324,n̪̤,breathy voiced dental nasal consonant,n̪ʱ,-,-,-,-,-,-,-,-,-,-,+,-,-,-,-,-,-,-,-,-,-,-,+,+,+,-,-,-,-,-,-,-,-,-,-,-,-,-,-,-,-,-,-,-,+,-,-,-,-,-,-,-,-,-,-,-,-,-,-,-,-,-,-,-,-,-,-,-,-,-
BIPA_vw_u0076u02B7,vʷ,labialized voiced labio-dental fricative consonant,vʷ,-,-,-,-,-,-,-,-,-,-,-,-,-,-,-,-,-,-,-,-,-,-,-,+,+,-,-,+,-,+,-,-,-,-,-,-,-,-,-,-,-,-,-,-,-,-,-,-,-,-,-,-,-,-,-,-,-,-,-,-,-,-,-,-,-,-,+,-,-,-
BIPA_a_u0251u0330,ɑ̰,creaky unrounded open back vowel,ɑ̰,-,-,-,-,-,-,-,-,-,-,-,-,-,-,-,-,-,-,-,-,-,-,-,-,-,-,-,-,-,-,-,-,-,-,-,-,-,-,-,-,+,-,-,+,-,-,-,-,+,-,-,-,+,-,-,-,-,-,-,-,-,-,-,-,-,-,-,-,-,-
BIPA_fw_u0066u02B7,fʷ,labialized voiceless labio-dental fricative consonant,fʷ,-,-,-,-,-,-,-,-,-,-,-,-,-,-,-,-,-,-,-,-,-,-,-,-,+,-,-,+,-,+,-,-,-,-,-,+,-,-,-,-,-,-,-,-,-,-,-,-,-,-,-,-,-,-,-,-,-,-,-,-,-,-,-,-,-,-,+,-,-,-
BIPA_ng_u014Bu01C3,ŋǃ,voiced alveolar nasal-click consonant,ŋǃ,-,-,-,-,-,-,-,-,-,-,+,-,-,-,-,-,-,-,-,-,-,-,-,+,-,-,-,-,-,-,-,-,-,-,+,-,-,-,-,-,-,+,-,-,-,-,-,-,-,-,-,-,-,-,-,-,-,-,-,-,-,-,-,-,-,-,-,+,-,-
BIPA_rg_u0072u02E0,rˠ,velarized voiced alveolar trill consonant,rˠ,-,-,-,-,-,-,-,-,+,-,-,-,-,-,-,-,-,-,-,-,-,-,-,+,+,-,-,-,-,-,-,-,-,-,-,-,-,+,-,-,-,-,-,-,-,-,-,-,-,-,-,-,-,-,-,-,-,-,-,-,-,+,-,-,-,-,-,-,-,-
BIPA__u0259u0330u0303,ə̰̃,nasalized creaky unrounded mid central vowel,ə̰̃,-,-,-,-,-,-,-,-,-,-,-,-,-,-,-,-,-,-,+,-,-,-,-,-,-,-,+,-,-,-,-,+,-,-,-,-,-,-,-,-,+,-,-,+,-,-,-,-,-,-,-,-,-,-,-,-,-,-,-,-,-,-,+,-,-,-,-,-,-,-
BIPA_ui_u0264u0069,ɤi,from unrounded close-mid back to unrounded close front diphthong,ɤi,-,-,-,+,-,+,-,-,-,-,-,-,-,+,-,+,-,-,-,-,-,-,-,-,-,-,+,-,-,-,-,+,-,-,-,-,-,-,-,-,-,-,-,+,-,-,-,-,-,-,-,-,+,-,-,-,-,-,-,+,-,-,-,-,-,-,-,-,-,-
BIPA_oo_u0254u0254u0325,ɔɔ̥,long devoiced rounded open-mid back vowel,ɔ̥ː,-,-,-,-,-,-,-,-,-,-,-,-,-,-,-,-,-,+,-,-,-,-,-,-,-,-,-,-,-,-,-,+,-,-,-,+,-,-,-,-,-,-,-,-,-,-,-,-,-,-,-,-,+,-,+,-,-,-,-,+,-,-,-,-,-,-,-,-,-,-
BIPA_ng_u014Bu0325,ŋ̥,devoiced voiced velar nasal consonant,ŋ̊,-,-,-,-,-,-,-,-,-,-,+,-,-,-,-,-,-,-,-,-,-,-,-,-,+,-,-,-,-,-,-,-,-,-,+,+,-,-,-,-,-,-,-,-,-,-,-,-,-,-,-,-,-,-,-,-,-,-,-,-,-,-,-,-,-,-,-,-,-,-
BIPA_wa_u026Fu0061,ɯa,from unrounded close back to unrounded open front diphthong,ɯa,-,-,-,-,-,+,-,-,-,-,-,-,-,-,-,+,-,-,-,-,-,-,-,-,-,-,-,-,-,-,-,-,-,-,-,-,-,-,-,-,-,-,-,+,-,-,-,-,+,-,-,-,+,-,-,-,-,-,-,+,-,-,+,-,-,-,-,-,-,+
BIPA_t_u0074u02D0,tː,long voiceless alveolar stop consonant,tː,-,-,-,-,-,-,-,-,-,-,-,-,-,-,-,-,-,-,-,+,-,-,-,-,+,-,-,-,-,-,-,-,-,-,-,+,-,-,-,-,-,-,-,-,-,-,-,-,-,-,-,-,-,-,-,-,-,+,-,-,-,+,-,-,-,-,-,-,-,-
BIPA_yy_u0079u0079u0325,yy̥,long devoiced rounded close front vowel,y̥ː,-,-,-,-,-,+,-,-,-,-,-,-,-,+,-,-,-,+,-,-,-,-,-,-,-,-,-,-,-,-,-,-,-,-,-,+,-,-,-,-,-,-,-,-,-,-,-,-,-,-,-,-,-,-,-,-,-,-,-,+,-,-,-,-,-,-,-,-,-,-
BIPA_ngkj_u014Bu006Bu02B2,ŋkʲ,pre-nasalized palatalized voiceless velar stop consonant,ⁿkʲ,-,-,-,-,-,-,-,-,-,-,-,-,+,-,-,-,-,-,-,-,-,-,-,-,+,-,-,-,-,-,-,-,-,-,+,+,+,-,-,-,-,-,-,-,-,-,-,-,-,-,-,-,-,-,-,-,-,+,-,-,-,-,-,-,-,-,-,-,-,-
BIPA_b_u0062u0330,b̰,creaky voiced bilabial stop consonant,b̰,-,-,-,-,-,-,-,-,-,-,-,-,-,-,-,-,-,-,-,-,-,-,-,+,+,-,-,-,-,-,-,-,-,-,-,-,-,-,-,-,+,-,-,-,-,-,-,-,-,-,-,-,-,-,-,-,+,+,-,-,-,-,-,-,-,-,-,-,-,-
BIPA_w_u0077,w,voiced labio-velar approximant consonant,w,-,-,-,-,-,-,-,-,-,-,-,-,-,-,-,-,-,-,-,-,-,-,-,+,+,-,-,-,-,-,-,-,-,-,+,-,-,-,-,-,-,-,-,-,-,+,-,-,-,-,-,-,-,-,-,-,+,-,-,-,-,-,-,-,-,-,-,-,-,-
BIPA_z_u007Au032A,z̪,voiced dental sibilant fricative consonant,z̪,-,-,-,-,-,-,-,-,-,-,-,-,-,-,-,-,-,-,-,-,-,-,+,+,+,-,-,-,-,-,-,-,-,-,-,-,-,-,-,-,-,-,-,-,-,-,+,-,-,-,-,-,-,-,-,-,-,-,-,-,-,-,-,-,-,-,+,-,-,-
BIPA_lzj_u026Eu02B2,ɮʲ,palatalized voiced alveolar lateral fricative consonant,ɮʲ,-,-,-,-,-,-,-,-,-,-,-,-,-,-,-,-,-,-,-,-,+,-,-,+,+,-,-,-,-,-,-,-,-,-,-,-,+,-,-,-,-,-,-,-,-,-,-,-,-,-,-,-,-,-,-,-,-,-,-,-,-,+,-,-,-,-,+,-,-,-
BIPA_ee_u0065u0065u0325,ee̥,long devoiced unrounded close-mid front vowel,e̥ː,-,-,-,-,-,-,-,-,-,-,-,-,-,+,-,-,-,-,-,-,-,-,-,-,-,-,+,-,-,-,-,+,-,-,-,+,-,-,-,-,-,-,-,+,-,-,-,-,-,-,-,-,-,-,-,-,-,-,-,+,-,-,-,-,-,-,-,-,-,-
BIPA_kh_u006Bu02B0,kʰ,aspirated voiceless velar stop consonant,kʰ,-,-,-,-,-,-,-,-,-,-,-,-,-,-,-,-,-,-,-,-,-,-,-,-,+,-,-,-,-,-,-,-,-,-,+,+,-,-,-,-,-,-,-,-,-,-,-,-,-,-,+,-,-,-,-,-,-,+,-,-,-,-,-,-,-,-,-,-,-,-
BIPA_j_u025F,ɟ,voiced palatal stop consonant,ɟ,-,-,-,-,-,-,-,-,-,-,-,-,-,-,-,-,-,-,-,-,-,-,-,+,+,-,-,-,-,-,-,-,-,-,-,-,-,-,-,-,-,-,+,-,-,-,-,-,-,-,-,-,-,-,-,-,-,+,-,-,-,-,-,-,-,-,-,-,-,-
BIPA_v_u028B,ʋ,voiced labio-dental approximant consonant,ʋ,-,-,-,-,-,-,-,-,-,-,-,-,-,-,-,-,-,-,-,-,-,-,-,+,+,-,-,-,-,+,-,-,-,-,-,-,-,-,-,-,-,-,-,-,-,+,-,-,-,-,-,-,-,-,-,-,-,-,-,-,-,-,-,-,-,-,-,-,-,-
BIPA_g_u0261u01C3,ɡǃ,voiced alveolar click consonant,gǃ,-,-,-,-,-,-,-,-,-,-,-,-,-,-,-,-,-,-,-,-,-,-,-,+,-,-,-,-,-,-,-,-,-,-,+,-,-,-,-,-,-,+,-,-,-,-,-,-,-,-,-,-,-,-,-,-,-,+,-,-,-,-,-,-,-,-,-,+,-,-
BIPA_s_u0073u032A,s̪,voiceless dental sibilant fricative consonant,s̪,-,-,-,-,-,-,-,-,-,-,-,-,-,-,-,-,-,-,-,-,-,-,+,-,+,-,-,-,-,-,-,-,-,-,-,+,-,-,-,-,-,-,-,-,-,-,+,-,-,-,-,-,-,-,-,-,-,-,-,-,-,-,-,-,-,-,+,-,-,-
BIPA_khw_u03C7u02B7u02BC,χʷʼ,labialized voiceless uvular ejective fricative consonant,χ’ʷ,-,-,-,-,-,-,-,-,-,-,-,+,-,-,-,-,-,-,-,-,-,-,-,-,-,+,-,+,-,-,-,-,-,-,-,-,-,-,-,-,-,-,-,-,-,-,-,-,-,-,-,-,-,-,-,-,-,-,-,-,-,-,-,-,-,-,+,-,-,-
BIPA_gw_u0261u02B7,ɡʷ,labialized voiced velar stop consonant,gʷ,-,-,-,-,-,-,-,-,-,-,-,-,-,-,-,-,-,-,-,-,-,-,-,+,+,-,-,+,-,-,-,-,-,-,+,-,-,-,-,-,-,-,-,-,-,-,-,-,-,-,-,-,-,-,-,-,-,+,-,-,-,-,-,-,-,-,-,-,-,-
BIPA_l_u006Cu032Au02E4,l̪ˤ,pharyngealized voiced dental lateral approximant consonant,l̪ˤ,-,-,+,-,-,-,-,-,-,-,-,-,-,-,-,-,-,-,-,-,+,-,+,+,+,-,-,-,-,-,-,-,-,-,-,-,-,-,-,-,-,-,-,-,-,+,-,-,-,-,-,-,-,-,-,-,-,-,-,-,-,-,-,-,-,-,-,-,-,-
BIPA_khw_u03C7u02B7,χʷ,labialized voiceless uvular fricative consonant,χʷ,-,-,-,-,-,-,-,-,-,-,-,-,-,-,-,-,-,-,-,-,-,-,-,-,+,+,-,+,-,-,-,-,-,-,-,+,-,-,-,-,-,-,-,-,-,-,-,-,-,-,-,-,-,-,-,-,-,-,-,-,-,-,-,-,-,-,+,-,-,-
BIPA_m_u006Du0325,m̥,devoiced voiced bilabial nasal consonant,m̥,-,-,-,-,-,-,-,-,-,-,+,-,-,-,-,-,-,-,-,-,-,-,-,-,+,-,-,-,-,-,-,-,-,-,-,+,-,-,-,-,-,-,-,-,-,-,-,-,-,-,-,-,-,-,-,-,+,-,-,-,-,-,-,-,-,-,-,-,-,-
BIPA_tl_u0074u026Cu02BC,tɬʼ,voiceless alveolar ejective lateral affricate consonant,tɬʼ,-,-,-,-,-,-,-,-,-,-,-,+,-,-,-,-,-,-,-,-,+,-,-,-,-,-,-,-,-,-,-,-,-,-,-,-,-,-,-,-,-,-,-,-,-,-,-,-,-,-,-,-,-,-,-,-,-,-,-,-,-,+,-,-,+,-,-,-,-,-
BIPA_d_u0256u0324,ɖ̤,breathy voiced retroflex stop consonant,ɖʱ,-,-,-,-,-,-,-,-,-,-,-,-,-,-,-,-,-,-,-,-,-,-,-,+,+,-,-,-,-,-,-,-,-,-,-,-,-,-,-,-,-,-,-,-,+,-,-,+,-,-,-,-,-,-,-,-,-,+,-,-,-,-,-,-,-,-,-,-,-,-
BIPA_nmtp_u006Eu0320u006Du0074u0320u0070,n̠mt̠p,from retracted pre-nasalized voiceless alveolar stop to voiceless bilabial stop cluster,ⁿt̠p,-,-,-,-,-,-,-,-,-,-,-,-,+,-,-,-,-,-,-,-,-,-,-,-,+,-,-,-,-,-,-,-,-,-,-,+,-,-,-,-,-,-,-,-,-,-,-,-,-,-,-,-,-,-,-,-,+,+,-,-,-,-,-,-,-,-,-,+,-,-
